"Reversed left context";"Reversed center";"Left context";"Center";"Punct";"Right context";"Title";"Author";"Birthday";"Header";"Created";"Sphere";"Type";"Topic";"Publication";"Publ_year";"Medium";"Ambiguity";"Audience_age";"Sentences";"Words";"Full context";"Example source"
" ― еичорП ,сач йыньлетивтсйед лыб нидо ьшил";"еынделб";"лишь один был действительный час, Прочие ―";"бледные";" ";"списки!   11 августа 1895";"В. Я. Брюсов. «Знаешь, Миньона, один только раз…» (11.08.1895)";"В. Я. Брюсов";"1873";"«Знаешь, Миньона, один только раз…»";"11.08.1895";"художественная";"";"";"";"";"книга";"омонимия не снята";"";"11";"96";"Час лишь один был действительный час, Прочие ― бледные списки!   11 августа 1895";"9dd537b1a4065847f14a9d9c3d75a2f0:10:7"
" ьсев ,ажорд ,ьсюлмоТ ;дусос йытипыв как";"недолох";"как выпитый сосуд; Томлюсь, дрожа, весь";"холоден";", ";"ликуя, Огни страстей лишь вспыхнут, как";"В. Я. Брюсов. Встреча после разлуки  («Забытая, былая обстановка…») (16.08.1895)";"В. Я. Брюсов";"1873";"Встреча после разлуки  («Забытая, былая обстановка…»)";"16.08.1895";"художественная";"";"";"";"";"книга";"омонимия не снята";"";"21";"217";"А в жизни я ― как выпитый сосуд; Томлюсь, дрожа, весь холоден, ликуя, Огни страстей лишь вспыхнут, как умрут.";"79a3966bbeb8763a4cbf66109b9d2868:17:10"
" езир в мобен яславобюЛ ,йобот с";"йобулог";"с тобой, Любовался небом в ризе";"голубой";".  ";"";"В. Я. Брюсов. «Полно, не во сне ли видел я вчера…» (17.08.1895)";"В. Я. Брюсов";"1873";"«Полно, не во сне ли видел я вчера…»";"17.08.1895";"художественная";"";"";"";"";"книга";"омонимия не снята";"";"";"54";"Полно, не во сне ли я бродил с тобой, Любовался небом в ризе голубой.";"19c7bbca5415f2f14ebc658d20179132:1:13"
" есв ,охит есв ,кат отсорп есВ";"онмет";"Все просто так, все тихо, все";"темно";", ― ";"И квакают на озере лягушки.  17 августа 1895";"В. Я. Брюсов. «Торжественно-больное беспокойство…» (17.08.1895)";"В. Я. Брюсов";"1873";"«Торжественно-больное беспокойство…»";"17.08.1895";"художественная";"";"";"";"";"книга";"омонимия не снята";"";"14";"130";"Все просто так, все тихо, все темно, ― И квакают на озере лягушки.  17 августа 1895";"1d3443751b148c53e43ee70e43a29e2c:13:6"
" ";"ЕЫЛЕБ";"";"БЕЛЫЕ";" ";"КЛАВИШИ";"В. Я. Брюсов. Белые клавиши  («Белые клавиши в сердце моем…») (21.08.1895)";"В. Я. Брюсов";"1873";"Белые клавиши  («Белые клавиши в сердце моем…»)";"21.08.1895";"художественная";"";"";"";"";"книга";"омонимия не снята";"";"24";"217";"БЕЛЫЕ КЛАВИШИ";"f4a6b6b46816956db0419aac9cd02b4a:0:0"
"";"еылеБ";"";"Белые";" ";"клавиши в сердце моем Робко стонали";"В. Я. Брюсов. Белые клавиши  («Белые клавиши в сердце моем…») (21.08.1895)";"В. Я. Брюсов";"1873";"Белые клавиши  («Белые клавиши в сердце моем…»)";"21.08.1895";"художественная";"";"";"";"";"книга";"омонимия не снята";"";"24";"217";"Белые клавиши в сердце моем Робко стонали под грубыми пальцами, Думы скитались в просторе пустом, Память безмолвно раскрыла альбом, Тяжкий альбом, где вседневно страдальцами Пишутся строфы о счастьи былом…";"f4a6b6b46816956db0419aac9cd02b4a:1:0"
" В";"юунмет";"В";"темную";" ";"залу вхожу, одинок, Путник безвременный, гость";"В. Я. Брюсов. Белые клавиши  («Белые клавиши в сердце моем…») (21.08.1895)";"В. Я. Брюсов";"1873";"Белые клавиши  («Белые клавиши в сердце моем…»)";"21.08.1895";"художественная";"";"";"";"";"книга";"омонимия не снята";"";"24";"217";"В темную залу вхожу, одинок, Путник безвременный, гость неожиданный.";"f4a6b6b46816956db0419aac9cd02b4a:4:1"
" зеб оцил ,ондобовс илапу ысоК ,натс";"нямур";"стан, Косы упали свободно, лицо без";"румян";".  ";"";"В. Я. Брюсов. Белые клавиши  («Белые клавиши в сердце моем…») (21.08.1895)";"В. Я. Брюсов";"1873";"Белые клавиши  («Белые клавиши в сердце моем…»)";"21.08.1895";"художественная";"";"";"";"";"книга";"омонимия не снята";"";"24";"217";"Вид необычный и призрак невиданный: Слабым корсетом не стянут испорченный стан, Косы упали свободно, лицо без румян.";"f4a6b6b46816956db0419aac9cd02b4a:6:16"
"";"еылеБ";"";"Белые";" ";"клавиши в сердце моем Стонут и";"В. Я. Брюсов. Белые клавиши  («Белые клавиши в сердце моем…») (21.08.1895)";"В. Я. Брюсов";"1873";"Белые клавиши  («Белые клавиши в сердце моем…»)";"21.08.1895";"художественная";"";"";"";"";"книга";"омонимия не снята";"";"24";"217";"Белые клавиши в сердце моем Стонут и плачут, живут под ударами, Думы встают и кричат о былом, Память дрожит, уронивши альбом, Тяжкий альбом, переполненный старыми Снами, мечтами о счастьи святом!";"f4a6b6b46816956db0419aac9cd02b4a:13:0"
" И";"ынчармус";"И";"сумрачны";" ";"дали вечерней зари, И в думах";"В. Я. Брюсов. «Иду но бульвару. В померкшей листве…» (01.09.1895)";"В. Я. Брюсов";"1873";"«Иду но бульвару. В померкшей листве…»";"01.09.1895";"художественная";"";"";"";"";"книга";"омонимия не снята";"";"8";"129";"И сумрачны дали вечерней зари, И в думах туманен закат.";"b5092267d37fc0f935746f1c20d3793d:2:1"
" доп ьдург алажорД ,йонтсартсодалс йоговерт розв";"мынреч";"взор тревогой сладострастной, Дрожала грудь под";"черным";" ";"домино,";"В. Я. Брюсов. Сонет к мечте  («Ни умолять, ни плакать неспособный…») (04.09.1895-06.09.1895)";"В. Я. Брюсов";"1873";"Сонет к мечте  («Ни умолять, ни плакать неспособный…»)";"04.09.1895-06.09.1895";"художественная";"";"";"";"";"книга";"омонимия не снята";"";"9";"76";"Властительно слова звучали, но Томился взор тревогой сладострастной, Дрожала грудь под черным домино,";"d2df407d16f9b21cb8dfe103015a05bd:7:11"
" унгетссар я И ,икзалг ястюоркирп овилдытс";"еыбулог";"стыдливо прикроются глазки, И я расстегну";"голубые";" ";"подвязки, И мы, не смущенные, руки";"В. Я. Брюсов. Измена  («Сегодня! сегодня! как странно! как странно!..») (14.09.1895)";"В. Я. Брюсов";"1873";"Измена  («Сегодня! сегодня! как странно! как странно!..»)";"14.09.1895";"художественная";"";"";"";"";"книга";"омонимия не снята";"";"20";"113";"Притворно стыдливо прикроются глазки, И я расстегну голубые подвязки, И мы, не смущенные, руки сплетем!";"5dc4a78cdf2db0c00aa9e6f1205980cd:10:7"
" и йымюргУ« :розв йыннелпутоп йом тенкьлем";"йылксут";"мелькнет мой потупленный взор: «Угрюмый и";"тусклый";"» ";"огонь сладострастья!   14 сентября 1895";"В. Я. Брюсов. Измена  («Сегодня! сегодня! как странно! как странно!..») (14.09.1895)";"В. Я. Брюсов";"1873";"Измена  («Сегодня! сегодня! как странно! как странно!..»)";"14.09.1895";"художественная";"";"";"";"";"книга";"омонимия не снята";"";"20";"113";"Сквозь дождь, сквозь ненастье, Пойду, побегу, как безумец, как вор, И в лужах мелькнет мой потупленный взор: «Угрюмый и тусклый» огонь сладострастья!   14 сентября 1895";"5dc4a78cdf2db0c00aa9e6f1205980cd:19:19"
" ан инет еынтсартсодалС";"йонмет";"Сладострастные тени на";"темной";" ";"постели окружили, легли, притаились, манят, Наклоняются";"В. Я. Брюсов. Тени  («Сладострастные тени на темной постели окружили, легли, притаились, манят…») (19.09.1895)";"В. Я. Брюсов";"1873";"Тени  («Сладострастные тени на темной постели окружили, легли, притаились, манят…»)";"19.09.1895";"художественная";"";"";"";"";"книга";"омонимия не снята";"";"9";"134";"Сладострастные тени на темной постели окружили, легли, притаились, манят, Наклоняются груди, сгибаются спины, веет жгучий, тягучий, глухой аромат.";"48622b43c736f67d8448caad529f9bd8:1:3"
" в алет теавилс и ерхив в";"йынтевцонзар";"в вихре и сливает тела в";"разноцветный";" ";"хаос.";"В. Я. Брюсов. Тени  («Сладострастные тени на темной постели окружили, легли, притаились, манят…») (19.09.1895)";"В. Я. Брюсов";"1873";"Тени  («Сладострастные тени на темной постели окружили, легли, притаились, манят…»)";"19.09.1895";"художественная";"";"";"";"";"книга";"омонимия не снята";"";"9";"134";"А дымящее пламя взвивается в вихре и сливает тела в разноцветный хаос.";"48622b43c736f67d8448caad529f9bd8:3:10"
"-оннартс ,еьромзв монненепсв ан орту еокелад";"еыла";"далекое утро на вспененном взморье, странно-";"алые";" ";"краски стыдливой зари!";"В. Я. Брюсов. Тени  («Сладострастные тени на темной постели окружили, легли, притаились, манят…») (19.09.1895)";"В. Я. Брюсов";"1873";"Тени  («Сладострастные тени на темной постели окружили, легли, притаились, манят…»)";"19.09.1895";"художественная";"";"";"";"";"книга";"омонимия не снята";"";"9";"134";"О, далекое утро на вспененном взморье, странно-алые краски стыдливой зари!";"48622b43c736f67d8448caad529f9bd8:4:7"
" в ытчем теавилс и ерхив в";"йынтевцонзар";"в вихре и сливает мечты в";"разноцветный";" ";"хаос.  19 сентября 1895";"В. Я. Брюсов. Тени  («Сладострастные тени на темной постели окружили, легли, притаились, манят…») (19.09.1895)";"В. Я. Брюсов";"1873";"Тени  («Сладострастные тени на темной постели окружили, легли, притаились, манят…»)";"19.09.1895";"художественная";"";"";"";"";"книга";"омонимия не снята";"";"9";"134";"А дымящее пламя взвивается в вихре и сливает мечты в разноцветный хаос.  19 сентября 1895";"48622b43c736f67d8448caad529f9bd8:8:10"
" йоннамут елгм в илакьлемаЗ оннартс кат";"ортсеП";"так странно Замелькали в мгле туманной";"Пестро";" ";"крашенные вьюки, Поезд шумный и нежданный.";"В. Я. Брюсов. «В глуби пустыни, в безвестном оазе…» (26.09.1895)";"В. Я. Брюсов";"1873";"«В глуби пустыни, в безвестном оазе…»";"26.09.1895";"художественная";"";"";"";"";"книга";"омонимия не снята";"";"12";"190";"И так чуждо, и так странно Замелькали в мгле туманной Пестро крашенные вьюки, Поезд шумный и нежданный.";"6e719bb873d9387bcd058930c5f01c02:9:10"
" тО екселб монярберес в дорог ьсеВ";"онделб";"Весь город в серебряном блеске От";"бледно";"-";"серебряных крыш, ― А там, на ее";"В. Я. Брюсов. Летучая мышь  («Весь город в серебряном блеске…») (27.09.1895)";"В. Я. Брюсов";"1873";"Летучая мышь  («Весь город в серебряном блеске…»)";"27.09.1895";"художественная";"";"";"";"";"книга";"омонимия не снята";"";"13";"125";"Весь город в серебряном блеске От бледно-серебряных крыш, ― А там, на ее занавеске, Повисла Летучая Мышь.";"0c85055e2734c630d8a42f695b4699d7:1:6"
" тО екселб монярберес в дорог ьсеВ";"онделб";"Весь город в серебряном блеске От";"бледно";"-";"серебряных крыш, А там у нее";"В. Я. Брюсов. Летучая мышь  («Весь город в серебряном блеске…») (27.09.1895)";"В. Я. Брюсов";"1873";"Летучая мышь  («Весь город в серебряном блеске…»)";"27.09.1895";"художественная";"";"";"";"";"книга";"омонимия не снята";"";"13";"125";"Весь город в серебряном блеске От бледно-серебряных крыш, А там у нее ― к занавеске Приникла Летучая Мышь.";"0c85055e2734c630d8a42f695b4699d7:6:6"
" ан моциЛ";"йодес";"Лицом на";"седой";" ";"подоконник, На камень холодный упав, Я";"В. Я. Брюсов. Летучая мышь  («Весь город в серебряном блеске…») (27.09.1895)";"В. Я. Брюсов";"1873";"Летучая мышь  («Весь город в серебряном блеске…»)";"27.09.1895";"художественная";"";"";"";"";"книга";"омонимия не снята";"";"13";"125";"Лицом на седой подоконник, На камень холодный упав, Я вновь ― твой поэт и поклонник, Царица позорных забав!";"0c85055e2734c630d8a42f695b4699d7:11:2"
" ьнемак аН ,киннокодоп йодес ан моциЛ";"йындолох";"Лицом на седой подоконник, На камень";"холодный";" ";"упав, Я вновь ― твой поэт и";"В. Я. Брюсов. Летучая мышь  («Весь город в серебряном блеске…») (27.09.1895)";"В. Я. Брюсов";"1873";"Летучая мышь  («Весь город в серебряном блеске…»)";"27.09.1895";"художественная";"";"";"";"";"книга";"омонимия не снята";"";"13";"125";"Лицом на седой подоконник, На камень холодный упав, Я вновь ― твой поэт и поклонник, Царица позорных забав!";"0c85055e2734c630d8a42f695b4699d7:11:6"
" тО екселб монярберес в дорог ьсеВ";"онделб";"Весь город в серебряном блеске От";"бледно";"-";"серебряных крыш, А там ― у нее";"В. Я. Брюсов. Летучая мышь  («Весь город в серебряном блеске…») (27.09.1895)";"В. Я. Брюсов";"1873";"Летучая мышь  («Весь город в серебряном блеске…»)";"27.09.1895";"художественная";"";"";"";"";"книга";"омонимия не снята";"";"13";"125";"Весь город в серебряном блеске От бледно-серебряных крыш, А там ― у нее, с занавески, ― Хохочет Летучая Мышь!   27 сентября 1895";"0c85055e2734c630d8a42f695b4699d7:12:6"
" ,ынищнеж ирТ";"еынзярг";"Три женщины,";"грязные";", ";"пьяные, Обнявшись, идут и шатаются.";"В. Я. Брюсов. Подруги  («Три женщины, грязные, пьяные…») (27.09.1895)";"В. Я. Брюсов";"1873";"Подруги  («Три женщины, грязные, пьяные…»)";"27.09.1895";"художественная";"";"";"";"";"книга";"омонимия не снята";"";"6";"45";"Три женщины, грязные, пьяные, Обнявшись, идут и шатаются.";"24dc50755058de0e87ec451ab98b5c1a:1:2"
" ,ино тудИ";"еынзярг";"Идут они,";"грязные";", ";"пьяные, Поют свои песни, ругаются…";"В. Я. Брюсов. Подруги  («Три женщины, грязные, пьяные…») (27.09.1895)";"В. Я. Брюсов";"1873";"Подруги  («Три женщины, грязные, пьяные…»)";"27.09.1895";"художественная";"";"";"";"";"книга";"омонимия не снята";"";"6";"45";"Идут они, грязные, пьяные, Поют свои песни, ругаются…";"24dc50755058de0e87ec451ab98b5c1a:4:2"
" ан яьтсил еищажорД ";"еынделб";"Дрожащие листья на";"бледные";" ";"щеки Изменчиво клали минутные тени, И";"В. Я. Брюсов. «Дрожащие листья на бледные щеки…» (01.10.1895)";"В. Я. Брюсов";"1873";"«Дрожащие листья на бледные щеки…»";"01.10.1895";"художественная";"";"";"";"";"книга";"омонимия не снята";"";"4";"64";"Дрожащие листья на бледные щеки Изменчиво клали минутные тени, И, чуть шелестя, заглушали упреки.";"06e497d1b788d8c0e8cfa8402e901bf3:0:3"
" как ,яьтсил еищажорД";"еынмет";"Дрожащие листья, как";"темные";" ";"пятна, Мелькали, скользили по звездному фону";"В. Я. Брюсов. «Дрожащие листья на бледные щеки…» (01.10.1895)";"В. Я. Брюсов";"1873";"«Дрожащие листья на бледные щеки…»";"01.10.1895";"художественная";"";"";"";"";"книга";"омонимия не снята";"";"4";"64";"Дрожащие листья, как темные пятна, Мелькали, скользили по звездному фону, И ты и они ― вы шептали невнятно.";"06e497d1b788d8c0e8cfa8402e901bf3:1:3"
" каК ,ыроку илачувз ,тселеш йынневтсил каК";"еынделб";"Как лиственный шелест, звучали укоры, Как";"бледные";" ";"звезды, за дымкою листьев, Смотрели, сквозь";"В. Я. Брюсов. «Дрожащие листья на бледные щеки…» (01.10.1895)";"В. Я. Брюсов";"1873";"«Дрожащие листья на бледные щеки…»";"01.10.1895";"художественная";"";"";"";"";"книга";"омонимия не снята";"";"4";"64";"Как лиственный шелест, звучали укоры, Как бледные звезды, за дымкою листьев, Смотрели, сквозь слезы, печальные взоры,";"06e497d1b788d8c0e8cfa8402e901bf3:2:6"
" ан ьсилижол инет И";"еынделб";"И тени ложились на";"бледные";" ";"щеки, И тени скользили, дрожали минутно";"В. Я. Брюсов. «Дрожащие листья на бледные щеки…» (01.10.1895)";"В. Я. Брюсов";"1873";"«Дрожащие листья на бледные щеки…»";"01.10.1895";"художественная";"";"";"";"";"книга";"омонимия не снята";"";"4";"64";"И тени ложились на бледные щеки, И тени скользили, дрожали минутно, И чуть долетали из дали упреки.  1 октября 1895";"06e497d1b788d8c0e8cfa8402e901bf3:3:4"
" илыб ынщиводуч-оннартС ,енолксобен момен ан";"еындолох";"на немом небосклоне, Странно-чудовищны были";"холодные";" ";"глуби дороги, Изредка ты воскресал на";"В. Я. Брюсов. А. М. Добролюбову  («Смутно куритесь, туманы былого!..») (04.10.1895)";"В. Я. Брюсов";"1873";"А. М. Добролюбову  («Смутно куритесь, туманы былого!..»)";"04.10.1895";"художественная";"";"";"";"";"книга";"омонимия не снята";"";"8";"93";"Блеск умирал на немом небосклоне, Странно-чудовищны были холодные глуби дороги, Изредка ты воскресал на сбегающем склоне, Но все чаще грозили утесов сухие отроги, И забывалося эхо гармоний.";"786e6e1d823c1a9e5e523e8b8bf0dda6:4:8"
" и ,нежротсов-онтсартссеб и ,лункьлем енм";"летевс";"мне мелькнул, и бесстрастно-восторжен, и";"светел";"…  ";"";"В. Я. Брюсов. А. М. Добролюбову  («Смутно куритесь, туманы былого!..») (04.10.1895)";"В. Я. Брюсов";"1873";"А. М. Добролюбову  («Смутно куритесь, туманы былого!..»)";"04.10.1895";"художественная";"";"";"";"";"книга";"омонимия не снята";"";"8";"93";"Небо раскинулось вдруг недосказанным храмом, Это ты мне мелькнул, и бесстрастно-восторжен, и светел…";"786e6e1d823c1a9e5e523e8b8bf0dda6:6:13"
" гуркв ценев теяиС";"йондолох";"Сияет венец вкруг";"холодной";" ";"луны.";"В. Я. Брюсов. В камышах  («Луна в облаках — далека, хороша…») (22.10.1895-23.10.1895)";"В. Я. Брюсов";"1873";"В камышах  («Луна в облаках — далека, хороша…»)";"22.10.1895-23.10.1895";"художественная";"";"";"";"";"книга";"омонимия не снята";"";"10";"43";"Задумчиво кто-то сидит в челноке. Сияет венец вкруг холодной луны.";"533fe00f1a984db752c2ef50deb89071:5:3"
