"Reversed left context";"Reversed center";"Left context";"Center";"Punct";"Right context";"Title";"Author";"Birthday";"Header";"Created";"Sphere";"Type";"Topic";"Publication";"Publ_year";"Medium";"Ambiguity";"Audience_age";"Sentences";"Words";"Full context";"Example source"
" ― йелмез дан тееР ацинерев вохуд хынделБ";"йынреЧ";"Бледных духов вереница Реет над землей ―";"Черный";" ";"лес луной пронизан, Мертвою луной.";"В. Я. Брюсов. «Черный лес луной пронизан…» (15.10.1896)";"В. Я. Брюсов";"1873";"«Черный лес луной пронизан…»";"15.10.1896";"художественная";"";"";"";"";"книга";"омонимия не снята";"";"";"41";"Бледных духов вереница Реет над землей ― Черный лес луной пронизан, Мертвою луной.";"2bfa31348afac0e3fb56158a92f83362:1:6"
" ,я от-адгок лиЖ котев ерим моннартс";"йынреЧ";"странном мире веток Жил когда-то я,";"Черный";" ";"лес пронизан светом, Светом бытия.  15 октября 1896";"В. Я. Брюсов. «Черный лес луной пронизан…» (15.10.1896)";"В. Я. Брюсов";"1873";"«Черный лес луной пронизан…»";"15.10.1896";"художественная";"";"";"";"";"книга";"омонимия не снята";"";"";"41";"В этом странном мире веток Жил когда-то я, Черный лес пронизан светом, Светом бытия.  15 октября 1896";"2bfa31348afac0e3fb56158a92f83362:2:8"
" как ,тядохсов убен К яьнедив еытявс";"йылеб";"святые виденья К небу восходят, как";"белый";" ";"туман; Сны мои черны, ― и снова";"В. Я. Брюсов. «В час, когда гений вечерней прохлады…» (1897)";"В. Я. Брюсов";"1873";"«В час, когда гений вечерней прохлады…»";"1897";"художественная";"";"";"";"";"книга";"омонимия не снята";"";"";"58";"В жуткой тревоге святые виденья К небу восходят, как белый туман; Сны мои черны, ― и снова я пьян Мутным вином искушенья.1897";"7216f367e18f282b35cb232dda9f96a0:2:9"
" иом ынС ;намут йылеб как ,тядохсов";"ынреч";"восходят, как белый туман; Сны мои";"черны";", ― ";"и снова я пьян Мутным вином";"В. Я. Брюсов. «В час, когда гений вечерней прохлады…» (1897)";"В. Я. Брюсов";"1873";"«В час, когда гений вечерней прохлады…»";"1897";"художественная";"";"";"";"";"книга";"омонимия не снята";"";"";"58";"В жуткой тревоге святые виденья К небу восходят, как белый туман; Сны мои черны, ― и снова я пьян Мутным вином искушенья.1897";"7216f367e18f282b35cb232dda9f96a0:2:13"
" няьп я авонс и ― ,ынреч иом";"мынтуМ";"мои черны, ― и снова я пьян";"Мутным";" ";"вином искушенья.1897";"В. Я. Брюсов. «В час, когда гений вечерней прохлады…» (1897)";"В. Я. Брюсов";"1873";"«В час, когда гений вечерней прохлады…»";"1897";"художественная";"";"";"";"";"книга";"омонимия не снята";"";"";"58";"В жуткой тревоге святые виденья К небу восходят, как белый туман; Сны мои черны, ― и снова я пьян Мутным вином искушенья.1897";"7216f367e18f282b35cb232dda9f96a0:2:18"
" онволС";"еылкелбоп";"Словно";"поблеклые";" ";"листья под дерзкой ласкою ветра, Робко";"В. Я. Брюсов. «Муза в измятом венке, богиня, забытая миром!..» [Вступление к поэме «Атлантида», 1] (1897)";"В. Я. Брюсов";"1873";"«Муза в измятом венке, богиня, забытая миром!..»";"1897";"художественная";"";"";"";"";"книга";"омонимия не снята";"";"9";"110";"Словно поблеклые листья под дерзкой ласкою ветра, Робко трепещут слова в дыхании древнего метра, Словно путницы-сестры, уставши на долгой дороге, Рифма склоняется к рифме в стыдливо смутной тревоге, Что-то странное дышит в звуках античных гармоний ― Это месяц зажегся на бледно-ночном небосклоне.";"12b1e8f64e2bfb7365c3593a9e8cfba8:4:1"
" ан ясгежаз цясем отЭ ― йиномраг хынчитна";"онделб";"античных гармоний ― Это месяц зажегся на";"бледно";"-";"ночном небосклоне.";"В. Я. Брюсов. «Муза в измятом венке, богиня, забытая миром!..» [Вступление к поэме «Атлантида», 1] (1897)";"В. Я. Брюсов";"1873";"«Муза в измятом венке, богиня, забытая миром!..»";"1897";"художественная";"";"";"";"";"книга";"омонимия не снята";"";"9";"110";"Словно поблеклые листья под дерзкой ласкою ветра, Робко трепещут слова в дыхании древнего метра, Словно путницы-сестры, уставши на долгой дороге, Рифма склоняется к рифме в стыдливо смутной тревоге, Что-то странное дышит в звуках античных гармоний ― Это месяц зажегся на бледно-ночном небосклоне.";"12b1e8f64e2bfb7365c3593a9e8cfba8:4:40"
" оН";"йонйокопс";"Но";"спокойной";" ";"улыбкой встречаю Рассвет восходящего дня.";"В. Я. Брюсов. К прошлому  («Для кого я пишу? — не знаю…») (23.01.1897)";"В. Я. Брюсов";"1873";"К прошлому  («Для кого я пишу? — не знаю…»)";"23.01.1897";"художественная";"";"";"";"";"книга";"омонимия не снята";"";"7";"53";"Но спокойной улыбкой встречаю Рассвет восходящего дня.";"b7cd78d62b97e105af909c51c9abb1d4:3:1"
" И ,монотс микжят с ихуд тядохУ";"йылеб";"Уходят духи с тяжким стоном, И";"белый";" ";"день плывет вокруг, И воздух полон";"В. Я. Брюсов. «В последний раз пропел петух…» (07.02.1897)";"В. Я. Брюсов";"1873";"«В последний раз пропел петух…»";"07.02.1897";"художественная";"";"";"";"";"книга";"омонимия не снята";"";"6";"65";"В последний раз пропел петух, Уходят духи с тяжким стоном, И белый день плывет вокруг, И воздух полон ранним звоном.";"f8b03156118a60a5d8497ddf93f6aaa2:2:11"
" доп акрик яаратС ,акер ,елоп ,икимоД";"мынреч";"Домики, поле, река, Старая кирка под";"черным";" ";"навесом.";"В. Я. Брюсов. «Поезд врывается в древние скалы…» (31.05.1897)";"В. Я. Брюсов";"1873";"«Поезд врывается в древние скалы…»";"31.05.1897";"художественная";"";"";"";"";"книга";"омонимия не снята";"";"8";"48";"Склоны, покрытые лесом, Домики, поле, река, Старая кирка под черным навесом.";"2ccb1f570cdd9ab56a64749f8452bb87:3:9"
" ,сету ан лешос комаЗ ,ырог ястюагивдан";"еынреЧ";"надвигаются горы, Замок сошел на утес,";"Черные";" ";"сосны, расщелин узоры…";"В. Я. Брюсов. «Поезд врывается в древние скалы…» (31.05.1897)";"В. Я. Брюсов";"1873";"«Поезд врывается в древние скалы…»";"31.05.1897";"художественная";"";"";"";"";"книга";"омонимия не снята";"";"8";"48";"Опять надвигаются горы, Замок сошел на утес, Черные сосны, расщелин узоры…";"2ccb1f570cdd9ab56a64749f8452bb87:6:7"
" йовс В ,хынневонзред ,сан и ыт";"йылтевс";"ты и нас, дерзновенных, В свой";"светлый";" ";"день!   25 июня 1897";"В. Я. Брюсов. В день святой Агаты  («Имя твое непорочно и свято…») (25.06.1897)";"В. Я. Брюсов";"1873";"В день святой Агаты  («Имя твое непорочно и свято…»)";"25.06.1897";"художественная";"";"";"";"";"книга";"омонимия не снята";"";"7";"55";"свет любви перед взором блаженных Горит сквозь тень: Верю, ― простишь ты и нас, дерзновенных, В свой светлый день!   25 июня 1897";"f97257382dea6f496dc12b5bb4a46a8c:6:16"
" В";"молтевс";"В";"светлом";" ";"небе ― бесконечность: бесконечность милых глаз.";"В. Я. Брюсов. Я люблю ...  («Я люблю тебя и небо, только небо и тебя…») (26.06.1897)";"В. Я. Брюсов";"1873";"Я люблю ...  («Я люблю тебя и небо, только небо и тебя…»)";"26.06.1897";"художественная";"";"";"";"";"книга";"омонимия не снята";"";"12";"96";"В светлом небе ― бесконечность: бесконечность милых глаз.";"2c205d4de0d522adf3f5cbf5208915b6:4:1"
" В";"молтевс";"В";"светлом";" ";"взоре ― беспредельность: небо, явленное в нас.";"В. Я. Брюсов. Я люблю ...  («Я люблю тебя и небо, только небо и тебя…») (26.06.1897)";"В. Я. Брюсов";"1873";"Я люблю ...  («Я люблю тебя и небо, только небо и тебя…»)";"26.06.1897";"художественная";"";"";"";"";"книга";"омонимия не снята";"";"12";"96";"В светлом взоре ― беспредельность: небо, явленное в нас.";"2c205d4de0d522adf3f5cbf5208915b6:5:1"
" инет А ― ,ман титевс ,титевс и";"еырес";"и светит, светит нам, ― А тени";"серые";" ";"легли по сторонам И чутко сторожат";"В. Я. Брюсов. Ей же <Е. И. П.>  («Огонь еще горит, и светит, светит нам…») (07.09.1897)";"В. Я. Брюсов";"1873";"Ей же <Е. И. П.>  («Огонь еще горит, и светит, светит нам…»)";"07.09.1897";"художественная";"";"";"";"";"книга";"омонимия не снята";"";"4";"56";"Огонь еще горит, и светит, светит нам, ― А тени серые легли по сторонам И чутко сторожат его невольный трепет.";"7ea74a1329e96be5f635d3ba2c828286:1:9"
" ― И ,теяис он ,теебалс ,тировог иман";"йылтевс";"нами говорит, слабеет, но сияет, И ―";"светлый";", ";"как всегда ― покорно угасает.  7 сентября 1897";"В. Я. Брюсов. Ей же <Е. И. П.>  («Огонь еще горит, и светит, светит нам…») (07.09.1897)";"В. Я. Брюсов";"1873";"Ей же <Е. И. П.>  («Огонь еще горит, и светит, светит нам…»)";"07.09.1897";"художественная";"";"";"";"";"книга";"омонимия не снята";"";"4";"56";"Он шепчет свой завет пред ликом божества, Он с нами говорит, слабеет, но сияет, И ― светлый, как всегда ― покорно угасает.  7 сентября 1897";"7ea74a1329e96be5f635d3ba2c828286:3:15"
" ьшенедан ыТ ,ьшеьбу ыт янем адгок";"еолеб";"когда меня ты убьешь, Ты наденешь";"белое";" ";"платье, И свечи у трупа зажжешь";"В. Я. Брюсов. Близкой  («И когда меня ты убьешь…») (13.10.1897)";"В. Я. Брюсов";"1873";"Близкой  («И когда меня ты убьешь…»)";"13.10.1897";"художественная";"";"";"";"";"книга";"омонимия не снята";"";"4";"56";"И когда меня ты убьешь, Ты наденешь белое платье, И свечи у трупа зажжешь, И сядешь со мной на кровати.";"a2bf09ff15ab3b7fe55ecba85b3af19d:1:7"
" иом ьтедялг И инго ясьтиемз тудуб";"еылксут";"будут змеиться огни И глядеть мои";"тусклые";" ";"очи.";"В. Я. Брюсов. Близкой  («И когда меня ты убьешь…») (13.10.1897)";"В. Я. Брюсов";"1873";"Близкой  («И когда меня ты убьешь…»)";"13.10.1897";"художественная";"";"";"";"";"книга";"омонимия не снята";"";"4";"56";"И будем с тобой мы одни Среди безмолвия ночи; Лишь будут змеиться огни И глядеть мои тусклые очи.";"a2bf09ff15ab3b7fe55ecba85b3af19d:2:16"
" иовт В ,кинечу йикбор как ,я";"еынйокопс";"я, как робкий ученик, В твои";"спокойные";", ";"обдуманные строки, Я знаю ― ты со";"В. Я. Брюсов. К портрету Лейбница  («Когда вникаю я, как робкий ученик…») (25.11.1897)";"В. Я. Брюсов";"1873";"К портрету Лейбница  («Когда вникаю я, как робкий ученик…»)";"25.11.1897";"художественная";"";"";"";"";"книга";"омонимия не снята";"";"10";"99";"Когда вникаю я, как робкий ученик, В твои спокойные, обдуманные строки, Я знаю ― ты со мной!";"d01c96ff8b1392c1bf30bb7307c071c8:1:8"
" ДЕРЕП ";"ЙОНМЕТ";"ПЕРЕД";"ТЕМНОЙ";" ";"ЗАВЕСОЙ";"В. Я. Брюсов. Перед темной завесой  («Слова теряют смысл первоначальный…») (28.11.1897-1911)";"В. Я. Брюсов";"1873";"Перед темной завесой  («Слова теряют смысл первоначальный…»)";"28.11.1897-1911";"художественная";"";"";"";"";"книга";"омонимия не снята";"";"9";"96";"ПЕРЕД ТЕМНОЙ ЗАВЕСОЙ Слова теряют смысл первоначальный, Дыханье тайны явно для души, В померкшем зеркале твои глаза печальны, Твой голос ― как струна в сочувственной тиши.";"71cf2d1b43ec332839f59ca9580b0804:0:1"
" авд ым ― ымьлап юьнес доП";"хынделб";"Под сенью пальмы ― мы два";"бледных";" ";"изваянья, И нежит мне чело волос";"В. Я. Брюсов. Перед темной завесой  («Слова теряют смысл первоначальный…») (28.11.1897-1911)";"В. Я. Брюсов";"1873";"Перед темной завесой  («Слова теряют смысл первоначальный…»)";"28.11.1897-1911";"художественная";"";"";"";"";"книга";"омонимия не снята";"";"9";"96";"Под сенью пальмы ― мы два бледных изваянья, И нежит мне чело волос приникших прядь.";"71cf2d1b43ec332839f59ca9580b0804:4:5"
" дерП ,онтумс ,ончувззеб тятелорп игим ьтсуП";"йонмет";"Пусть миги пролетят беззвучно, смутно, Пред";"темной";" ";"завесой безвестных дней.";"В. Я. Брюсов. Перед темной завесой  («Слова теряют смысл первоначальный…») (28.11.1897-1911)";"В. Я. Брюсов";"1873";"Перед темной завесой  («Слова теряют смысл первоначальный…»)";"28.11.1897-1911";"художественная";"";"";"";"";"книга";"омонимия не снята";"";"9";"96";"Пусть миги пролетят беззвучно, смутно, Пред темной завесой безвестных дней.";"71cf2d1b43ec332839f59ca9580b0804:5:6"
" И";"еорес";"И";"серое";" ";"небо, и проволок сети, Саней ускользающий";"В. Я. Брюсов. «И серое небо, и проволок сети…» [Весенняя поэма, 1] (29.11.1897)";"В. Я. Брюсов";"1873";"«И серое небо, и проволок сети…»";"29.11.1897";"художественная";"";"";"";"";"книга";"омонимия не снята";"";"5";"47";"И серое небо, и проволок сети, Саней ускользающий бег; И вдруг предо мной в электрическом свете Вуаль, словно искристый снег.";"7b2fcaf414f29c81cd21cdf6fcd6fa1c:2:1"
" ииняис В ,яанмез как ,алшорп юонм";"огокря";"мною прошла, как земная, В сиянии";"яркого";" ";"дня, И, легкой улыбкой свой взор";"В. Я. Брюсов. «Она предо мною прошла, как земная…» [Весенняя поэма, 3] (29.11.1897)";"В. Я. Брюсов";"1873";"«Она предо мною прошла, как земная…»";"29.11.1897";"художественная";"";"";"";"";"книга";"омонимия не снята";"";"4";"39";"Она предо мною прошла, как земная, В сиянии яркого дня, И, легкой улыбкой свой взор оттеняя, Взглянула она на меня.";"3733c7a9584ac1d56b3580209b3e8761:1:8"
" ,О";"еорес";"О,";"серое";" ";"небо, о, проволок сети, О, тающий";"В. Я. Брюсов. «Она предо мною прошла, как земная…» [Весенняя поэма, 3] (29.11.1897)";"В. Я. Брюсов";"1873";"«Она предо мною прошла, как земная…»";"29.11.1897";"художественная";"";"";"";"";"книга";"омонимия не снята";"";"4";"39";"О, серое небо, о, проволок сети, О, тающий, тающий снег,   29 ноября 1897";"3733c7a9584ac1d56b3580209b3e8761:3:1"
" яаннещевсО ,ацинтсел яаннилД";"окря";"Длинная лестница, Освещенная";"ярко";", ";"А за дверью во храме смутный";"В. Я. Брюсов. Аганат  («Небесная девственница…») (19.12.1897-04.10.1898)";"В. Я. Брюсов";"1873";"Аганат  («Небесная девственница…»)";"19.12.1897-04.10.1898";"художественная";"";"";"";"";"книга";"омонимия не снята";"";"107";"845";"Длинная лестница, Освещенная ярко, А за дверью во храме смутный сумрак ночной.";"df2327d340534fc71a60fb505ea9d07f:7:3"
" В ";"монмет";"В";"темном";" ";"взоре Сверканье звезд ночных, а грудь";"В. Я. Брюсов. Аганат  («Небесная девственница…») (19.12.1897-04.10.1898)";"В. Я. Брюсов";"1873";"Аганат  («Небесная девственница…»)";"19.12.1897-04.10.1898";"художественная";"";"";"";"";"книга";"омонимия не снята";"";"107";"845";"В темном взоре Сверканье звезд ночных, а грудь бледна.";"df2327d340534fc71a60fb505ea9d07f:19:1"
" ьдург а ,хынчон дзевз еьнакревС ерозв";"анделб";"взоре Сверканье звезд ночных, а грудь";"бледна";".  ";"";"В. Я. Брюсов. Аганат  («Небесная девственница…») (19.12.1897-04.10.1898)";"В. Я. Брюсов";"1873";"Аганат  («Небесная девственница…»)";"19.12.1897-04.10.1898";"художественная";"";"";"";"";"книга";"омонимия не снята";"";"107";"845";"В темном взоре Сверканье звезд ночных, а грудь бледна.";"df2327d340534fc71a60fb505ea9d07f:19:8"
" илад в ьсиламыдоп ьтуЧ";"йенис";"Чуть подымались в дали";"синей";" ";"снасти, Она спешила на берег, ждала";"В. Я. Брюсов. Аганат  («Небесная девственница…») (19.12.1897-04.10.1898)";"В. Я. Брюсов";"1873";"Аганат  («Небесная девственница…»)";"19.12.1897-04.10.1898";"художественная";"";"";"";"";"книга";"омонимия не снята";"";"107";"845";"Чуть подымались в дали синей снасти, Она спешила на берег, ждала, Встречала моряков игрой запястий,";"df2327d340534fc71a60fb505ea9d07f:22:4"
" едов в кселп йынрем лесев И";"йонелез";"И весел мерный плеск в воде";"зеленой";",  ";"";"В. Я. Брюсов. Аганат  («Небесная девственница…») (19.12.1897-04.10.1898)";"В. Я. Брюсов";"1873";"Аганат  («Небесная девственница…»)";"19.12.1897-04.10.1898";"художественная";"";"";"";"";"книга";"омонимия не снята";"";"107";"845";"И жизнь и шум на пристани Сидона В веселый час прихода кораблей: И весел мерный плеск в воде зеленой,";"df2327d340534fc71a60fb505ea9d07f:46:18"
" ьтох но ладжаж каК";"огонделб";"Как жаждал он хоть";"бледного";" ";"следа Былого!";"В. Я. Брюсов. Аганат  («Небесная девственница…») (19.12.1897-04.10.1898)";"В. Я. Брюсов";"1873";"Аганат  («Небесная девственница…»)";"19.12.1897-04.10.1898";"художественная";"";"";"";"";"книга";"омонимия не снята";"";"107";"845";"Как жаждал он хоть бледного следа Былого!";"df2327d340534fc71a60fb505ea9d07f:51:4"
" мокшилс юьворб доп розв йичугж И";"йонреч";"И жгучий взор под бровью слишком";"черной";".  ";"";"В. Я. Брюсов. Аганат  («Небесная девственница…») (19.12.1897-04.10.1898)";"В. Я. Брюсов";"1873";"Аганат  («Небесная девственница…»)";"19.12.1897-04.10.1898";"художественная";"";"";"";"";"книга";"омонимия не снята";"";"107";"845";"Он смотрит: золото, браслетов ряд, И жгучий взор под бровью слишком черной.";"df2327d340534fc71a60fb505ea9d07f:62:11"
" атратсА ,ьнигоб хесв янигоб акилев ,О";"яалтевс";"О, велика богиня всех богинь, Астарта";"светлая";"!  ";"";"В. Я. Брюсов. Аганат  («Небесная девственница…») (19.12.1897-04.10.1898)";"В. Я. Брюсов";"1873";"Аганат  («Небесная девственница…»)";"19.12.1897-04.10.1898";"художественная";"";"";"";"";"книга";"омонимия не снята";"";"107";"845";"О, велика богиня всех богинь, Астарта светлая!";"df2327d340534fc71a60fb505ea9d07f:89:6"
