"Reversed left context";"Reversed center";"Left context";"Center";"Punct";"Right context";"Title";"Author";"Birthday";"Header";"Created";"Sphere";"Type";"Topic";"Publication";"Publ_year";"Medium";"Ambiguity";"Audience_age";"Sentences";"Words";"Full context";"Example source"
"-онелез тевс йывреп И :ацердум йелов";"йыла";"волей мудреца: И первый свет зелено-";"алый";", ";"И волн встающие кристаллы, И тени";"В. Я. Брюсов. Золото  («Золото сделал я, золото…») (23.07.1899)";"В. Я. Брюсов";"1873";"Золото  («Золото сделал я, золото…»)";"23.07.1899";"художественная";"";"";"";"";"книга";"омонимия не снята";"";"16";"149";"Мир создан волей мудреца: И первый свет зелено-алый, И волн встающие кристаллы, И тени страстного лица!";"042509aae1e530f63cc7db9a9922a1d1:13:8"
" инзиж зИ";"йонделб";"Из жизни";"бледной";" ";"и случайной Я сделал трепет без";"В. Я. Брюсов. Золото  («Золото сделал я, золото…») (23.07.1899)";"В. Я. Брюсов";"1873";"Золото  («Золото сделал я, золото…»)";"23.07.1899";"художественная";"";"";"";"";"книга";"омонимия не снята";"";"16";"149";"Из жизни бледной и случайной Я сделал трепет без конца!   23 июля 1899";"042509aae1e530f63cc7db9a9922a1d1:15:2"
" ылис каК";"оголтевс";"Как силы";"светлого";" ";"и грозного огня, Как пламя, бьющее";"В. Я. Брюсов. Сонет о поэте  («Как силы светлого и грозного огня…») (02.08.1899)";"В. Я. Брюсов";"1873";"Сонет о поэте  («Как силы светлого и грозного огня…»)";"02.08.1899";"художественная";"";"";"";"";"книга";"омонимия не снята";"";"8";"106";"Как силы светлого и грозного огня, Как пламя, бьющее в холодный небосвод, И жизнь, и гибель я; мой дух всегда живет, Зачатие и смерть в себе самом храня.";"1e48ae5c19b418f0895d534cc37f66cb:1:2"
" в еещюьб ,ямалп каК ,янго огонзорг";"йындолох";"грозного огня, Как пламя, бьющее в";"холодный";" ";"небосвод, И жизнь, и гибель я";"В. Я. Брюсов. Сонет о поэте  («Как силы светлого и грозного огня…») (02.08.1899)";"В. Я. Брюсов";"1873";"Сонет о поэте  («Как силы светлого и грозного огня…»)";"02.08.1899";"художественная";"";"";"";"";"книга";"омонимия не снята";"";"8";"106";"Как силы светлого и грозного огня, Как пламя, бьющее в холодный небосвод, И жизнь, и гибель я; мой дух всегда живет, Зачатие и смерть в себе самом храня.";"1e48ae5c19b418f0895d534cc37f66cb:1:10"
" йербед зи И ,тяротваз ыловяьд окиД";"хинис";"Дико дьяволы завторят, И из дебрей";"синих";" ";"гор, Как лучи над темным морем";"В. Я. Брюсов. Брань народов  («Брань народов не утихнет…») (18.08.1899)";"В. Я. Брюсов";"1873";"Брань народов  («Брань народов не утихнет…»)";"18.08.1899";"художественная";"";"";"";"";"книга";"омонимия не снята";"";"12";"112";"Дико дьяволы завторят, И из дебрей синих гор, Как лучи над темным морем, Выйдет праведников хор.";"218680535709fcb4b3935bb924c44cc9:9:6"
" дан ичул каК ,рог хинис йербед";"мынмет";"дебрей синих гор, Как лучи над";"темным";" ";"морем, Выйдет праведников хор.";"В. Я. Брюсов. Брань народов  («Брань народов не утихнет…») (18.08.1899)";"В. Я. Брюсов";"1873";"Брань народов  («Брань народов не утихнет…»)";"18.08.1899";"художественная";"";"";"";"";"книга";"омонимия не снята";"";"12";"112";"Дико дьяволы завторят, И из дебрей синих гор, Как лучи над темным морем, Выйдет праведников хор.";"218680535709fcb4b3935bb924c44cc9:9:11"
" хыншерг ялд А";"ечря";"А для грешных";"ярче";" ";"вспыхнет В преисподней столп огня…";"В. Я. Брюсов. Брань народов  («Брань народов не утихнет…») (18.08.1899)";"В. Я. Брюсов";"1873";"Брань народов  («Брань народов не утихнет…»)";"18.08.1899";"художественная";"";"";"";"";"книга";"омонимия не снята";"";"12";"112";"А для грешных ярче вспыхнет В преисподней столп огня…";"218680535709fcb4b3935bb924c44cc9:10:3"
" мосеван доП";"йонмет";"Под навесом";"темной";" ";"ели, На ковре из мягкой хвои";"В. Я. Брюсов. За пределами сказок  («Под навесом темной ели…») (29.08.1899)";"В. Я. Брюсов";"1873";"За пределами сказок  («Под навесом темной ели…»)";"29.08.1899";"художественная";"";"";"";"";"книга";"омонимия не снята";"";"4";"54";"Под навесом темной ели, На ковре из мягкой хвои, Оба друга рядом сели ― И теперь их в мире двое.";"4c433fbb31c3d8bd8ca5bdd9f99ebbfe:1:2"
" солоГ ,еновз монтелереп в онся кат";"йытсирберес";"так ясно в перелетном звоне, Голос";"серебристый";" ";"мне звучал предтечей Прежде недоступных сладостных";"В. Я. Брюсов. К металлам  («Золото, убранство тайного ковчега…») (29.08.1899)";"В. Я. Брюсов";"1873";"К металлам  («Золото, убранство тайного ковчега…»)";"29.08.1899";"художественная";"";"";"";"";"книга";"омонимия не снята";"";"10";"112";"Серебро сияет тихо на иконе, Мученице юной покрывает плечи, Серебро так ясно в перелетном звоне, Голос серебристый мне звучал предтечей Прежде недоступных сладостных гармоний.";"0b35d70ea671fff01b7cabdba26feaf5:2:16"
" :узнорб я юлбюл И";"еынчармус";"И люблю я бронзу:";"сумрачные";" ";"тени Томной баядерки в роскоши вечерней.";"В. Я. Брюсов. К металлам  («Золото, убранство тайного ковчега…») (29.08.1899)";"В. Я. Брюсов";"1873";"К металлам  («Золото, убранство тайного ковчега…»)";"29.08.1899";"художественная";"";"";"";"";"книга";"омонимия не снята";"";"10";"112";"И люблю я бронзу: сумрачные тени Томной баядерки в роскоши вечерней.";"0b35d70ea671fff01b7cabdba26feaf5:3:4"
" ан ытсич кат икселбтО ,инел йокгел";"йондолох";"легкой лени, Отблески так чисты на";"холодной";" ";"черни!";"В. Я. Брюсов. К металлам  («Золото, убранство тайного ковчега…») (29.08.1899)";"В. Я. Брюсов";"1873";"К металлам  («Золото, убранство тайного ковчега…»)";"29.08.1899";"художественная";"";"";"";"";"книга";"омонимия не снята";"";"10";"112";"В твердости изгибов столько легкой лени, Отблески так чисты на холодной черни!";"0b35d70ea671fff01b7cabdba26feaf5:4:10"
" к ,йывинвер ,луньлирп Я ,илакревсаз ортсыб";"мылеб";"быстро засверкали, Я прильнул, ревнивый, к";"белым";" ";"занавескам…";"В. Я. Брюсов. К металлам  («Золото, убранство тайного ковчега…») (29.08.1899)";"В. Я. Брюсов";"1873";"К металлам  («Золото, убранство тайного ковчега…»)";"29.08.1899";"художественная";"";"";"";"";"книга";"омонимия не снята";"";"10";"112";"Змеи резких молний быстро засверкали, Я прильнул, ревнивый, к белым занавескам…";"0b35d70ea671fff01b7cabdba26feaf5:8:9"
" хажыл ан ьтатемзВ ,егенс в ясьтавиксиод";"йылеб";"доискиваться в снеге, Взметать на лыжах";"белый";" ";"прах.";"В. Я. Брюсов. «А сколько радости и неги…» (23.09.1899)";"В. Я. Брюсов";"1873";"«А сколько радости и неги…»";"23.09.1899";"художественная";"";"";"";"";"книга";"омонимия не снята";"";"5";"67";"Следов доискиваться в снеге, Взметать на лыжах белый прах.";"69c8727488afe3ff43d7668a498f68cf:1:7"
" йешырк доп ьтаворип И";"йонженс";"И пировать под крышей";"снежной";", ";"И охранять под снегом челн, И";"В. Я. Брюсов. «А сколько радости и неги…» (23.09.1899)";"В. Я. Брюсов";"1873";"«А сколько радости и неги…»";"23.09.1899";"художественная";"";"";"";"";"книга";"омонимия не снята";"";"5";"67";"И пировать под крышей снежной, И охранять под снегом челн, И ждать, что океан безбрежный Опять раскинет гребни волн.  23 сентября 1899";"69c8727488afe3ff43d7668a498f68cf:4:4"
" онжун ен енМ";"огокря";"Мне не нужно";"яркого";" ";"блеска, Красоты и величья небес.";"В. Я. Брюсов. «Когда опускается штора…» (03.10.1899)";"В. Я. Брюсов";"1873";"«Когда опускается штора…»";"03.10.1899";"художественная";"";"";"";"";"книга";"омонимия не снята";"";"7";"49";"Мне не нужно яркого блеска, Красоты и величья небес.";"bdcf38ebc20084b533e65cd6d3477430:1:3"
" обен И ,инго еывреп и ,тевс";"еонделб";"свет, и первые огни, И небо";"бледное";", ";"где звезд еще не видно.";"В. Я. Брюсов. «Люблю вечерний свет, и первые огни…» (04.10.1899-05.10.1899)";"В. Я. Брюсов";"1873";"«Люблю вечерний свет, и первые огни…»";"04.10.1899-05.10.1899";"художественная";"";"";"";"";"книга";"омонимия не снята";"";"";"64";"Люблю вечерний свет, и первые огни, И небо бледное, где звезд еще не видно.";"d9a7979a4eabdc4b39cb7afc47fbf734:0:8"
" иливбо онвобюЛ игебоп еывиж ;театевцсар щюлп";"еыворус";"плющ расцветает; живые побеги Любовно обвили";"суровые";" ";"нити.";"В. Я. Брюсов. Из детской книжки  («Мой плющ расцветает, живые побеги…») (12.11.1899)";"В. Я. Брюсов";"1873";"Из детской книжки  («Мой плющ расцветает, живые побеги…»)";"12.11.1899";"художественная";"";"";"";"";"книга";"омонимия не снята";"";"9";"68";"Мой плющ расцветает; живые побеги Любовно обвили суровые нити.";"9aefab45ccfa676ce5ed897ebd4a35db:1:7"
" хаквокам о ьшинмопирп оньловеН ,хынся вокичнебуб";"хынсарк";"бубенчиков ясных, Невольно припомнишь о маковках";"красных";", ";"Горящих, как угли, на нашей полянке.";"В. Я. Брюсов. Из детской книжки  («Мой плющ расцветает, живые побеги…») (12.11.1899)";"В. Я. Брюсов";"1873";"Из детской книжки  («Мой плющ расцветает, живые побеги…»)";"12.11.1899";"художественная";"";"";"";"";"книга";"омонимия не снята";"";"9";"68";"Когда разбегутся веселые санки И воздух дрожит от бубенчиков ясных, Невольно припомнишь о маковках красных, Горящих, как угли, на нашей полянке.";"9aefab45ccfa676ce5ed897ebd4a35db:3:14"
" могурк оН";"онмет";"Но кругом";"темно";" ― ";"тишина, ― За решеткой в окно Москва";"В. Я. Брюсов. О последнем рязанском князе Иване Ивановиче  («Ой вы, струночки — многозвончаты!..») (27.11.1899)";"В. Я. Брюсов";"1873";"О последнем рязанском князе Иване Ивановиче  («Ой вы, струночки — многозвончаты!..»)";"27.11.1899";"художественная";"";"";"";"";"книга";"омонимия не снята";"";"18";"190";"Но кругом темно ― тишина, ― За решеткой в окно Москва видна, Не услышит никто удалый клич, За замком сидит последний Ольгович.";"544e79cca01744fb7d7699a33df72d5d:13:2"
" отч ,мет яслянолкоп оТ ,йенго зеб";"ечря";"без огней, То поклонялся тем, что";"ярче";", ";"что телесней, То трепетал в предчувствии";"В. Я. Брюсов. Я  («Мой дух не изнемог во мгле противоречий…») (24.12.1899)";"В. Я. Брюсов";"1873";"Я  («Мой дух не изнемог во мгле противоречий…»)";"24.12.1899";"художественная";"";"";"";"";"книга";"омонимия не снята";"";"8";"130";"На острове Мечты, где статуи, где песни, Я исследил пути в огнях и без огней, То поклонялся тем, что ярче, что телесней, То трепетал в предчувствии теней.";"02ecf37e7f8e66c8bfb6f5052d967cac:5:19"
" доп-зи азалг тяртомС ,ичелп еынлоп и";"хынреч";"и полные плечи, Смотрят глаза из-под";"черных";" ";"кудрей…";"В. Я. Брюсов. Астролог  («Звездное небо плывет надо мной…») (29.12.1899)";"В. Я. Брюсов";"1873";"Астролог  («Звездное небо плывет надо мной…»)";"29.12.1899";"художественная";"";"";"";"";"книга";"омонимия не снята";"";"9";"58";"Вот проступают телесней, ясней Твердые бедра и полные плечи, Смотрят глаза из-под черных кудрей…";"452edd22078312fc224b5c6247a4b714:5:12"
" ясличанзобо тоВ";"йылеб";"Вот обозначился";"белый";" ";"хребет, Груди повисли, согнулись колени…";"В. Я. Брюсов. Астролог  («Звездное небо плывет надо мной…») (29.12.1899)";"В. Я. Брюсов";"1873";"Астролог  («Звездное небо плывет надо мной…»)";"29.12.1899";"художественная";"";"";"";"";"книга";"омонимия не снята";"";"9";"58";"Вот обозначился белый хребет, Груди повисли, согнулись колени…";"452edd22078312fc224b5c6247a4b714:7:2"
" ебен В";"мондолох";"В небе";"холодном";" ";"мерцанье планет, В небе порядок кругов";"В. Я. Брюсов. Астролог  («Звездное небо плывет надо мной…») (29.12.1899)";"В. Я. Брюсов";"1873";"Астролог  («Звездное небо плывет надо мной…»)";"29.12.1899";"художественная";"";"";"";"";"книга";"омонимия не снята";"";"9";"58";"В небе холодном мерцанье планет, В небе порядок кругов и движений…  29 декабря 1899";"452edd22078312fc224b5c6247a4b714:8:2"
" ыдов В ,йоннелесв еынйат ибулг В";"еынмет";"В глуби тайные вселенной, В воды";"темные";" ";"столетий Мы бросаем с лодки бренной";"В. Я. Брюсов. «В глуби тайные вселенной…» (1900)";"В. Я. Брюсов";"1873";"«В глуби тайные вселенной…»";"1900";"художественная";"";"";"";"";"книга";"омонимия не снята";"";"2";"31";"В глуби тайные вселенной, В воды темные столетий Мы бросаем с лодки бренной Золотые сети.";"5cee42b6905c415ab8185d2543b75ee7:0:6"
" йоннерб икдол с меасорб ыМ йителотс";"еытолоЗ";"столетий Мы бросаем с лодки бренной";"Золотые";" ";"сети.";"В. Я. Брюсов. «В глуби тайные вселенной…» (1900)";"В. Я. Брюсов";"1873";"«В глуби тайные вселенной…»";"1900";"художественная";"";"";"";"";"книга";"омонимия не снята";"";"2";"31";"В глуби тайные вселенной, В воды темные столетий Мы бросаем с лодки бренной Золотые сети.";"5cee42b6905c415ab8185d2543b75ee7:0:13"
" ;итуп моворим аН яьнадз ьсилиплотС ";"олтевс";"Столпились зданья На мировом пути;";"светло";" ";"вокруг.";"В. Я. Брюсов. «Настали дни печальные, как воды…» (1900)";"В. Я. Брюсов";"1873";"«Настали дни печальные, как воды…»";"1900";"художественная";"";"";"";"";"книга";"омонимия не снята";"";"16";"96";"Столпились зданья На мировом пути; светло вокруг.";"c9ee6f27e92f66481032d6be0ae1b4d2:5:5"
" и йовон К йолатсу инзиж то";"йолтевс";"от жизни усталой К новой и";"светлой";" ";"весне?";"В. Я. Брюсов. «Сладко скользить по окраинам бездны…» (1900)";"В. Я. Брюсов";"1873";"«Сладко скользить по окраинам бездны…»";"1900";"художественная";"";"";"";"";"книга";"омонимия не снята";"";"12";"105";"Крылья умчат ли от жизни усталой К новой и светлой весне?";"d2cc9b5b73318a10dc1108dc301c5f9e:2:9"
" ,йигортС ";"йындолох";"Строгий,";"холодный";" ";"и властный Свет невосшедшего дня.";"В. Я. Брюсов. «Строгий, холодный и властный…» (1900)";"В. Я. Брюсов";"1873";"«Строгий, холодный и властный…»";"1900";"художественная";"";"";"";"";"книга";"омонимия не снята";"";"10";"65";"Строгий, холодный и властный Свет невосшедшего дня.";"9ec3c46ea0570a459dbbad668d729c67:0:1"
" В";"молтевс";"В";"светлом";" ";"безмолвии утра Двое нас в мире";"В. Я. Брюсов. «Строгий, холодный и властный…» (1900)";"В. Я. Брюсов";"1873";"«Строгий, холодный и властный…»";"1900";"художественная";"";"";"";"";"книга";"омонимия не снята";"";"10";"65";"В светлом безмолвии утра Двое нас в мире живых!";"9ec3c46ea0570a459dbbad668d729c67:2:1"
" в ортУ";"мондолох";"Утро в";"холодном";" ";"свете, Ты лучше песен и книг!   Апрель 1900";"В. Я. Брюсов. «Строгий, холодный и властный…» (1900)";"В. Я. Брюсов";"1873";"«Строгий, холодный и властный…»";"1900";"художественная";"";"";"";"";"книга";"омонимия не снята";"";"10";"65";"Утро в холодном свете, Ты лучше песен и книг!   Апрель 1900";"9ec3c46ea0570a459dbbad668d729c67:9:2"
" ,идем в йыннещолпов ,зарбо каК ,театсв";"хындолоХ";"встает, Как образ, воплощенный в меди,";"Холодных";" ";"замыслов расчет.";"В. Я. Брюсов. «Торжествовать! какие звуки!..» (1900)";"В. Я. Брюсов";"1873";"«Торжествовать! какие звуки!..»";"1900";"художественная";"";"";"";"";"книга";"омонимия не снята";"";"10";"71";"Но в сладких думах о победе Из глубей памяти встает, Как образ, воплощенный в меди, Холодных замыслов расчет.";"c29a461d1718b5a86fc5342d0a73d395:4:15"
"-онревен тевс юнмоп Я ";"йылеб";"Я помню свет неверно-";"белый";" ";"И запах роз, томивший нас, Взор";"В. Я. Брюсов. «Я помню свет неверно-белый…» (1900)";"В. Я. Брюсов";"1873";"«Я помню свет неверно-белый…»";"1900";"художественная";"";"";"";"";"книга";"омонимия не снята";"";"5";"50";"Я помню свет неверно-белый И запах роз, томивший нас, Взор соблазнительно несмелый, И этот весь вечерний час.";"8916631b56702f7fac969fbfc0c4fdfc:0:4"
" ебет ьтитсм удуб еН ,йоксром итсонжербзеб";"мыньлатс";"безбрежности морской, Не буду мстить тебе";"стальным";" ";"огнем и кровью, Не буду ждать";"В. Я. Брюсов. К. Д. Бальмонту  («Нет, я люблю тебя не яростной любовью…») (1900)";"В. Я. Брюсов";"1873";"К. Д. Бальмонту  («Нет, я люблю тебя не яростной любовью…»)";"1900";"художественная";"";"";"";"";"книга";"омонимия не снята";"";"12";"189";"Нет, я люблю тебя не яростной любовью, Вскипающей, как ключ в безбрежности морской, Не буду мстить тебе стальным огнем и кровью, Не буду ждать тебя, в безмолвной тьме, ― с тоской.";"b35b2cf71e81905d989263bf9ca43201:1:17"
" ― ьдурГ";"алеб";"Грудь ―";"бела";", ";"а губы ― кровь.";"В. Я. Брюсов. Ламия  («В дни весенних новолуний…») (1900)";"В. Я. Брюсов";"1873";"Ламия  («В дни весенних новолуний…»)";"1900";"художественная";"";"";"";"";"книга";"омонимия не снята";"";"18";"129";"Всех красивей я из ламий! Грудь ― бела, а губы ― кровь. Я вопьюсь в тебя губами, Перелью в тебя любовь.";"b38076dbcca18db67d16f81929053d49:6:1"
