"Reversed left context";"Reversed center";"Left context";"Center";"Punct";"Right context";"Title";"Author";"Birthday";"Header";"Created";"Sphere";"Type";"Topic";"Publication";"Publ_year";"Medium";"Ambiguity";"Audience_age";"Sentences";"Words";"Full context";"Example source"
" аварТ ,окгел тижорд адов яанелеЗ";"яанелез";"Зеленая вода дрожит легко, Трава";"зеленая";" ";"по склонам, И молодая девушка в";"Н. С. Гумилев. Купанье  («Зеленая вода дрожит легко…») (1917-1918)";"Н. С. Гумилев";"1886";"Купанье  («Зеленая вода дрожит легко…»)";"1917-1918";"художественная";"";"";"";"1988";"книга";"омонимия не снята";"";"8";"104";"Зеленая вода дрожит легко, Трава зеленая по склонам, И молодая девушка в трико Купальном, ласковом, зеленом;";"1ed2e41968b460be7a83536d86535cdf:1:5"
" ,мовоксал ,моньлапуК окирт в акшувед яадолом";"монелез";"молодая девушка в трико Купальном, ласковом,";"зеленом";"; ";"";"Н. С. Гумилев. Купанье  («Зеленая вода дрожит легко…») (1917-1918)";"Н. С. Гумилев";"1886";"Купанье  («Зеленая вода дрожит легко…»)";"1917-1918";"художественная";"";"";"";"1988";"книга";"омонимия не снята";"";"8";"104";"Зеленая вода дрожит легко, Трава зеленая по склонам, И молодая девушка в трико Купальном, ласковом, зеленом;";"1ed2e41968b460be7a83536d86535cdf:1:15"
" в И";"монреч";"И в";"черном";" ";"я.";"Н. С. Гумилев. Купанье  («Зеленая вода дрожит легко…») (1917-1918)";"Н. С. Гумилев";"1886";"Купанье  («Зеленая вода дрожит легко…»)";"1917-1918";"художественная";"";"";"";"1988";"книга";"омонимия не снята";"";"8";"104";"И в черном я.";"1ed2e41968b460be7a83536d86535cdf:2:2"
" каТ ";"нереч";"Так";"черен";" ";"только грех, Зачатый полночью бессонной, А";"Н. С. Гумилев. Купанье  («Зеленая вода дрожит легко…») (1917-1918)";"Н. С. Гумилев";"1886";"Купанье  («Зеленая вода дрожит легко…»)";"1917-1918";"художественная";"";"";"";"1988";"книга";"омонимия не снята";"";"8";"104";"Так черен только грех, Зачатый полночью бессонной, А может быть, и зреющий орех В соседней заросли зеленой.";"1ed2e41968b460be7a83536d86535cdf:3:1"
" илсораз йендесос В херо йищюерз и";"йонелез";"и зреющий орех В соседней заросли";"зеленой";".  ";"";"Н. С. Гумилев. Купанье  («Зеленая вода дрожит легко…») (1917-1918)";"Н. С. Гумилев";"1886";"Купанье  («Зеленая вода дрожит легко…»)";"1917-1918";"художественная";"";"";"";"1988";"книга";"омонимия не снята";"";"8";"104";"Так черен только грех, Зачатый полночью бессонной, А может быть, и зреющий орех В соседней заросли зеленой.";"1ed2e41968b460be7a83536d86535cdf:3:16"
" отч ,ущург кат Я ,монноволз удурп";"йынреч";"пруду зловонном, Я так грущу, что";"черный";" ";"мой костюм Не поспевает за зеленым,";"Н. С. Гумилев. Купанье  («Зеленая вода дрожит легко…») (1917-1918)";"Н. С. Гумилев";"1886";"Купанье  («Зеленая вода дрожит легко…»)";"1917-1918";"художественная";"";"";"";"1988";"книга";"омонимия не снята";"";"8";"104";"И вот теперь, покинут и угрюм, Барахтаясь в пруду зловонном, Я так грущу, что черный мой костюм Не поспевает за зеленым,";"1ed2e41968b460be7a83536d86535cdf:6:14"
" аз теавепсоп еН мютсок йом йынреч";"мынелез";"черный мой костюм Не поспевает за";"зеленым";",  ";"";"Н. С. Гумилев. Купанье  («Зеленая вода дрожит легко…») (1917-1918)";"Н. С. Гумилев";"1886";"Купанье  («Зеленая вода дрожит легко…»)";"1917-1918";"художественная";"";"";"";"1988";"книга";"омонимия не снята";"";"8";"104";"И вот теперь, покинут и угрюм, Барахтаясь в пруду зловонном, Я так грущу, что черный мой костюм Не поспевает за зеленым,";"1ed2e41968b460be7a83536d86535cdf:6:20"
" вилтсачс хакзакс в окьлот И мазор";"йынреч";"розам И только в сказках счастлив";"черный";" ";"жук, К зеленым сватаясь стрекозам.  <1917 или 1918? >";"Н. С. Гумилев. Купанье  («Зеленая вода дрожит легко…») (1917-1918)";"Н. С. Гумилев";"1886";"Купанье  («Зеленая вода дрожит легко…»)";"1917-1918";"художественная";"";"";"";"1988";"книга";"омонимия не снята";"";"8";"104";"Что в тайном заговоре все вокруг, Что солнце светит не звездам, а розам И только в сказках счастлив черный жук, К зеленым сватаясь стрекозам.  <1917 или 1918? >";"1ed2e41968b460be7a83536d86535cdf:7:18"
" К ,куж йынреч вилтсачс хакзакс в";"мынелез";"в сказках счастлив черный жук, К";"зеленым";" ";"сватаясь стрекозам.  <1917 или 1918? >";"Н. С. Гумилев. Купанье  («Зеленая вода дрожит легко…») (1917-1918)";"Н. С. Гумилев";"1886";"Купанье  («Зеленая вода дрожит легко…»)";"1917-1918";"художественная";"";"";"";"1988";"книга";"омонимия не снята";"";"8";"104";"Что в тайном заговоре все вокруг, Что солнце светит не звездам, а розам И только в сказках счастлив черный жук, К зеленым сватаясь стрекозам.  <1917 или 1918? >";"1ed2e41968b460be7a83536d86535cdf:7:21"
" с укшувед орП уме ужакссар я";"имынелез";"я расскажу ему Про девушку с";"зелеными";" ";"глазами, Про голубую утреннюю тьму, Пронзенную";"Н. С. Гумилев. Рыцарь счастья  («Как в этом мире дышится легко!..») (1917-1918)";"Н. С. Гумилев";"1886";"Рыцарь счастья  («Как в этом мире дышится легко!..»)";"1917-1918";"художественная";"";"";"";"1988";"книга";"омонимия не снята";"";"7";"89";"Пусть он придет, я расскажу ему Про девушку с зелеными глазами, Про голубую утреннюю тьму, Пронзенную лучами и стихами.";"04f5c450b640bfe177c5d346808b84b3:3:9"
" орП ,имазалг имынелез с укшувед орП";"юубулог";"Про девушку с зелеными глазами, Про";"голубую";" ";"утреннюю тьму, Пронзенную лучами и стихами.";"Н. С. Гумилев. Рыцарь счастья  («Как в этом мире дышится легко!..») (1917-1918)";"Н. С. Гумилев";"1886";"Рыцарь счастья  («Как в этом мире дышится легко!..»)";"1917-1918";"художественная";"";"";"";"1988";"книга";"омонимия не снята";"";"7";"89";"Пусть он придет, я расскажу ему Про девушку с зелеными глазами, Про голубую утреннюю тьму, Пронзенную лучами и стихами.";"04f5c450b640bfe177c5d346808b84b3:3:12"
" йылавыбен игон ми лазил И ,ьрепет";"йотолоЗ";"теперь, И лизал им ноги небывалый";"Золотой";" ";"и шестикрылый зверь.";"Н. С. Гумилев. «В этот мой благословенный вечер…» (1917)";"Н. С. Гумилев";"1886";"«В этот мой благословенный вечер…»";"1917";"художественная";"";"";"";"1988";"книга";"омонимия не снята";"";"12";"181";"Муза Дальних Странствий обнимала Зою, как сестру свою теперь, И лизал им ноги небывалый Золотой и шестикрылый зверь.";"998484b239e832079235aaa8beb63b1a:2:14"
" ыдзевз ьсилитевс И";"еытолоз";"И светились звезды";"золотые";", ";"Приглашенные на торжество, Словно апельсины восковые";"Н. С. Гумилев. «В этот мой благословенный вечер…» (1917)";"Н. С. Гумилев";"1886";"«В этот мой благословенный вечер…»";"1917";"художественная";"";"";"";"1988";"книга";"омонимия не снята";"";"12";"181";"И светились звезды золотые, Приглашенные на торжество, Словно апельсины восковые, Те, что подают на Рождество.";"998484b239e832079235aaa8beb63b1a:6:3"
" и ,кур хылим И ,йонидебел иеш";"хыла";"шеи лебединой, И милых рук, и";"алых";" ";"губ.1917";"Н. С. Гумилев. «Взгляните: вот гусары смерти!..» (1917)";"Н. С. Гумилев";"1886";"«Взгляните: вот гусары смерти!..»";"1917";"художественная";"";"";"";"1988";"книга";"омонимия не снята";"";"4";"50";"Ах, им опасен плен единый, Опасен и безумно люб, ― Девичьей шеи лебединой, И милых рук, и алых губ.1917";"28ea752164b6fc5a1b53e7b84ba8b6e3:3:16"
" хяелла в ыМ ";"хылтевс";"Мы в аллеях";"светлых";" ";"пролетали, Мы летели около воды, Золотые";"Н. С. Гумилев. «Мы в аллеях светлых пролетали…» (1917)";"Н. С. Гумилев";"1886";"«Мы в аллеях светлых пролетали…»";"1917";"художественная";"";"";"";"1988";"книга";"омонимия не снята";"";"6";"99";"Мы в аллеях светлых пролетали, Мы летели около воды, Золотые листья опадали В синие и сонные пруды.";"f71b3dd65b044a6e2b7a233c5d0c8da4:0:3"
" ,ыдов олоко илетел ыМ ,илателорп хылтевс";"еытолоЗ";"светлых пролетали, Мы летели около воды,";"Золотые";" ";"листья опадали В синие и сонные";"Н. С. Гумилев. «Мы в аллеях светлых пролетали…» (1917)";"Н. С. Гумилев";"1886";"«Мы в аллеях светлых пролетали…»";"1917";"художественная";"";"";"";"1988";"книга";"омонимия не снята";"";"6";"99";"Мы в аллеях светлых пролетали, Мы летели около воды, Золотые листья опадали В синие и сонные пруды.";"f71b3dd65b044a6e2b7a233c5d0c8da4:0:9"
" В иладапо яьтсил еытолоЗ ,ыдов олоко";"еинис";"около воды, Золотые листья опадали В";"синие";" ";"и сонные пруды.";"Н. С. Гумилев. «Мы в аллеях светлых пролетали…» (1917)";"Н. С. Гумилев";"1886";"«Мы в аллеях светлых пролетали…»";"1917";"художественная";"";"";"";"1988";"книга";"омонимия не снята";"";"6";"99";"Мы в аллеях светлых пролетали, Мы летели около воды, Золотые листья опадали В синие и сонные пруды.";"f71b3dd65b044a6e2b7a233c5d0c8da4:0:13"
" яьверед едг ,екмар В оцил еолим";"еытолоз";"милое лицо В рамке, где деревья";"золотые";" ";"С водами слились в одно кольцо.";"Н. С. Гумилев. «Мы в аллеях светлых пролетали…» (1917)";"Н. С. Гумилев";"1886";"«Мы в аллеях светлых пролетали…»";"1917";"художественная";"";"";"";"1988";"книга";"омонимия не снята";"";"6";"99";"Я смотрел в глаза ее большие, И я видел милое лицо В рамке, где деревья золотые С водами слились в одно кольцо.";"f71b3dd65b044a6e2b7a233c5d0c8da4:3:15"
" ,йихит ,йихиТ ― яропс ен ыб лянирп";"йотолоз";"принял бы не споря ― Тихий, тихий,";"золотой";" ";"покой Да двенадцать тысяч футов моря";"Н. С. Гумилев. «Нежно-небывалая отрада…» (1917)";"Н. С. Гумилев";"1886";"«Нежно-небывалая отрада…»";"1917";"художественная";"";"";"";"1988";"книга";"омонимия не снята";"";"";"64";"Лишь одно я принял бы не споря ― Тихий, тихий, золотой покой Да двенадцать тысяч футов моря Над моей пробитой головой.";"627e754b7a22ed305bd93f9e6fde552e:1:9"
" ханилвап о ,харезо бО ";"хылеб";"Об озерах, о павлинах";"белых";", ";"О закатно-лунных вечерах Вы мне";"Н. С. Гумилев. «Об озерах, о павлинах белых…» (1917)";"Н. С. Гумилев";"1886";"«Об озерах, о павлинах белых…»";"1917";"художественная";"";"";"";"1988";"книга";"омонимия не снята";"";"";"54";"Об озерах, о павлинах белых, О закатно-лунных вечерах Вы мне говорили, о несмелых И пророческих своих мечтах.";"ba19f116095cfba2401edbc135dbd7b6:0:4"
" хымас рим В ,ызок окьлот тядорб";"хылеб";"бродят только козы, В мир самых";"белых";" ";"облаков, Искать увянувшие розы И слушать";"Н. С. Гумилев. «Однообразные мелькают…» (1917)";"Н. С. Гумилев";"1886";"«Однообразные мелькают…»";"1917";"художественная";"";"";"";"1988";"книга";"омонимия не снята";"";"4";"69";"Туда, где бродят только козы, В мир самых белых облаков, Искать увянувшие розы И слушать мертвых соловьев.  <1917>";"e684db23ad93cf23a2f42cc34db56f9c:3:8"
" В ― алшу и ,меьнахыд зор ещалС";"йылеб";"Слаще роз дыханьем, и ушла ― В";"белый";" ";"май с его очарованьем, В лунные";"Н. С. Гумилев. «Перед ночью северной, короткой…» (1917)";"Н. С. Гумилев";"1886";"«Перед ночью северной, короткой…»";"1917";"художественная";"";"";"";"1988";"книга";"омонимия не снята";"";"5";"89";"Отравила взглядом и дыханьем, Слаще роз дыханьем, и ушла ― В белый май с его очарованьем, В лунные, слепые зеркала…";"14b09bc1cc905404887fdc2e04b44ee8:1:10"
" отэ ыботЧ ,ьтижод инесо йокгел од";"еонненго";"до легкой осени дожить, Чтобы это";"огненное";" ";"лето Не могло меня испепелить?";"Н. С. Гумилев. «Перед ночью северной, короткой…» (1917)";"Н. С. Гумилев";"1886";"«Перед ночью северной, короткой…»";"1917";"художественная";"";"";"";"1988";"книга";"омонимия не снята";"";"5";"89";"У кого я попрошу совета, Как до легкой осени дожить, Чтобы это огненное лето Не могло меня испепелить?";"14b09bc1cc905404887fdc2e04b44ee8:2:12"
" итямап в ьвонВ ,еьняотсод еом ьвонв";"хылеб";"вновь мое достоянье, Вновь в памяти";"белых";" ";"лилий И синих миров сверканье.";"Н. С. Гумилев. «Так долго сердце боролось…» (1917)";"Н. С. Гумилев";"1886";"«Так долго сердце боролось…»";"1917";"художественная";"";"";"";"1988";"книга";"омонимия не снята";"";"5";"84";"Но Вы мне его возвратили, Он вновь мое достоянье, Вновь в памяти белых лилий И синих миров сверканье.";"61c6cf95d1b17f90309dc334be71ef12:1:12"
" И йилил хылеб итямап в ьвонВ";"хинис";"Вновь в памяти белых лилий И";"синих";" ";"миров сверканье.";"Н. С. Гумилев. «Так долго сердце боролось…» (1917)";"Н. С. Гумилев";"1886";"«Так долго сердце боролось…»";"1917";"художественная";"";"";"";"1988";"книга";"омонимия не снята";"";"5";"84";"Но Вы мне его возвратили, Он вновь мое достоянье, Вновь в памяти белых лилий И синих миров сверканье.";"61c6cf95d1b17f90309dc334be71ef12:1:15"
" ысок тешеч тоВ";"еытолоз";"Вот чешет косы";"золотые";", ";"По-праздничному весела.";"Н. С. Гумилев. «Ты говорил слова пустые…» (1917)";"Н. С. Гумилев";"1886";"«Ты говорил слова пустые…»";"1917";"художественная";"";"";"";"1988";"книга";"омонимия не снята";"";"5";"54";"Вот чешет косы золотые, По-праздничному весела.";"f78f1433d7dc751fce8210ce4dfb3b1f:1:3"
" йозор или йокпиркс йокновЗ ,мэоп зи";"юолеб";"из поэм, Звонкой скрипкой или розой";"белою";", ";"В этом мире сделался ничем, Вот";"Н. С. Гумилев. «Я, что мог быть лучшей из поэм…» (1917)";"Н. С. Гумилев";"1886";"«Я, что мог быть лучшей из поэм…»";"1917";"художественная";"";"";"";"1988";"книга";"омонимия не снята";"";"";"64";"Я, что мог быть лучшей из поэм, Звонкой скрипкой или розой белою, В этом мире сделался ничем, Вот живу и ничего не делаю.";"e3812e02a1d229d0e55fd51add5f3fb4:0:11"
" ан кодзе еН ,от-яакак яом ьлоб";"монненго";"боль моя какая-то, Не ездок на";"огненном";" ";"коне, А томленье и пустая маята.";"Н. С. Гумилев. «Я, что мог быть лучшей из поэм…» (1917)";"Н. С. Гумилев";"1886";"«Я, что мог быть лучшей из поэм…»";"1917";"художественная";"";"";"";"1988";"книга";"омонимия не снята";"";"";"64";"Часто больно мне и трудно мне, Только даже боль моя какая-то, Не ездок на огненном коне, А томленье и пустая маята.";"e3812e02a1d229d0e55fd51add5f3fb4:1:14"
" в ыТ яар мокалбо мынченлос оН";"еонмет";"Но солнечным облаком рая Ты в";"темное";" ";"сердце вошла.";"Н. С. Гумилев. Богатое сердце  («Дремала душа, как слепая…») (1917)";"Н. С. Гумилев";"1886";"Богатое сердце  («Дремала душа, как слепая…»)";"1917";"художественная";"";"";"";"1988";"книга";"омонимия не снята";"";"5";"78";"Дремала душа, как слепая, Так пыльные спят зеркала, Но солнечным облаком рая Ты в темное сердце вошла.";"0c1f69bb6c52435d7dccf942698ad927:1:14"
" ,яром еТ йерокс юлбюл я ,оннартс";"еыворус";"странно, я люблю скорей Те моря,";"суровые";" ";"без меры, Где акулы, спруты и";"Н. С. Гумилев. В Бретани  («Здравствуй, море! Ты из тех морей…») (1917)";"Н. С. Гумилев";"1886";"В Бретани  («Здравствуй, море! Ты из тех морей…»)";"1917";"художественная";"";"";"";"1988";"книга";"омонимия не снята";"";"6";"72";"Только странно, я люблю скорей Те моря, суровые без меры, Где акулы, спруты и химеры, ― Ужас чернокожих рыбарей.";"bae7d607566f83a9ee49835bf5d2d311:3:7"
" воркоп хи ужив онсЯ ,ыновз хи";"йынелвреч";"их звоны, Ясно вижу их покров";"червленый";" ";"В душной комнате, в тиши ночной,";"Н. С. Гумилев. В Бретани  («Здравствуй, море! Ты из тех морей…») (1917)";"Н. С. Гумилев";"1886";"В Бретани  («Здравствуй, море! Ты из тех морей…»)";"1917";"художественная";"";"";"";"1988";"книга";"омонимия не снята";"";"6";"72";"Те моря… я слушаю их звоны, Ясно вижу их покров червленый В душной комнате, в тиши ночной,";"bae7d607566f83a9ee49835bf5d2d311:4:10"
" обен как ,ыт евзар ьшеанз еН";"енис";"Не знаешь разве ты, как небо";"сине";", ";"Как веселы широкие пустыни";"Н. С. Гумилев. Два Адама  («Мне странно сочетанье слов — «я сам»…») (1917)";"Н. С. Гумилев";"1886";"Два Адама  («Мне странно сочетанье слов — «я сам»…»)";"1917";"художественная";"";"";"";"1988";"книга";"омонимия не снята";"";"13";"120";"Не знаешь разве ты, как небо сине, Как веселы широкие пустыни";"0e9130ca1f18ce6b679d34c727143e65:6:6"
" мацровд ясьтисонзв еН мынвломзеб мяьжербирп оп";"мытолоз";"по прибрежьям безмолвным Не взноситься дворцам";"золотым";"?  ";"";"Н. С. Гумилев. Девочка  («Временами, не справясь с тоскою…») (1917)";"Н. С. Гумилев";"1886";"Девочка  («Временами, не справясь с тоскою…»)";"1917";"художественная";"";"";"";"1988";"книга";"омонимия не снята";"";"18";"202";"Почему по прибрежьям безмолвным Не взноситься дворцам золотым?";"da3ff5d3a91bbede2433dcf9c762451e:6:7"
