"Reversed left context";"Reversed center";"Left context";"Center";"Punct";"Right context";"Title";"Author";"Birthday";"Header";"Created";"Sphere";"Type";"Topic";"Publication";"Publ_year";"Medium";"Ambiguity";"Audience_age";"Sentences";"Words";"Full context";"Example source"
" лыб ниязох маС";"нереч";"Сам хозяин был";"черен";", ";"как в дегте, У него были";"Н. С. Гумилев. Сказка  («На скале, у самого края…») (1916)";"Н. С. Гумилев";"1886";"Сказка  («На скале, у самого края…»)";"1916";"художественная";"";"";"";"1988";"книга";"омонимия не снята";"";"22";"272";"Сам хозяин был черен, как в дегте, У него были длинные когти, Гибкий хвост под плащом он прятал.";"2fe24a39b539b93387534fc32ff73bd9:5:3"
" алахЕ атебазилЕ угереб оп моречеВ";"яанреч";"Вечером по берегу Елизабета Ехала";"черная";" ";"карета, А в карете сидел старый";"Н. С. Гумилев. Сказка  («На скале, у самого края…») (1916)";"Н. С. Гумилев";"1886";"Сказка  («На скале, у самого края…»)";"1916";"художественная";"";"";"";"1988";"книга";"омонимия не снята";"";"22";"272";"Вечером по берегу Елизабета Ехала черная карета, А в карете сидел старый дьявол.";"2fe24a39b539b93387534fc32ff73bd9:19:5"
" хавр в имялуп доп ьшиЛ ,ьтремс";"хынйокопс";"смерть, Лишь под пулями в рвах";"спокойных";" ";"Веришь в знамя Господне, твердь.";"Н. С. Гумилев. Смерть  («Есть так много жизней достойных…») (1916)";"Н. С. Гумилев";"1886";"Смерть  («Есть так много жизней достойных…»)";"1916";"художественная";"";"";"";"1988";"книга";"омонимия не снята";"";"7";"116";"Есть так много жизней достойных, Но одна лишь достойна смерть, Лишь под пулями в рвах спокойных Веришь в знамя Господне, твердь.";"0de3514e47b7b725a3ac046fe5993a47:1:15"
" калбо онволс ,адгок ,сач В ,сач";"йынсарк";"час, В час, когда, словно облак";"красный";", ";"Милый день уплывет из глаз, ―";"Н. С. Гумилев. Смерть  («Есть так много жизней достойных…») (1916)";"Н. С. Гумилев";"1886";"Смерть  («Есть так много жизней достойных…»)";"1916";"художественная";"";"";"";"1988";"книга";"омонимия не снята";"";"7";"116";"И за это знаешь так ясно, Что в единственный, строгий час, В час, когда, словно облак красный, Милый день уплывет из глаз, ―";"0de3514e47b7b725a3ac046fe5993a47:2:16"
" ут ушуд и ,юошуд дерП тунивдзар";"еынженсолеБ";"раздвинут Пред душою, и душу ту";"Белоснежные";" ";"кони ринут В ослепительную высоту.";"Н. С. Гумилев. Смерть  («Есть так много жизней достойных…») (1916)";"Н. С. Гумилев";"1886";"Смерть  («Есть так много жизней достойных…»)";"1916";"художественная";"";"";"";"1988";"книга";"омонимия не снята";"";"7";"116";"Свод небесный будет раздвинут Пред душою, и душу ту Белоснежные кони ринут В ослепительную высоту.";"0de3514e47b7b725a3ac046fe5993a47:3:9"
" в киньлачаН маТ";"мокря";"Там Начальник в";"ярком";" ";"доспехе, В грозном шлеме звездных лучей";"Н. С. Гумилев. Смерть  («Есть так много жизней достойных…») (1916)";"Н. С. Гумилев";"1886";"Смерть  («Есть так много жизней достойных…»)";"1916";"художественная";"";"";"";"1988";"книга";"омонимия не снята";"";"7";"116";"Там Начальник в ярком доспехе, В грозном шлеме звездных лучей И к старинной бранной потехе Огнекрылых зов трубачей.";"0de3514e47b7b725a3ac046fe5993a47:4:3"
" В асырк ьтсе андо ьтох ьлежуеН";"йонзярг";"Неужель хоть одна есть крыса В";"грязной";" ";"кухне иль червь в норе, Хоть";"Н. С. Гумилев. Снова море  («Я сегодня опять услышал…») (1916)";"Н. С. Гумилев";"1886";"Снова море  («Я сегодня опять услышал…»)";"1916";"художественная";"";"";"";"1988";"книга";"омонимия не снята";"";"6";"136";"Неужель хоть одна есть крыса В грязной кухне иль червь в норе, Хоть один беззубый и лысый И помешанный на добре, Что не слышат песен Уллиса, Призывающего к игре?";"a7c72edd0a785841b6b8d212a2dda2f5:2:6"
" идюл туминс ахуд аверд то И";"еытолоЗ";"И от древа духа снимут люди";"Золотые";", ";"зрелые плоды.";"Н. С. Гумилев. Солнце духа  («Как могли мы прежде жить в покое…») (1916)";"Н. С. Гумилев";"1886";"Солнце духа  («Как могли мы прежде жить в покое…»)";"1916";"художественная";"";"";"";"1988";"книга";"омонимия не снята";"";"6";"99";"Чувствую, что скоро осень будет, Солнечные кончатся труды И от древа духа снимут люди Золотые, зрелые плоды.";"13466e10749482b450981039b09a9bf6:5:14"
" ым оН";"ынйокопс";"Но мы";"спокойны";", ";"мы поспорим Со стражами Господня гнева";"Н. С. Гумилев. Средневековье  («Прошел патруль, стуча мечами…») (1916)";"Н. С. Гумилев";"1886";"Средневековье  («Прошел патруль, стуча мечами…»)";"1916";"художественная";"";"";"";"1988";"книга";"омонимия не снята";"";"9";"134";"Но мы спокойны, мы поспорим Со стражами Господня гнева, И пахнет звездами и морем Твой плащ широкий, Женевьева.";"43c088be678979e52d7632a06a9e7c8f:2:2"
" даН ,екарм ов йищюенреч ,марх латсВ";"имынчармус";"Встал храм, чернеющий во мраке, Над";"сумрачными";" ";"алтарями Горели огненные знаки.";"Н. С. Гумилев. Средневековье  («Прошел патруль, стуча мечами…») (1916)";"Н. С. Гумилев";"1886";"Средневековье  («Прошел патруль, стуча мечами…»)";"1916";"художественная";"";"";"";"1988";"книга";"омонимия не снята";"";"9";"134";"Ты помнишь ли, как перед нами Встал храм, чернеющий во мраке, Над сумрачными алтарями Горели огненные знаки.";"43c088be678979e52d7632a06a9e7c8f:3:12"
" илероГ имяратла имынчармус даН ,екарм ов";"еынненго";"во мраке, Над сумрачными алтарями Горели";"огненные";" ";"знаки.";"Н. С. Гумилев. Средневековье  («Прошел патруль, стуча мечами…») (1916)";"Н. С. Гумилев";"1886";"Средневековье  («Прошел патруль, стуча мечами…»)";"1916";"художественная";"";"";"";"1988";"книга";"омонимия не снята";"";"9";"134";"Ты помнишь ли, как перед нами Встал храм, чернеющий во мраке, Над сумрачными алтарями Горели огненные знаки.";"43c088be678979e52d7632a06a9e7c8f:3:15"
" кимот ,йыньлып кимоТ";"йырес";"Томик пыльный, томик";"серый";" ";"Я беру, тоску кляня, Но и";"Н. С. Гумилев. Старая дева  («Жизнь печальна, жизнь пустынна…») (1916)";"Н. С. Гумилев";"1886";"Старая дева  («Жизнь печальна, жизнь пустынна…»)";"1916";"художественная";"";"";"";"1988";"книга";"омонимия не снята";"";"9";"129";"Томик пыльный, томик серый Я беру, тоску кляня, Но и в книгах кавалеры Влюблены, да не в меня.";"b42cd9fb814448521abed94e3670a5e3:2:3"
" йозор с ,ьрацыр онволС ,енок ан";"йола";"на коне, Словно рыцарь, с розой";"алой";" ";"На чешуйчатой броне.";"Н. С. Гумилев. Старая дева  («Жизнь печальна, жизнь пустынна…») (1916)";"Н. С. Гумилев";"1886";"Старая дева  («Жизнь печальна, жизнь пустынна…»)";"1916";"художественная";"";"";"";"1988";"книга";"омонимия не снята";"";"9";"129";"И зато за мной, усталой, Смерть прискачет на коне, Словно рыцарь, с розой алой На чешуйчатой броне.";"b42cd9fb814448521abed94e3670a5e3:8:13"
" ,могоБ тидерб ьсуР";"мынсарк";"Русь бредит Богом,";"красным";" ";"пламенем, Где видно ангелов сквозь дым";"Н. С. Гумилев. Старые усадьбы  («Дома косые, двухэтажные…») (1916)";"Н. С. Гумилев";"1886";"Старые усадьбы  («Дома косые, двухэтажные…»)";"1916";"художественная";"";"";"";"1988";"книга";"омонимия не снята";"";"19";"204";"Русь бредит Богом, красным пламенем, Где видно ангелов сквозь дым… Они ж покорно верят знаменьям, Любя свое, живя своим.";"0a7d35df8bd973650520bfc3d9bacdae:5:3"
" вункиноП";"юосур";"Поникнув";"русою";" ";"головкою, С ним дочка ― восемнадцать лет.";"Н. С. Гумилев. Старые усадьбы  («Дома косые, двухэтажные…») (1916)";"Н. С. Гумилев";"1886";"Старые усадьбы  («Дома косые, двухэтажные…»)";"1916";"художественная";"";"";"";"1988";"книга";"омонимия не снята";"";"19";"204";"Поникнув русою головкою, С ним дочка ― восемнадцать лет.";"0a7d35df8bd973650520bfc3d9bacdae:7:1"
" макласуР юобьдасу дереп удурп В ";"мынделб";"В пруду перед усадьбою Русалкам";"бледным";" ";"плохо ль жить?";"Н. С. Гумилев. Старые усадьбы  («Дома косые, двухэтажные…») (1916)";"Н. С. Гумилев";"1886";"Старые усадьбы  («Дома косые, двухэтажные…»)";"1916";"художественная";"";"";"";"1988";"книга";"омонимия не снята";"";"19";"204";"В пруду перед усадьбою Русалкам бледным плохо ль жить?";"0a7d35df8bd973650520bfc3d9bacdae:12:5"
" иксялп И яинелмот огеннесев ысач В";"хылеб";"В часы весеннего томления И пляски";"белых";" ";"облаков Бывают головокружения У девушек и";"Н. С. Гумилев. Старые усадьбы  («Дома косые, двухэтажные…») (1916)";"Н. С. Гумилев";"1886";"Старые усадьбы  («Дома косые, двухэтажные…»)";"1916";"художественная";"";"";"";"1988";"книга";"омонимия не снята";"";"19";"204";"В часы весеннего томления И пляски белых облаков Бывают головокружения У девушек и стариков.";"0a7d35df8bd973650520bfc3d9bacdae:13:6"
" ,еытявС ,еывалготолоз ― макиратс оН";"еылеб";"Но старикам ― золотоглавые, Святые,";"белые";" ";"скиты, А девушкам ― одни лукавые Увещеванья";"Н. С. Гумилев. Старые усадьбы  («Дома косые, двухэтажные…») (1916)";"Н. С. Гумилев";"1886";"Старые усадьбы  («Дома косые, двухэтажные…»)";"1916";"художественная";"";"";"";"1988";"книга";"омонимия не снята";"";"19";"204";"Но старикам ― золотоглавые, Святые, белые скиты, А девушкам ― одни лукавые Увещеванья пустоты.";"0a7d35df8bd973650520bfc3d9bacdae:14:4"
" ацинбешлов ,ьсуР О";"яаворус";"О Русь, волшебница";"суровая";", ";"Повсюду ты свое возьмешь.";"Н. С. Гумилев. Старые усадьбы  («Дома косые, двухэтажные…») (1916)";"Н. С. Гумилев";"1886";"Старые усадьбы  («Дома косые, двухэтажные…»)";"1916";"художественная";"";"";"";"1988";"книга";"омонимия не снята";"";"19";"204";"О Русь, волшебница суровая, Повсюду ты свое возьмешь.";"0a7d35df8bd973650520bfc3d9bacdae:15:3"
" ,йишчул йымас йом В";"йылтевс";"В мой самый лучший,";"светлый";" ";"день, В тот день Христова Воскресенья";"Н. С. Гумилев. Счастие  («Больные верят в розы майские…») (1916)";"Н. С. Гумилев";"1886";"Счастие  («Больные верят в розы майские…»)";"1916";"художественная";"";"";"";"1988";"книга";"омонимия не снята";"";"17";"183";"В мой самый лучший, светлый день, В тот день Христова Воскресенья, Мне вдруг примнилось искупленье, Какого я искал везде.";"1d9db7886a2628f9d8e027a68712658c:15:4"
" авакур зи ьчон теаксупыв едГ ,ирузал";"хыньлатсурХ";"лазури, Где выпускает ночь из рукава";"Хрустальных";" ";"нимф и венценосных фурий;";"Н. С. Гумилев. Фра Беато Анджелико  («В стране, где гиппогриф веселый льва…») (1916)";"Н. С. Гумилев";"1886";"Фра Беато Анджелико  («В стране, где гиппогриф веселый льва…»)";"1916";"художественная";"";"";"";"1988";"книга";"омонимия не снята";"";"16";"272";"В стране, где гиппогриф веселый льва Крылатого зовет играть в лазури, Где выпускает ночь из рукава Хрустальных нимф и венценосных фурий;";"35205723521adf90791e45c203e734f9:1:16"
" еварт в тярог адгоК ,йелопот хикнот";"йонелез";"тонких тополей, Когда горят в траве";"зеленой";" ";"маки, И в глубине готических церквей";"Н. С. Гумилев. Фра Беато Анджелико  («В стране, где гиппогриф веселый льва…») (1916)";"Н. С. Гумилев";"1886";"Фра Беато Анджелико  («В стране, где гиппогриф веселый льва…»)";"1916";"художественная";"";"";"";"1988";"книга";"омонимия не снята";"";"16";"272";"На Фьезоле, средь тонких тополей, Когда горят в траве зеленой маки, И в глубине готических церквей, Где мученики спят в прохладной раке.";"35205723521adf90791e45c203e734f9:5:9"
" укшабур в ,чалаП мытявс мынназявс нешартсен";"ююнис";"нестрашен связанным святым Палач, в рубашку";"синюю";" ";"одетый, Им хорошо под нимбом золотым";"Н. С. Гумилев. Фра Беато Анджелико  («В стране, где гиппогриф веселый льва…») (1916)";"Н. С. Гумилев";"1886";"Фра Беато Анджелико  («В стране, где гиппогриф веселый льва…»)";"1916";"художественная";"";"";"";"1988";"книга";"омонимия не снята";"";"16";"272";"И так нестрашен связанным святым Палач, в рубашку синюю одетый, Им хорошо под нимбом золотым, И здесь есть свет, и там ― иные светы.";"35205723521adf90791e45c203e734f9:11:8"
" мобмин доп ошорох мИ ,йытедо ююнис";"мытолоз";"синюю одетый, Им хорошо под нимбом";"золотым";", ";"И здесь есть свет, и там";"Н. С. Гумилев. Фра Беато Анджелико  («В стране, где гиппогриф веселый льва…») (1916)";"Н. С. Гумилев";"1886";"Фра Беато Анджелико  («В стране, где гиппогриф веселый льва…»)";"1916";"художественная";"";"";"";"1988";"книга";"омонимия не снята";"";"16";"272";"И так нестрашен связанным святым Палач, в рубашку синюю одетый, Им хорошо под нимбом золотым, И здесь есть свет, и там ― иные светы.";"35205723521adf90791e45c203e734f9:11:14"
" ― иксарк ,иксарк А";"икря";"А краски, краски ―";"ярки";" ";"и чисты, Они родились с ним";"Н. С. Гумилев. Фра Беато Анджелико  («В стране, где гиппогриф веселый льва…») (1916)";"Н. С. Гумилев";"1886";"Фра Беато Анджелико  («В стране, где гиппогриф веселый льва…»)";"1916";"художественная";"";"";"";"1988";"книга";"омонимия не снята";"";"16";"272";"А краски, краски ― ярки и чисты, Они родились с ним и с ним погасли.";"35205723521adf90791e45c203e734f9:12:3"
" дерП ,яемс ен ьтавовтсрокоп ин ,ьтиропс";"имынсарк";"спорить, ни покорствовать не смея, Пред";"красными";", ";"как зарево, шатрами.";"Н. С. Гумилев. Юдифь  («Какой мудрейшею из мудрых пифий…») (1916)";"Н. С. Гумилев";"1886";"Юдифь  («Какой мудрейшею из мудрых пифий…»)";"1916";"художественная";"";"";"";"1988";"книга";"омонимия не снята";"";"6";"99";"Ведь много дней томилась Иудея, Опалена горячими ветрами, Ни спорить, ни покорствовать не смея, Пред красными, как зарево, шатрами.";"1964437da3bb13f1a8d4e3d41d0861a6:2:15"
" едГ ,дорог иледив ыМ ханибулг хыннос";"хыла";"сонных глубинах Мы видели город, Где";"алых";" ";"рубинов Возносятся горы».";"Н. С. Гумилев. Конквистадор  («От дальних селений…») (1915)";"Н. С. Гумилев";"1886";"Конквистадор  («От дальних селений…»)";"1915";"художественная";"";"";"";"1988";"книга";"омонимия не снята";"";"10";"108";"И в сонных глубинах Мы видели город, Где алых рубинов Возносятся горы».";"327d807be2ae594c800d094c3bfc024c:8:8"
" оД ворташ и нижих то миР";"хылеб";"Рим от хижин и шатров До";"белых";" ";"портиков и лоджий.";"Н. С. Гумилев. Надпись на «Колчане»  («От «Романтических цветов»…») (1915)";"Н. С. Гумилев";"1886";"Надпись на «Колчане»  («От «Романтических цветов»…»)";"1915";"художественная";"";"";"";"1988";"книга";"омонимия не снята";"";"5";"48";"От «Романтических цветов» И до «Колчана» я все тот же, Как Рим от хижин и шатров До белых портиков и лоджий.";"c056ec503be1687c7530bde476ae3c4f:2:17"
" авд ужиВ ;кувз ястишылс енм и";"еылеб";"и мне слышится звук; Вижу два";"белые";" ";"стебля высоко закинутых рук,";"Н. С. Гумилев. «Долго молили о танце мы вас, но молили напрасно…» (1914)";"Н. С. Гумилев";"1886";"«Долго молили о танце мы вас, но молили напрасно…»";"1914";"художественная";"";"";"";"1988";"книга";"омонимия не снята";"";"12";"149";"Ангельской арфы струна порвалась, и мне слышится звук; Вижу два белые стебля высоко закинутых рук,";"62702d1bd0a5c589fd34c122d461b80a:4:10"
" мынтахраб еынбодоп ,еынчон ыбуГ";"мынсарк";"Губы ночные, подобные бархатным";"красным";" ";"цветам… Значит, танцуете все-таки вы, отказавшая";"Н. С. Гумилев. «Долго молили о танце мы вас, но молили напрасно…» (1914)";"Н. С. Гумилев";"1886";"«Долго молили о танце мы вас, но молили напрасно…»";"1914";"художественная";"";"";"";"1988";"книга";"омонимия не снята";"";"12";"149";"Губы ночные, подобные бархатным красным цветам… Значит, танцуете все-таки вы, отказавшая нам!";"62702d1bd0a5c589fd34c122d461b80a:5:4"
" В";"йенис";"В";"синей";" ";"тунике из неба ночного затянутый стан";"Н. С. Гумилев. «Долго молили о танце мы вас, но молили напрасно…» (1914)";"Н. С. Гумилев";"1886";"«Долго молили о танце мы вас, но молили напрасно…»";"1914";"художественная";"";"";"";"1988";"книга";"омонимия не снята";"";"12";"149";"В синей тунике из неба ночного затянутый стан Вдруг разрывает стремительно залитый светом туман,";"62702d1bd0a5c589fd34c122d461b80a:6:1"
" в но тянирП юовс укум юукдалс";"енис";"сладкую муку свою Принят он в";"сине";"-";"хрустальном высоком Господнем раю.";"Н. С. Гумилев. «Долго молили о танце мы вас, но молили напрасно…» (1914)";"Н. С. Гумилев";"1886";"«Долго молили о танце мы вас, но молили напрасно…»";"1914";"художественная";"";"";"";"1988";"книга";"омонимия не снята";"";"12";"149";"Если за горькое счастье и сладкую муку свою Принят он в сине-хрустальном высоком Господнем раю.";"62702d1bd0a5c589fd34c122d461b80a:9:11"
