"Reversed left context";"Reversed center";"Left context";"Center";"Punct";"Right context";"Title";"Author";"Birthday";"Header";"Created";"Sphere";"Type";"Topic";"Publication";"Publ_year";"Medium";"Ambiguity";"Audience_age";"Sentences";"Words";"Full context";"Example source"
" с ьталед ман отч оН";"йовозор";"Но что нам делать с";"розовой";" ";"зарей Над холодеющими небесами, Где тишина";"Н. С. Гумилев. Шестое чувство  («Прекрасно в нас влюбленное вино…») (1921)";"Н. С. Гумилев";"1886";"Шестое чувство  («Прекрасно в нас влюбленное вино…»)";"1921";"художественная";"";"";"";"1988";"книга";"омонимия не снята";"";"9";"126";"Но что нам делать с розовой зарей Над холодеющими небесами, Где тишина и неземной покой, Что делать нам с бессмертными стихами?";"030950e98345814edc52b2acbe0acda1:2:5"
" даН ытаказ тюалып как ,лертомс ончепсеб";"юонелез";"беспечно смотрел, как пылают закаты Над";"зеленою";" ";"крышей далеких лесов.";"Н. С. Гумилев. Экваториальный лес  («Я поставил палатку на каменном склоне…») (1921)";"Н. С. Гумилев";"1886";"Экваториальный лес  («Я поставил палатку на каменном склоне…»)";"1921";"художественная";"";"";"";"1988";"книга";"омонимия не снята";"";"39";"512";"Я поставил палатку на каменном склоне Абиссинских сбегающих к западу гор И беспечно смотрел, как пылают закаты Над зеленою крышей далеких лесов.";"53de79da79e5efdaa004453f6ed90494:1:18"
" С ыцитп от-еикак адутто илателирП";"имындурмузи";"Прилетали оттуда какие-то птицы С";"изумрудными";" ";"перьями в длинных хвостах, По ночам";"Н. С. Гумилев. Экваториальный лес  («Я поставил палатку на каменном склоне…») (1921)";"Н. С. Гумилев";"1886";"Экваториальный лес  («Я поставил палатку на каменном склоне…»)";"1921";"художественная";"";"";"";"1988";"книга";"омонимия не снята";"";"39";"512";"Прилетали оттуда какие-то птицы С изумрудными перьями в длинных хвостах, По ночам выбегали веселые зебры, Мне был слышен их храп и удары копыт.";"53de79da79e5efdaa004453f6ed90494:2:5"
" оннебосо лыб таказ ыджандо И";"несарк";"И однажды закат был особенно";"красен";", ";"И особенный запах летел от лесов";"Н. С. Гумилев. Экваториальный лес  («Я поставил палатку на каменном склоне…») (1921)";"Н. С. Гумилев";"1886";"Экваториальный лес  («Я поставил палатку на каменном склоне…»)";"1921";"художественная";"";"";"";"1988";"книга";"омонимия не снята";"";"39";"512";"И однажды закат был особенно красен, И особенный запах летел от лесов, И к палатке моей подошел европеец, Исхудалый, небритый, и есть попросил.";"53de79da79e5efdaa004453f6ed90494:3:5"
" онневтрем кат но умечоп ,лисорпс Я";"неделб";"Я спросил, почему он так мертвенно";"бледен";", ";"Почему его руки сухие дрожат, Как";"Н. С. Гумилев. Экваториальный лес  («Я поставил палатку на каменном склоне…») (1921)";"Н. С. Гумилев";"1886";"Экваториальный лес  («Я поставил палатку на каменном склоне…»)";"1921";"художественная";"";"";"";"1988";"книга";"омонимия не снята";"";"39";"512";"Я спросил, почему он так мертвенно бледен, Почему его руки сухие дрожат, Как листы… «Лихорадка великого леса», ― Он ответил и с ужасом глянул назад.";"53de79da79e5efdaa004453f6ed90494:5:6"
" и йылог ,сяоп оп енм ,килрак";"йынреч";"карлик, мне по пояс, голый и";"черный";", ";"Мне казалось, что он не умел";"Н. С. Гумилев. Экваториальный лес  («Я поставил палатку на каменном склоне…») (1921)";"Н. С. Гумилев";"1886";"Экваториальный лес  («Я поставил палатку на каменном склоне…»)";"1921";"художественная";"";"";"";"1988";"книга";"омонимия не снята";"";"39";"512";"Был с ним карлик, мне по пояс, голый и черный, Мне казалось, что он не умел говорить, Точно пес, он сидел за своим господином, Положив на колени бульдожье лицо.";"53de79da79e5efdaa004453f6ed90494:8:9"
" каК« :лахыдзв нО";"онмет";"Он вздыхал: «Как";"темно";"… ";"этот лес бесконечен… Не увидеть нам";"Н. С. Гумилев. Экваториальный лес  («Я поставил палатку на каменном склоне…») (1921)";"Н. С. Гумилев";"1886";"Экваториальный лес  («Я поставил палатку на каменном склоне…»)";"1921";"художественная";"";"";"";"1988";"книга";"омонимия не снята";"";"39";"512";"Он вздыхал: «Как темно… этот лес бесконечен… Не увидеть нам солнца уже никогда… Пьер, дневник у тебя?";"53de79da79e5efdaa004453f6ed90494:11:3"
" илуникоп сан умечоП";"еынреч";"Почему нас покинули";"черные";" ";"люди?";"Н. С. Гумилев. Экваториальный лес  («Я поставил палатку на каменном склоне…») (1921)";"Н. С. Гумилев";"1886";"Экваториальный лес  («Я поставил палатку на каменном склоне…»)";"1921";"художественная";"";"";"";"1988";"книга";"омонимия не снята";"";"39";"512";"Лучше жизнь потерять нам, чем этот дневник! Почему нас покинули черные люди? Горе, компасы наши они унесли… Что нам делать?";"53de79da79e5efdaa004453f6ed90494:14:3"
" аН йижеребоп хытурк У";"монелез";"У крутых побережий На";"зеленом";" ";"лугу Липы, ясени те же, Что";"Н. С. Гумилев. Алжир и Тунис  («От Европы старинной…») (1918-1921)";"Н. С. Гумилев";"1886";"Алжир и Тунис  («От Европы старинной…»)";"1918-1921";"художественная";"";"";"";"1988";"книга";"омонимия не снята";"";"22";"239";"У крутых побережий На зеленом лугу Липы, ясени те же, Что на том берегу.";"ee18f2a3fb3e7eca0cc29f5004d18e4e:4:4"
" и алежяТ адаморг асалтА И";"анреч";"И Атласа громада Тяжела и";"черна";", ";"Словно Сьерра-Невада Ей от века";"Н. С. Гумилев. Алжир и Тунис  («От Европы старинной…») (1918-1921)";"Н. С. Гумилев";"1886";"Алжир и Тунис  («От Европы старинной…»)";"1918-1921";"художественная";"";"";"";"1988";"книга";"омонимия не снята";"";"22";"239";"И Атласа громада Тяжела и черна, Словно Сьерра-Невада Ей от века родна.";"ee18f2a3fb3e7eca0cc29f5004d18e4e:5:5"
" инытсуп зи тузлоп есВ";"йежыР";"Все ползут из пустыни";"Рыжей";" ";"стаей пески.";"Н. С. Гумилев. Алжир и Тунис  («От Европы старинной…») (1918-1921)";"Н. С. Гумилев";"1886";"Алжир и Тунис  («От Европы старинной…»)";"1918-1921";"художественная";"";"";"";"1988";"книга";"омонимия не снята";"";"22";"239";"Все ползут из пустыни Рыжей стаей пески.";"ee18f2a3fb3e7eca0cc29f5004d18e4e:17:4"
" окьлоТ";"йылеб";"Только";"белый";" ";"бороться Рад со всяким врагом: Вырывает";"Н. С. Гумилев. Алжир и Тунис  («От Европы старинной…») (1918-1921)";"Н. С. Гумилев";"1886";"Алжир и Тунис  («От Европы старинной…»)";"1918-1921";"художественная";"";"";"";"1988";"книга";"омонимия не снята";"";"22";"239";"Только белый бороться Рад со всяким врагом: Вырывает колодцы, Садит пальмы кругом.";"ee18f2a3fb3e7eca0cc29f5004d18e4e:19:1"
" ывед еынжен как ,И";"йотолоЗ";"И, как нежные девы";"Золотой";" ";"старины, В тихом поле посевы Им";"Н. С. Гумилев. Алжир и Тунис  («От Европы старинной…») (1918-1921)";"Н. С. Гумилев";"1886";"Алжир и Тунис  («От Европы старинной…»)";"1918-1921";"художественная";"";"";"";"1988";"книга";"омонимия не снята";"";"22";"239";"И, как нежные девы Золотой старины, В тихом поле посевы Им одним спасены.  <1918 ― 1921>";"ee18f2a3fb3e7eca0cc29f5004d18e4e:21:4"
" с унищнеж ыТ";"имындолох";"Ты женщину с";"холодными";" ";"глазами, Влюбленную лишь в самое себя";"Н. С. Гумилев. Леопарди  («О праздниках, о звоне струн, о нарде…») (1918-1921)";"Н. С. Гумилев";"1886";"Леопарди  («О праздниках, о звоне струн, о нарде…»)";"1918-1921";"художественная";"";"";"";"1988";"книга";"омонимия не снята";"";"6";"68";"Ты женщину с холодными глазами, Влюбленную лишь в самое себя, И родину любил под небесами.";"aa9ca90db62e9ec372d874bf5295c002:3:3"
" анаеко нлов хижевс аз-зИ";"йынсарК";"Из-за свежих волн океана";"Красный";" ";"бык приподнял рога, И бежали лани";"Н. С. Гумилев. Поэма начала  («Из-за свежих волн океана…») (1918-1921)";"Н. С. Гумилев";"1886";"Поэма начала  («Из-за свежих волн океана…»)";"1918-1921";"художественная";"";"";"";"1988";"книга";"омонимия не снята";"";"94";"1231";"Из-за свежих волн океана Красный бык приподнял рога, И бежали лани тумана Под скалистые берега.";"7a147dcfc3280895041ed89fc6140cd4:5:4"
" инет йорыс йонмушогонм В имагереб имытсилакс";"имытсирбереС";"скалистыми берегами В многошумной сырой тени";"Серебристыми";" ";"жемчугами Оседали на мох они.";"Н. С. Гумилев. Поэма начала  («Из-за свежих волн океана…») (1918-1921)";"Н. С. Гумилев";"1886";"Поэма начала  («Из-за свежих волн океана…»)";"1918-1921";"художественная";"";"";"";"1988";"книга";"омонимия не снята";"";"94";"1231";"Под скалистыми берегами В многошумной сырой тени Серебристыми жемчугами Оседали на мох они.";"7a147dcfc3280895041ed89fc6140cd4:6:7"
"";"йынсарК";"";"Красный";" ";"бык изменяет лица: Вот широко крылья";"Н. С. Гумилев. Поэма начала  («Из-за свежих волн океана…») (1918-1921)";"Н. С. Гумилев";"1886";"Поэма начала  («Из-за свежих волн океана…»)";"1918-1921";"художественная";"";"";"";"1988";"книга";"омонимия не снята";"";"94";"1231";"Красный бык изменяет лица: Вот широко крылья простер И парит, огромная птица, Пожирающая простор.";"7a147dcfc3280895041ed89fc6140cd4:7:0"
" мяревд к тоВ";"йобулог";"Вот к дверям";"голубой";" ";"кумирни, Ключ держа от тайн и";"Н. С. Гумилев. Поэма начала  («Из-за свежих волн океана…») (1918-1921)";"Н. С. Гумилев";"1886";"Поэма начала  («Из-за свежих волн океана…»)";"1918-1921";"художественная";"";"";"";"1988";"книга";"омонимия не снята";"";"94";"1231";"Вот к дверям голубой кумирни, Ключ держа от тайн и чудес, Он восходит, стрелок и лирник, По открытой тропе небес.";"7a147dcfc3280895041ed89fc6140cd4:8:3"
" теавилаН";"мынелез";"Наливает";"зеленым";" ";"соком Детски нежные стебли трав И";"Н. С. Гумилев. Поэма начала  («Из-за свежих волн океана…») (1918-1921)";"Н. С. Гумилев";"1886";"Поэма начала  («Из-за свежих волн океана…»)";"1918-1921";"художественная";"";"";"";"1988";"книга";"омонимия не снята";"";"94";"1231";"Наливает зеленым соком Детски нежные стебли трав И багряным, дивно высоким Благородное сердце льва.";"7a147dcfc3280895041ed89fc6140cd4:12:1"
" И варт илбетс еынжен икстеД мокос";"мыняргаб";"соком Детски нежные стебли трав И";"багряным";", ";"дивно высоким Благородное сердце льва.";"Н. С. Гумилев. Поэма начала  («Из-за свежих волн океана…») (1918-1921)";"Н. С. Гумилев";"1886";"Поэма начала  («Из-за свежих волн океана…»)";"1918-1921";"художественная";"";"";"";"1988";"книга";"омонимия не снята";"";"94";"1231";"Наливает зеленым соком Детски нежные стебли трав И багряным, дивно высоким Благородное сердце льва.";"7a147dcfc3280895041ed89fc6140cd4:12:8"
" И авонс и авонс теавилорП косеп";"йынелез";"песок Проливает снова и снова И";"зеленый";" ";"и красный сок.";"Н. С. Гумилев. Поэма начала  («Из-за свежих волн океана…») (1918-1921)";"Н. С. Гумилев";"1886";"Поэма начала  («Из-за свежих волн океана…»)";"1918-1921";"художественная";"";"";"";"1988";"книга";"омонимия не снята";"";"94";"1231";"И, всегда желая иного, На голодный жаркий песок Проливает снова и снова И зеленый и красный сок.";"7a147dcfc3280895041ed89fc6140cd4:13:13"
" и йынелез И авонс и авонс";"йынсарк";"снова и снова И зеленый и";"красный";" ";"сок.";"Н. С. Гумилев. Поэма начала  («Из-за свежих волн океана…») (1918-1921)";"Н. С. Гумилев";"1886";"Поэма начала  («Из-за свежих волн океана…»)";"1918-1921";"художественная";"";"";"";"1988";"книга";"омонимия не снята";"";"94";"1231";"И, всегда желая иного, На голодный жаркий песок Проливает снова и снова И зеленый и красный сок.";"7a147dcfc3280895041ed89fc6140cd4:13:15"
" йобуг ясрет опуТ ,ропу йынжедан ваксытО";"йонелез";"Отыскав надежный упор, Тупо терся губой";"зеленой";" ";"О подножие Лунных гор.";"Н. С. Гумилев. Поэма начала  («Из-за свежих волн океана…») (1918-1921)";"Н. С. Гумилев";"1886";"Поэма начала  («Из-за свежих волн океана…»)";"1918-1921";"художественная";"";"";"";"1988";"книга";"омонимия не снята";"";"94";"1231";"Океан косматый и сонный, Отыскав надежный упор, Тупо терся губой зеленой О подножие Лунных гор.";"7a147dcfc3280895041ed89fc6140cd4:17:10"
" ,йынсебен лопук в ьсяарипУ ,алремаз и";"яавотситемА";"и замерла, Упираясь в купол небесный,";"Аметистовая";" ";"скала.";"Н. С. Гумилев. Поэма начала  («Из-за свежих волн океана…») (1918-1921)";"Н. С. Гумилев";"1886";"Поэма начала  («Из-за свежих волн океана…»)";"1918-1921";"художественная";"";"";"";"1988";"книга";"омонимия не снята";"";"94";"1231";"И над ним стеною отвесной Разбежалась и замерла, Упираясь в купол небесный, Аметистовая скала.";"7a147dcfc3280895041ed89fc6140cd4:18:12"
" и дов ешратС ,нос яапысод йовокеВ";"еелтевс";"Вековой досыпая сон, Старше вод и";"светлее";" ";"солнца, Золоточешуйный дракон.";"Н. С. Гумилев. Поэма начала  («Из-за свежих волн океана…») (1918-1921)";"Н. С. Гумилев";"1886";"Поэма начала  («Из-за свежих волн океана…»)";"1918-1921";"художественная";"";"";"";"1988";"книга";"омонимия не снята";"";"94";"1231";"Потому что свивал там кольца, Вековой досыпая сон, Старше вод и светлее солнца, Золоточешуйный дракон.";"7a147dcfc3280895041ed89fc6140cd4:20:11"
" ьсолазак ен уме И";"мылтевс";"И ему не казалось";"светлым";" ";"Солнце, юное для людей.";"Н. С. Гумилев. Поэма начала  («Из-за свежих волн океана…») (1918-1921)";"Н. С. Гумилев";"1886";"Поэма начала  («Из-за свежих волн океана…»)";"1918-1921";"художественная";"";"";"";"1988";"книга";"омонимия не снята";"";"94";"1231";"И ему не казалось светлым Солнце, юное для людей.";"7a147dcfc3280895041ed89fc6140cd4:25:4"
" оП ыннолок ястунят имадяР ";"мылеб";"Рядами тянутся колонны По";"белым";" ";"коридорам сна.";"Н. С. Гумилев : соавторы. «Рядами тянутся колонны…» (1918-1921)";"Н. С. Гумилев : соавторы";"1886";"«Рядами тянутся колонны…»";"1918-1921";"художественная";"";"";"";"1988";"книга";"омонимия не снята";"";"11";"153";"Рядами тянутся колонны По белым коридорам сна.";"078ea032a2075eea43f576b2fcde9b06:0:4"
" тедуб мав ануЛ« :мынмот тичорорп мосолог";"йылтевс";"голосом пророчит томным: «Луна вам будет";"светлый";" ";"дом Или Сатурн ― с его огромным";"Н. С. Гумилев : соавторы. «Рядами тянутся колонны…» (1918-1921)";"Н. С. Гумилев : соавторы";"1886";"«Рядами тянутся колонны…»";"1918-1921";"художественная";"";"";"";"1988";"книга";"омонимия не снята";"";"11";"153";"Нам голосом пророчит томным: «Луна вам будет светлый дом Или Сатурн ― с его огромным И ярко-пламенным кольцом.";"078ea032a2075eea43f576b2fcde9b06:4:7"
" И мынморго оге с ― нрутаС илИ";"окря";"Или Сатурн ― с его огромным И";"ярко";"-";"пламенным кольцом.";"Н. С. Гумилев : соавторы. «Рядами тянутся колонны…» (1918-1921)";"Н. С. Гумилев : соавторы";"1886";"«Рядами тянутся колонны…»";"1918-1921";"художественная";"";"";"";"1988";"книга";"омонимия не снята";"";"11";"153";"Нам голосом пророчит томным: «Луна вам будет светлый дом Или Сатурн ― с его огромным И ярко-пламенным кольцом.";"078ea032a2075eea43f576b2fcde9b06:4:15"
" но И ,илачлом ым оН ";"еенмет";"Но мы молчали, И он";"темнее";" ";"тучи стал, И взгляд его острее";"Н. С. Гумилев : соавторы. «Рядами тянутся колонны…» (1918-1921)";"Н. С. Гумилев : соавторы";"1886";"«Рядами тянутся колонны…»";"1918-1921";"художественная";"";"";"";"1988";"книга";"омонимия не снята";"";"11";"153";"Но мы молчали, И он темнее тучи стал, И взгляд его острее стали Колол и ранил, как кинжал.";"078ea032a2075eea43f576b2fcde9b06:8:5"
" йовирг яасяртоп ,нО";"йежыр";"Он, потрясая гривой";"рыжей";", ";"Грозил нам манием руки, Его крылатые";"Н. С. Гумилев : соавторы. «Рядами тянутся колонны…» (1918-1921)";"Н. С. Гумилев : соавторы";"1886";"«Рядами тянутся колонны…»";"1918-1921";"художественная";"";"";"";"1988";"книга";"омонимия не снята";"";"11";"153";"Он, потрясая гривой рыжей, Грозил нам манием руки, Его крылатые быки К нам подходили ближе, ближе.";"078ea032a2075eea43f576b2fcde9b06:9:3"
" ";"еотлеЖ";"";"Желтое";" ";"поле, Солнечный полдень, Старая липа.";"Н. С. Гумилев. «Желтое поле…» (1906-1921)";"Н. С. Гумилев";"1886";"«Желтое поле…»";"1906-1921";"художественная";"";"";"";"1988";"книга";"омонимия не снята";"";"4";"41";"Желтое поле, Солнечный полдень, Старая липа. Маленький мальчик Тихо читает Хорошую книгу.";"b9f546f5bbf66753c110bc69cfbe470a:0:0"
" ,ьнедлоп йиксьлюИ тедубазоп И мылсорзв тенатС";"еотлеЖ";"Станет взрослым И позабудет Июльский полдень,";"Желтое";" ";"поле.";"Н. С. Гумилев. «Желтое поле…» (1906-1921)";"Н. С. Гумилев";"1886";"«Желтое поле…»";"1906-1921";"художественная";"";"";"";"1988";"книга";"омонимия не снята";"";"4";"41";"Минут годы, Маленький мальчик Станет взрослым И позабудет Июльский полдень, Желтое поле.";"b9f546f5bbf66753c110bc69cfbe470a:2:10"
