"Reversed left context";"Reversed center";"Left context";"Center";"Punct";"Right context";"Title";"Author";"Birthday";"Header";"Created";"Sphere";"Type";"Topic";"Publication";"Publ_year";"Medium";"Ambiguity";"Audience_age";"Sentences";"Words";"Full context";"Example source"
" зи такаЗ";"оготолоз";"Закат из";"золотого";" ";"стал как медь, Покрылись облака зеленой";"Н. С. Гумилев. «Закат из золотого стал как медь…» [Душа и тело, 2] (1921)";"Н. С. Гумилев";"1886";"«Закат из золотого стал как медь…»";"1921";"художественная";"";"";"";"1988";"книга";"омонимия не снята";"";"6";"103";"Закат из золотого стал как медь, Покрылись облака зеленой ржою, И телу я сказал тогда: «Ответь На все, провозглашенное душою».";"0d10916c3a7a90fddb67c6dad6e75df5:1:2"
" акалбо ьсилыркоП ,ьдем как латс оготолоз";"йонелез";"золотого стал как медь, Покрылись облака";"зеленой";" ";"ржою, И телу я сказал тогда";"Н. С. Гумилев. «Закат из золотого стал как медь…» [Душа и тело, 2] (1921)";"Н. С. Гумилев";"1886";"«Закат из золотого стал как медь…»";"1921";"художественная";"";"";"";"1988";"книга";"омонимия не снята";"";"6";"103";"Закат из золотого стал как медь, Покрылись облака зеленой ржою, И телу я сказал тогда: «Ответь На все, провозглашенное душою».";"0d10916c3a7a90fddb67c6dad6e75df5:1:8"
" цясем илсе ,теов йыротоК ,сеп немузар";"летевс";"разумен пес, Который воет, если месяц";"светел";"?  ";"";"Н. С. Гумилев. «Когда же слово Бога с высоты…» [Душа и тело, 3] (1921)";"Н. С. Гумилев";"1886";"«Когда же слово Бога с высоты…»";"1921";"художественная";"";"";"";"1988";"книга";"омонимия не снята";"";"7";"102";"На них я взоры медленно вознес И милостиво дерзостным ответил: «Скажите мне, ужель разумен пес, Который воет, если месяц светел?";"b67a2d7e5a7e243510147b6c1ffc6f04:3:19"
" оД янд огонмез оговреп то корс";"огонненго";"срок от первого земного дня До";"огненного";" ";"светопреставленья?";"Н. С. Гумилев. «Когда же слово Бога с высоты…» [Душа и тело, 3] (1921)";"Н. С. Гумилев";"1886";"«Когда же слово Бога с высоты…»";"1921";"художественная";"";"";"";"1988";"книга";"омонимия не снята";"";"7";"102";"Ужели вам допрашивать меня, Меня, кому единое мгновенье ― Весь срок от первого земного дня До огненного светопреставленья?";"b67a2d7e5a7e243510147b6c1ffc6f04:4:15"
" и йеннемалп ецнлоС еренеВ едзевз йокелад";"йетситолоз";"далекой звезде Венере Солнце пламенней и";"золотистей";".  ";"";"Н. С. Гумилев. «На далекой звезде Венере…» (1921)";"Н. С. Гумилев";"1886";"«На далекой звезде Венере…»";"1921";"художественная";"";"";"";"1988";"книга";"омонимия не снята";"";"10";"101";"На далекой звезде Венере Солнце пламенней и золотистей.";"1eee6aeccc6fb6cfe8e0892fc55b18cf:0:7"
" веьверед У еренеВ ан ,ха ,еренеВ";"еинис";"Венере, ах, на Венере У деревьев";"синие";" ";"листья.";"Н. С. Гумилев. «На далекой звезде Венере…» (1921)";"Н. С. Гумилев";"1886";"«На далекой звезде Венере…»";"1921";"художественная";"";"";"";"1988";"книга";"омонимия не снята";"";"10";"101";"На Венере, ах, на Венере У деревьев синие листья.";"1eee6aeccc6fb6cfe8e0892fc55b18cf:1:7"
" еар менверд о ― »оа« ,»оУ« ";"еотолоЗ";"«Уо», «ао» ― о древнем рае";"Золотое";" ";"воспоминанье.";"Н. С. Гумилев. «На далекой звезде Венере…» (1921)";"Н. С. Гумилев";"1886";"«На далекой звезде Венере…»";"1921";"художественная";"";"";"";"1988";"книга";"омонимия не снята";"";"10";"101";"«Уо», «ао» ― о древнем рае Золотое воспоминанье.";"1eee6aeccc6fb6cfe8e0892fc55b18cf:6:5"
" тюаджулб И";"еытолоз";"И блуждают";"золотые";" ";"дымы В синих, синих вечерних кущах";"Н. С. Гумилев. «На далекой звезде Венере…» (1921)";"Н. С. Гумилев";"1886";"«На далекой звезде Венере…»";"1921";"художественная";"";"";"";"1988";"книга";"омонимия не снята";"";"10";"101";"И блуждают золотые дымы В синих, синих вечерних кущах Иль, как радостные пилигримы, Навещают еще живущих.  <1921>";"1eee6aeccc6fb6cfe8e0892fc55b18cf:9:2"
" В ымыд еытолоз тюаджулб И";"хинис";"И блуждают золотые дымы В";"синих";", ";"синих вечерних кущах Иль, как радостные";"Н. С. Гумилев. «На далекой звезде Венере…» (1921)";"Н. С. Гумилев";"1886";"«На далекой звезде Венере…»";"1921";"художественная";"";"";"";"1988";"книга";"омонимия не снята";"";"10";"101";"И блуждают золотые дымы В синих, синих вечерних кущах Иль, как радостные пилигримы, Навещают еще живущих.  <1921>";"1eee6aeccc6fb6cfe8e0892fc55b18cf:9:5"
" ,хинис В ымыд еытолоз тюаджулб И";"хинис";"И блуждают золотые дымы В синих,";"синих";" ";"вечерних кущах Иль, как радостные пилигримы";"Н. С. Гумилев. «На далекой звезде Венере…» (1921)";"Н. С. Гумилев";"1886";"«На далекой звезде Венере…»";"1921";"художественная";"";"";"";"1988";"книга";"омонимия не снята";"";"10";"101";"И блуждают золотые дымы В синих, синих вечерних кущах Иль, как радостные пилигримы, Навещают еще живущих.  <1921>";"1eee6aeccc6fb6cfe8e0892fc55b18cf:9:6"
" ,тищ йынжедан йом ,ерог отэ оТ";"еондолоХ";"То это горе, мой надежный щит,";"Холодное";" ";"презрительное горе».";"Н. С. Гумилев. «Над городом плывет ночная тишь…» [Душа и тело, 1] (1921)";"Н. С. Гумилев";"1886";"«Над городом плывет ночная тишь…»";"1921";"художественная";"";"";"";"1988";"книга";"омонимия не снята";"";"8";"107";"И если что еще меня роднит С былым, мерцающим в планетном хоре, То это горе, мой надежный щит, Холодное презрительное горе».";"c1edd092d5dfa5bcd4db48cd939dba26:7:18"
" ьшиЛ";"яалеб";"Лишь";"белая";", ";"в белой одежде, Как в пеплуме";"Н. С. Гумилев. «Я сам над собой насмеялся…» (1921)";"Н. С. Гумилев";"1886";"«Я сам над собой насмеялся…»";"1921";"художественная";"";"";"";"1988";"книга";"омонимия не снята";"";"6";"91";"Лишь белая, в белой одежде, Как в пеплуме древних богинь, Ты держишь хрустальную сферу В прозрачных и тонких перстах.";"789bd2c12c909d6cf3088d31eaa408db:1:1"
" в ,яалеб ьшиЛ";"йолеб";"Лишь белая, в";"белой";" ";"одежде, Как в пеплуме древних богинь";"Н. С. Гумилев. «Я сам над собой насмеялся…» (1921)";"Н. С. Гумилев";"1886";"«Я сам над собой насмеялся…»";"1921";"художественная";"";"";"";"1988";"книга";"омонимия не снята";"";"6";"91";"Лишь белая, в белой одежде, Как в пеплуме древних богинь, Ты держишь хрустальную сферу В прозрачных и тонких перстах.";"789bd2c12c909d6cf3088d31eaa408db:1:3"
" ьшижред ыТ ,ьнигоб хинверд емулпеп в";"юуньлатсурх";"в пеплуме древних богинь, Ты держишь";"хрустальную";" ";"сферу В прозрачных и тонких перстах.";"Н. С. Гумилев. «Я сам над собой насмеялся…» (1921)";"Н. С. Гумилев";"1886";"«Я сам над собой насмеялся…»";"1921";"художественная";"";"";"";"1988";"книга";"омонимия не снята";"";"6";"91";"Лишь белая, в белой одежде, Как в пеплуме древних богинь, Ты держишь хрустальную сферу В прозрачных и тонких перстах.";"789bd2c12c909d6cf3088d31eaa408db:1:12"
" авд каК ,тюер инемалп еыннилд маТ";"еытолоз";"Там длинные пламени реют, Как два";"золотые";" ";"крыла.  <1921>";"Н. С. Гумилев. «Я сам над собой насмеялся…» (1921)";"Н. С. Гумилев";"1886";"«Я сам над собой насмеялся…»";"1921";"художественная";"";"";"";"1988";"книга";"омонимия не снята";"";"6";"91";"Там длинные пламени реют, Как два золотые крыла.  <1921>";"789bd2c12c909d6cf3088d31eaa408db:5:6"
" огонйуб могереб уджеМ";"огонсарК";"Между берегом буйного";"Красного";" ";"моря И суданским таинственным лесом видна";"Н. С. Гумилев. Абиссиния  («Между берегом буйного Красного моря…») (1921)";"Н. С. Гумилев";"1886";"Абиссиния  («Между берегом буйного Красного моря…»)";"1921";"художественная";"";"";"";"1988";"книга";"омонимия не снята";"";"27";"504";"Между берегом буйного Красного моря И суданским таинственным лесом видна, Разметавшись среди четырех плоскогорий, С отдыхающей львицею схожа, страна.";"0126b0ea0781f886ec9be02eab83d034:1:3"
" иемЗ ,яарк зеб и анд зеб";"еынреч";"без дна и без края, Змеи";"черные";" ";"подступы к ним стерегут, Их сестер";"Н. С. Гумилев. Абиссиния  («Между берегом буйного Красного моря…») (1921)";"Н. С. Гумилев";"1886";"Абиссиния  («Между берегом буйного Красного моря…»)";"1921";"художественная";"";"";"";"1988";"книга";"омонимия не снята";"";"27";"504";"Север ― это болота без дна и без края, Змеи черные подступы к ним стерегут, Их сестер-лихорадок зловещая стая, Желтолицая, здесь обрела свой приют.";"0126b0ea0781f886ec9be02eab83d034:2:9"
" и ыретнап ьсилиатирП ,ываду ьсилиатирп йен";"еижыр";"ней притаились удавы, Притаились пантеры и";"рыжие";" ";"львы.";"Н. С. Гумилев. Абиссиния  («Между берегом буйного Красного моря…») (1921)";"Н. С. Гумилев";"1886";"Абиссиния  («Между берегом буйного Красного моря…»)";"1921";"художественная";"";"";"";"1988";"книга";"омонимия не снята";"";"27";"504";"В ней притаились удавы, Притаились пантеры и рыжие львы.";"0126b0ea0781f886ec9be02eab83d034:14:7"
" И алес еылесев ,ызор и ыромокиС";"йынелез";"Сикоморы и розы, веселые села И";"зеленый";", ";"народом пестреющий луг.";"Н. С. Гумилев. Абиссиния  («Между берегом буйного Красного моря…») (1921)";"Н. С. Гумилев";"1886";"Абиссиния  («Между берегом буйного Красного моря…»)";"1921";"художественная";"";"";"";"1988";"книга";"омонимия не снята";"";"27";"504";"По обрывам и кручам дорогой тяжелой Поднимись, и нежданно увидишь вокруг Сикоморы и розы, веселые села И зеленый, народом пестреющий луг.";"0126b0ea0781f886ec9be02eab83d034:15:17"
" в ьсишвакчапереП ,яачолом вотсук ьдерс тачыр";"молеб";"рычат средь кустов молочая, Перепачкавшись в";"белом";" ";"и липком соку, Мчатся всадники, длинные";"Н. С. Гумилев. Абиссиния  («Между берегом буйного Красного моря…») (1921)";"Н. С. Гумилев";"1886";"Абиссиния  («Между берегом буйного Красного моря…»)";"1921";"художественная";"";"";"";"1988";"книга";"омонимия не снята";"";"27";"504";"Павианы рычат средь кустов молочая, Перепачкавшись в белом и липком соку, Мчатся всадники, длинные копья бросая, Из винтовок стреляя на полном скаку.";"0126b0ea0781f886ec9be02eab83d034:20:7"
" агенс то мецнлос миксечипорт доП ынишрев";"ылеб";"вершины Под тропическим солнцем от снега";"белы";".  ";"";"Н. С. Гумилев. Абиссиния  («Между берегом буйного Красного моря…») (1921)";"Н. С. Гумилев";"1886";"Абиссиния  («Между берегом буйного Красного моря…»)";"1921";"художественная";"";"";"";"1988";"книга";"омонимия не снята";"";"27";"504";"Выше только утесы, нагие стремнины, Где кочуют ветра да ликуют орлы, Человек не взбирался туда, и вершины Под тропическим солнцем от снега белы.";"0126b0ea0781f886ec9be02eab83d034:21:22"
" и юьтсок юовонолс аЗ ынартс еынтсевзиен";"мотолоз";"неизвестные страны За слоновою костью и";"золотом";" ";"гор.";"Н. С. Гумилев. Абиссиния  («Между берегом буйного Красного моря…») (1921)";"Н. С. Гумилев";"1886";"Абиссиния  («Между берегом буйного Красного моря…»)";"1921";"художественная";"";"";"";"1988";"книга";"омонимия не снята";"";"27";"504";"И повсюду, вверху и внизу, караваны Видят солнце и пьют неоглядный простор, Уходя в до сих пор неизвестные страны За слоновою костью и золотом гор.";"0126b0ea0781f886ec9be02eab83d034:22:23"
" менеми миом ьтавзан йаД ,укеволеч итуп";"юунреч";"пути человеку, Дай назвать моим именем";"черную";" ";"До сих пор неоткрытую реку;";"Н. С. Гумилев. Вступленье  («Оглушенная ревом и топотом…») (1921)";"Н. С. Гумилев";"1886";"Вступленье  («Оглушенная ревом и топотом…»)";"1921";"художественная";"";"";"";"1988";"книга";"омонимия не снята";"";"8";"135";"Дай за это дорогу мне торную Там, где нету пути человеку, Дай назвать моим именем черную До сих пор неоткрытую реку;";"45a8332e72695cf1aaaf3d61fb070285:6:15"
" И ырог еикид еиксречреЧ ьзовкС наварак";"хыдес";"караван Сквозь Черчерские дикие горы И";"седых";" ";"на деревьях стрелял обезьян, Засыпал средь";"Н. С. Гумилев. Галла  («Восемь дней от Харрара я вел караван…») (1921)";"Н. С. Гумилев";"1886";"Галла  («Восемь дней от Харрара я вел караван…»)";"1921";"художественная";"";"";"";"1988";"книга";"омонимия не снята";"";"14";"258";"Восемь дней от Харрара я вел караван Сквозь Черчерские дикие горы И седых на деревьях стрелял обезьян, Засыпал средь корней сикоморы.";"0800287eeca7104ffd81f71db80cba79:1:12"
" ончоТ ,ыртсок ,енинвар йоннеладто в ,узинв";"еынсарк";"внизу, в отдаленной равнине, костры, Точно";"красные";" ";"звезды, повсюду.";"Н. С. Гумилев. Галла  («Восемь дней от Харрара я вел караван…») (1921)";"Н. С. Гумилев";"1886";"Галла  («Восемь дней от Харрара я вел караван…»)";"1921";"художественная";"";"";"";"1988";"книга";"омонимия не снята";"";"14";"258";"На девятую ночь я увидел с горы ― Этот миг никогда не забуду ― Там внизу, в отдаленной равнине, костры, Точно красные звезды, повсюду.";"0800287eeca7104ffd81f71db80cba79:2:19"
" йещюяис в ичут ончоТ ,ино имигурд";"инис";"другими они, Точно тучи в сияющей";"сини";", ";"Ночи трижды святые и странные дни";"Н. С. Гумилев. Галла  («Восемь дней от Харрара я вел караван…») (1921)";"Н. С. Гумилев";"1886";"Галла  («Восемь дней от Харрара я вел караван…»)";"1921";"художественная";"";"";"";"1988";"книга";"омонимия не снята";"";"14";"258";"И помчались одни за другими они, Точно тучи в сияющей сини, Ночи трижды святые и странные дни На широкой галласской равнине.";"0800287eeca7104ffd81f71db80cba79:3:10"
" еишвадив ен адгокиН ,икыб илагебу янем";"хылеб";"меня убегали быки, Никогда не видавшие";"белых";".  ";"";"Н. С. Гумилев. Галла  («Восемь дней от Харрара я вел караван…») (1921)";"Н. С. Гумилев";"1886";"Галла  («Восемь дней от Харрара я вел караван…»)";"1921";"художественная";"";"";"";"1988";"книга";"омонимия не снята";"";"14";"258";"И как поят парным молоком старики Умирающих змей престарелых… И, мыча, от меня убегали быки, Никогда не видавшие белых.";"0800287eeca7104ffd81f71db80cba79:7:18"
" огеом йогулс ьтыБ ниотсод ыТ ";"оготолоз";"Ты достоин Быть слугой моего";"золотого";" ";"отца».";"Н. С. Гумилев. Дагомея : «Царь сказал своему полководцу: «Могучий…» (1921)";"Н. С. Гумилев";"1886";"Дагомея : «Царь сказал своему полководцу: «Могучий…»";"1921";"художественная";"";"";"";"1988";"книга";"омонимия не снята";"";"10";"113";"Ты достоин Быть слугой моего золотого отца».";"7b86e5220698c99c58a37ccbc2dba9fa:5:5"
" иьняис в ― ьсолазак а ,едов в";"оготолоЗ";"в воде, а казалось ― в сияньи";"Золотого";" ";"закатного солнца тонул.";"Н. С. Гумилев. Дагомея : «Царь сказал своему полководцу: «Могучий…» (1921)";"Н. С. Гумилев";"1886";"Дагомея : «Царь сказал своему полководцу: «Могучий…»";"1921";"художественная";"";"";"";"1988";"книга";"омонимия не снята";"";"10";"113";"Полководец царю поклонился в молчаньи И с утеса в бурливую воду прыгнул, И тонул он в воде, а казалось ― в сияньи Золотого закатного солнца тонул.";"7b86e5220698c99c58a37ccbc2dba9fa:7:21"
" ончоТ ,икыдалв у оцил олатсилб И";"еонреч";"И блистало лицо у владыки, Точно";"черное";" ";"солнце подземной страны.";"Н. С. Гумилев. Дагомея : «Царь сказал своему полководцу: «Могучий…» (1921)";"Н. С. Гумилев";"1886";"Дагомея : «Царь сказал своему полководцу: «Могучий…»";"1921";"художественная";"";"";"";"1988";"книга";"омонимия не снята";"";"10";"113";"И блистало лицо у владыки, Точно черное солнце подземной страны.";"7b86e5220698c99c58a37ccbc2dba9fa:9:6"
" как ,тувылп есВ елесод ,наеко в";"еылеб";"в океан, доселе Все плывут, как";"белые";" ";"люди; И когда их довольно будет,";"Н. С. Гумилев. Дамара  («Человеку грешно гордиться…») (1921)";"Н. С. Гумилев";"1886";"Дамара  («Человеку грешно гордиться…»)";"1921";"художественная";"";"";"";"1988";"книга";"омонимия не снята";"";"12";"176";"А вот перья, что улетели Далеко в океан, доселе Все плывут, как белые люди; И когда их довольно будет,";"ebadd0d32fd2172af5336531872877db:10:12"
" В ,еьтсачс тюадевзи ьтяпо И итсач";"хылеб";"части И опять изведают счастье, В";"белых";" ";"перьях большая птица На своей земле";"Н. С. Гумилев. Дамара  («Человеку грешно гордиться…») (1921)";"Н. С. Гумилев";"1886";"Дамара  («Человеку грешно гордиться…»)";"1921";"художественная";"";"";"";"1988";"книга";"омонимия не снята";"";"12";"176";"Вновь срастутся былые части И опять изведают счастье, В белых перьях большая птица На своей земле поселится.";"ebadd0d32fd2172af5336531872877db:11:9"
" В ,ценедалм енс ов течалп каТ";"хынреч";"Так плачет во сне младенец, В";"черных";" ";"глазах томленье, Как у восточных пленниц.";"Н. С. Гумилев. Дева-птица  («Пастух веселый…») (1921)";"Н. С. Гумилев";"1886";"Дева-птица  («Пастух веселый…»)";"1921";"художественная";"";"";"";"1988";"книга";"омонимия не снята";"";"19";"261";"Прерывно пенье, Так плачет во сне младенец, В черных глазах томленье, Как у восточных пленниц.";"16681f908c8f40827e36358faf2ecc9a:4:8"
