"Reversed left context";"Reversed center";"Left context";"Center";"Punct";"Right context";"Title";"Author";"Birthday";"Header";"Created";"Sphere";"Type";"Topic";"Publication";"Publ_year";"Medium";"Ambiguity";"Audience_age";"Sentences";"Words";"Full context";"Example source"
" ыдзевз тятселб окосыВ";"йотолоЗ";"Высоко блестят звезды";"Золотой";" ";"бумаги, И дерутся два паяца, Скрестив";"Е. Г. Гуро. Детская шарманочка  («С ледяных сосулек искорки…») (1909)";"Е. Г. Гуро";"1877";"Детская шарманочка  («С ледяных сосулек искорки…»)";"1909";"художественная";"";"";"";"2002";"книга";"омонимия не снята";"";"10";"95";"Высоко блестят звезды Золотой бумаги, И дерутся два паяца, Скрестив шпаги.";"2cc1ec868a089faae8e711babf8288d6:5:3"
" и мылгурК мером аз окелад ,окелаД";"мыбулог";"Далеко, далеко за морем Круглым и";"голубым";" ";"Рдеют апельсины Под месяцем золотым.";"Е. Г. Гуро. Детская шарманочка  («С ледяных сосулек искорки…») (1909)";"Е. Г. Гуро";"1877";"Детская шарманочка  («С ледяных сосулек искорки…»)";"1909";"художественная";"";"";"";"2002";"книга";"омонимия не снята";"";"10";"95";"Арлекин поет песенку: ― Далеко, далеко за морем Круглым и голубым Рдеют апельсины Под месяцем золотым.";"2cc1ec868a089faae8e711babf8288d6:6:9"
" мецясем доП ынисьлепа тюедР мыбулог и";"мытолоз";"и голубым Рдеют апельсины Под месяцем";"золотым";".  ";"";"Е. Г. Гуро. Детская шарманочка  («С ледяных сосулек искорки…») (1909)";"Е. Г. Гуро";"1877";"Детская шарманочка  («С ледяных сосулек искорки…»)";"1909";"художественная";"";"";"";"2002";"книга";"омонимия не снята";"";"10";"95";"Арлекин поет песенку: ― Далеко, далеко за морем Круглым и голубым Рдеют апельсины Под месяцем золотым.";"2cc1ec868a089faae8e711babf8288d6:6:14"
" тядялг И";"еинис";"И глядят";"синие";" ";"звезды На счастливые мандарины И смеются";"Е. Г. Гуро. Детская шарманочка  («С ледяных сосулек искорки…») (1909)";"Е. Г. Гуро";"1877";"Детская шарманочка  («С ледяных сосулек искорки…»)";"1909";"художественная";"";"";"";"2002";"книга";"омонимия не снята";"";"10";"95";"И глядят синие звезды На счастливые мандарины И смеются блесткам золотым Под бряцанье мандолины.(1909)";"2cc1ec868a089faae8e711babf8288d6:9:2"
" мактселб ястюемс И ынираднам еывилтсачс аН";"мытолоз";"На счастливые мандарины И смеются блесткам";"золотым";" ";"Под бряцанье мандолины.(1909)";"Е. Г. Гуро. Детская шарманочка  («С ледяных сосулек искорки…») (1909)";"Е. Г. Гуро";"1877";"Детская шарманочка  («С ледяных сосулек искорки…»)";"1909";"художественная";"";"";"";"2002";"книга";"омонимия не снята";"";"10";"95";"И глядят синие звезды На счастливые мандарины И смеются блесткам золотым Под бряцанье мандолины.(1909)";"2cc1ec868a089faae8e711babf8288d6:9:10"
" ястялевеш инет в а ;тущеперт имактеном";"еынмет";"монетками трепещут; а в тени шевелятся";"темные";" ";"созданья: это тени чертят на листве";"Е. Г. Гуро. Днём  («Прядки на березе разовьются, вьются…») (1909)";"Е. Г. Гуро";"1877";"Днём  («Прядки на березе разовьются, вьются…»)";"1909";"художественная";"";"";"";"2002";"книга";"омонимия не снята";"";"10";"102";"Прядки освещенные монетками трепещут; а в тени шевелятся темные созданья: это тени чертят на листве узоры.";"b77b9c25332d4378296594d76b43fb3d:2:8"
"-овиргонмет юувеоб ьдашол в ьсалитарверп ;ымад";"юунелез";"дамы; превратилась в лошадь боевую темногриво-";"зеленую";"…  ";"";"Е. Г. Гуро. Днём  («Прядки на березе разовьются, вьются…») (1909)";"Е. Г. Гуро";"1877";"Днём  («Прядки на березе разовьются, вьются…»)";"1909";"художественная";"";"";"";"2002";"книга";"омонимия не снята";"";"10";"102";"Размахнулся нос у важной дамы; превратилась в лошадь боевую темногриво-зеленую…";"b77b9c25332d4378296594d76b43fb3d:4:10"
" абен илкетоп икчотсил в и ;ьсалавозарбо";"еылтевс";"образовалась; и в листочки потекли неба";"светлые";" ";"озера, неба светлые кружки: озеро в";"Е. Г. Гуро. Днём  («Прядки на березе разовьются, вьются…») (1909)";"Е. Г. Гуро";"1877";"Днём  («Прядки на березе разовьются, вьются…»)";"1909";"художественная";"";"";"";"2002";"книга";"омонимия не снята";"";"10";"102";"Расширялась, расширялась, и венком образовалась; и в листочки потекли неба светлые озера, неба светлые кружки: озеро в венке качается…";"b77b9c25332d4378296594d76b43fb3d:6:10"
" абен ,арезо еылтевс абен илкетоп икчотсил";"еылтевс";"листочки потекли неба светлые озера, неба";"светлые";" ";"кружки: озеро в венке качается…";"Е. Г. Гуро. Днём  («Прядки на березе разовьются, вьются…») (1909)";"Е. Г. Гуро";"1877";"Днём  («Прядки на березе разовьются, вьются…»)";"1909";"художественная";"";"";"";"2002";"книга";"омонимия не снята";"";"10";"102";"Расширялась, расширялась, и венком образовалась; и в листочки потекли неба светлые озера, неба светлые кружки: озеро в венке качается…";"b77b9c25332d4378296594d76b43fb3d:6:13"
" хи ,яьнедив ужелс я инет йещюат";"еынелез";"тающей тени я слежу виденья, их";"зеленые";" ";"кивки, маски и движенья, лёжа в";"Е. Г. Гуро. Днём  («Прядки на березе разовьются, вьются…») (1909)";"Е. Г. Гуро";"1877";"Днём  («Прядки на березе разовьются, вьются…»)";"1909";"художественная";"";"";"";"2002";"книга";"омонимия не снята";"";"10";"102";"В летней тающей тени я слежу виденья, их зеленые кивки, маски и движенья, лёжа в счастьи солнечной поры.(1909)";"b77b9c25332d4378296594d76b43fb3d:9:8"
" ежУ";"еылеб";"Уже";"белые";" ";"платьица мелькали, Уж косые лучи хотели";"Е. Г. Гуро. Едкое  («Пригласили! Наконец-то пригласили…») (1909)";"Е. Г. Гуро";"1877";"Едкое  («Пригласили! Наконец-то пригласили…»)";"1909";"художественная";"";"";"";"2002";"книга";"омонимия не снята";"";"21";"113";"Уже белые платьица мелькали, Уж косые лучи хотели счастья.";"d1c2dad097ec00d4d3f71356dd052716:5:1"
" лыб кожул ,йынешарк онволС ,пил уджеМ";"йынелез";"Между лип, Словно крашеный, лужок был";"зеленый";"!  ";"";"Е. Г. Гуро. Едкое  («Пригласили! Наконец-то пригласили…») (1909)";"Е. Г. Гуро";"1877";"Едкое  («Пригласили! Наконец-то пригласили…»)";"1909";"художественная";"";"";"";"2002";"книга";"омонимия не снята";"";"21";"113";"Между лип, Словно крашеный, лужок был зеленый!";"d1c2dad097ec00d4d3f71356dd052716:7:6"
" ясилидохсар ,хирнеГ ьрацыр лапорп каК";"еынмет";"Как пропал рыцарь Генрих, расходилися";"темные";" ";"силы, души Сарацинов неверных: скалы грызут";"Е. Г. Гуро. Из средневековья  («В небе колючие звезды…») (1909)";"Е. Г. Гуро";"1877";"Из средневековья  («В небе колючие звезды…»)";"1909";"художественная";"";"";"";"2002";"книга";"омонимия не снята";"";"16";"130";"Как пропал рыцарь Генрих, расходилися темные силы, души Сарацинов неверных: скалы грызут зубами, скрежещут и воют.";"1b7f51fe143c5ed6bd3a996cc1ae1396:5:5"
" молегнА« ";"мылеб";"«Ангелом";"белым";" ";"Пречистая Лилия, ты, безгрешная Жертва Вечерняя";"Е. Г. Гуро. Из средневековья  («В небе колючие звезды…») (1909)";"Е. Г. Гуро";"1877";"Из средневековья  («В небе колючие звезды…»)";"1909";"художественная";"";"";"";"2002";"книга";"омонимия не снята";"";"16";"130";"«Ангелом белым Пречистая Лилия, ты, безгрешная Жертва Вечерняя, Роза Эдемская, Елизавета!»";"1b7f51fe143c5ed6bd3a996cc1ae1396:6:1"
" йовт легна ябет сан аз тилоМ";"йылеб";"Молит за нас тебя ангел твой";"белый";", «";"наша заступница «Елизавета!";"Е. Г. Гуро. Из средневековья  («В небе колючие звезды…») (1909)";"Е. Г. Гуро";"1877";"Из средневековья  («В небе колючие звезды…»)";"1909";"художественная";"";"";"";"2002";"книга";"омонимия не снята";"";"16";"130";"«Молит за нас тебя ангел твой белый, «наша заступница «Елизавета!";"1b7f51fe143c5ed6bd3a996cc1ae1396:9:6"
" ьтсалв ,ьнигС« ";"яанмет";"«Сгинь, власть";"темная";" «";"от гроба непорочного.";"Е. Г. Гуро. Из средневековья  («В небе колючие звезды…») (1909)";"Е. Г. Гуро";"1877";"Из средневековья  («В небе колючие звезды…»)";"1909";"художественная";"";"";"";"2002";"книга";"омонимия не снята";"";"16";"130";"«Сгинь, власть темная «от гроба непорочного.  «Свечи четыре ― «Пречистый Крест «и лилии ― лилии, «молитвы христианские!»………………..";"1b7f51fe143c5ed6bd3a996cc1ae1396:10:2"
" в тюакьлем етолоб в икьногО";"йотиводя";"Огоньки в болоте мелькают в";"ядовитой";" ";"притихшей тине.";"Е. Г. Гуро. Из средневековья  («В небе колючие звезды…») (1909)";"Е. Г. Гуро";"1877";"Из средневековья  («В небе колючие звезды…»)";"1909";"художественная";"";"";"";"2002";"книга";"омонимия не снята";"";"16";"130";"Огоньки в болоте мелькают в ядовитой притихшей тине.";"1b7f51fe143c5ed6bd3a996cc1ae1396:12:5"
"";"микрЯ";"";"Ярким";" ";"огнем горит рампа.";"Е. Г. Гуро. Скука  («В черноте горячей листвы…») (1909)";"Е. Г. Гуро";"1877";"Скука  («В черноте горячей листвы…»)";"1909";"художественная";"";"";"";"2002";"книга";"омонимия не снята";"";"22";"125";"В шарманке вертятся, гудят, ревут валики. Ярким огнем горит рампа.";"1b93c48debaa1fd0aaa8de5f95436268:3:0"
" реев йовс тилевеш ettereiP";"йынреч";"Pierette шевелит свой веер";"черный";". ";"";"Е. Г. Гуро. Скука  («В черноте горячей листвы…») (1909)";"Е. Г. Гуро";"1877";"Скука  («В черноте горячей листвы…»)";"1909";"художественная";"";"";"";"2002";"книга";"омонимия не снята";"";"22";"125";"Над забытым столиком, в саду, фонарь или лампа. Pierette шевелит свой веер черный. Конфетти шуршит в аллейке сорной.";"1b93c48debaa1fd0aaa8de5f95436268:5:4"
" мат ястеачнев мераноф С";"яанреч";"С фонарем венчается там";"черная";" ";"ночь лета.";"Е. Г. Гуро. Скука  («В черноте горячей листвы…») (1909)";"Е. Г. Гуро";"1877";"Скука  («В черноте горячей листвы…»)";"1909";"художественная";"";"";"";"2002";"книга";"омонимия не снята";"";"22";"125";"С фонарем венчается там черная ночь лета.";"1b93c48debaa1fd0aaa8de5f95436268:17:4"
" ,япос и ятсивс ,ьсаливзВ";"яансарк";"Взвилась, свистя и сопя,";"красная";" ";"ракета.";"Е. Г. Гуро. Скука  («В черноте горячей листвы…») (1909)";"Е. Г. Гуро";"1877";"Скука  («В черноте горячей листвы…»)";"1909";"художественная";"";"";"";"2002";"книга";"омонимия не снята";"";"22";"125";"Взвилась, свистя и сопя, красная ракета.";"1b93c48debaa1fd0aaa8de5f95436268:18:4"
" кираноф ,хА ― ";"йывежнаро";"― Ах, фонарик";"оранжевый";", ― ";"приди! ―";"Е. Г. Гуро. Скука  («В черноте горячей листвы…») (1909)";"Е. Г. Гуро";"1877";"Скука  («В черноте горячей листвы…»)";"1909";"художественная";"";"";"";"2002";"книга";"омонимия не снята";"";"22";"125";"― Ах, фонарик оранжевый, ― приди! ―";"1b93c48debaa1fd0aaa8de5f95436268:19:2"
" В";"хынтевцонзар";"В";"разноцветных";" ";"зайчиках горит его лицо.(1909)";"Е. Г. Гуро. Скука  («В черноте горячей листвы…») (1909)";"Е. Г. Гуро";"1877";"Скука  («В черноте горячей листвы…»)";"1909";"художественная";"";"";"";"2002";"книга";"омонимия не снята";"";"22";"125";"Плачет глупый Пьерро. В разноцветных зайчиках горит его лицо.(1909)";"1b93c48debaa1fd0aaa8de5f95436268:21:1"
" тедйыВ";"ончармус";"Выйдет";"сумрачно";" ― ";"пышно одета, только шлейфом скользнет по";"Е. Г. Гуро. Старый романс  («Подана осторожно карета…») (1909)";"Е. Г. Гуро";"1877";"Старый романс  («Подана осторожно карета…»)";"1909";"художественная";"";"";"";"2002";"книга";"омонимия не снята";"";"9";"93";"Выйдет сумрачно ― пышно одета, только шлейфом скользнет по коврам.";"83df8d2dd0f4dd82c0ff8e25644de10e:2:1"
" ястунатсо И";"еырес";"И останутся";"серые";" ";"свечи, перед зеркалом ежить лучи.";"Е. Г. Гуро. Старый романс  («Подана осторожно карета…») (1909)";"Е. Г. Гуро";"1877";"Старый романс  («Подана осторожно карета…»)";"1909";"художественная";"";"";"";"2002";"книга";"омонимия не снята";"";"9";"93";"И останутся серые свечи, перед зеркалом ежить лучи.";"83df8d2dd0f4dd82c0ff8e25644de10e:3:2"
" от-отк тедйодоП";"йылеб";"Подойдет кто-то";"белый";", ";"белый, в отраженья свечой взойдет.";"Е. Г. Гуро. Старый романс  («Подана осторожно карета…») (1909)";"Е. Г. Гуро";"1877";"Старый романс  («Подана осторожно карета…»)";"1909";"художественная";"";"";"";"2002";"книга";"омонимия не снята";"";"9";"93";"Подойдет кто-то белый, белый, в отраженья свечой взойдет.";"83df8d2dd0f4dd82c0ff8e25644de10e:6:2"
" ,йылеб от-отк тедйодоП";"йылеб";"Подойдет кто-то белый,";"белый";", ";"в отраженья свечой взойдет.";"Е. Г. Гуро. Старый романс  («Подана осторожно карета…») (1909)";"Е. Г. Гуро";"1877";"Старый романс  («Подана осторожно карета…»)";"1909";"художественная";"";"";"";"2002";"книга";"омонимия не снята";"";"9";"93";"Подойдет кто-то белый, белый, в отраженья свечой взойдет.";"83df8d2dd0f4dd82c0ff8e25644de10e:6:3"
" в тедуб йоннелпорко ираз од мат";"монмет";"там до зари окропленной будет в";"темном";" ";"углу поджидать, и с улыбкой бледно";"Е. Г. Гуро. Старый романс  («Подана осторожно карета…») (1909)";"Е. Г. Гуро";"1877";"Старый романс  («Подана осторожно карета…»)";"1909";"художественная";"";"";"";"2002";"книга";"омонимия не снята";"";"9";"93";"Кто-то там до зари окропленной будет в темном углу поджидать, и с улыбкой бледно-принужденной в полусумраке утра встречать.";"83df8d2dd0f4dd82c0ff8e25644de10e:7:7"
" йокбылу с и ,ьтадиждоп улгу монмет";"онделб";"темном углу поджидать, и с улыбкой";"бледно";"-";"принужденной в полусумраке утра встречать.";"Е. Г. Гуро. Старый романс  («Подана осторожно карета…») (1909)";"Е. Г. Гуро";"1877";"Старый романс  («Подана осторожно карета…»)";"1909";"художественная";"";"";"";"2002";"книга";"омонимия не снята";"";"9";"93";"Кто-то там до зари окропленной будет в темном углу поджидать, и с улыбкой бледно-принужденной в полусумраке утра встречать.";"83df8d2dd0f4dd82c0ff8e25644de10e:7:13"
