"Reversed left context";"Reversed center";"Left context";"Center";"Punct";"Right context";"Title";"Author";"Birthday";"Header";"Created";"Sphere";"Type";"Topic";"Publication";"Publ_year";"Medium";"Ambiguity";"Audience_age";"Sentences";"Words";"Full context";"Example source"
" ипС";"онйокопс";"Спи";"спокойно";",\ ";"Баю-бай, В море канули часы, В";"Е. Г. Гуро. Вечернее  («Покачнулось море…») (1910-1913)";"Е. Г. Гуро";"1877";"Вечернее  («Покачнулось море…»)";"1910-1913";"художественная";"";"";"";"2002";"книга";"омонимия не снята";"";"18";"116";"Спи спокойно,\ Баю-бай, В море канули часы, В море лодка уплыла У сонули рыбака, Прошумела нам сосна, Облака тебе легли, Строятся дворцы вдали, вдали!..(1914)";"a332482c5efb5f7cb36828a69cead18b:17:1"
" и ыньливарп ымьрюТ";"ынйокопс";"Тюрьмы правильны и";"спокойны";". ";"";"Е. Г. Гуро. Город  («Пахнет кровью и позором с бойни…») (1910-1913)";"Е. Г. Гуро";"1877";"Город  («Пахнет кровью и позором с бойни…»)";"1910-1913";"художественная";"";"";"";"2002";"книга";"омонимия не снята";"";"16";"179";"Пахнет кровью и позором с бойни, Собака бесхвостая прижала осмеянный зад к столбу. Тюрьмы правильны и спокойны. Шляпки дамские с цветами в кружевном дымку.";"ee9e0f4e9e6ab14dbdba46860a9cfefe:2:3"
" нолоп сеЛ";"алпет";"Лес полон";"тепла";". ";"";"Е. Г. Гуро. Июнь  («Глубока, глубока синева…») (1910-1913)";"Е. Г. Гуро";"1877";"Июнь  («Глубока, глубока синева…»)";"1910-1913";"художественная";"";"";"";"2002";"книга";"омонимия не снята";"";"6";"27";"Глубока, глубока синева. Лес полон тепла. И хвоя повисла упоенная И чуть звенит от сна.";"1f64dd8cd3135dd94300c3a162307a94:2:2"
" анлоП";"алпет";"Полна";"тепла";", ";"И счастья, И упоения, И восторга.(1914)";"Е. Г. Гуро. Июнь  («Глубока, глубока синева…») (1910-1913)";"Е. Г. Гуро";"1877";"Июнь  («Глубока, глубока синева…»)";"1910-1913";"художественная";"";"";"";"2002";"книга";"омонимия не снята";"";"6";"27";"Полна тепла, И счастья, И упоения, И восторга.(1914)";"1f64dd8cd3135dd94300c3a162307a94:5:1"
" В АВТИЛОМ ";"ЙЫРЕС";"МОЛИТВА В";"СЕРЫЙ";" ";"ДЕНЬ";"Е. Г. Гуро. Молитва в серый день  («Пахнет нежно тиной, тиной…») (1910-1913)";"Е. Г. Гуро";"1877";"Молитва в серый день  («Пахнет нежно тиной, тиной…»)";"1910-1913";"художественная";"";"";"";"2002";"книга";"омонимия не снята";"";"9";"48";"МОЛИТВА В СЕРЫЙ ДЕНЬ Пахнет нежно тиной, тиной.";"2c4929dec4334b92c7cb3b3c0d8b4735:0:2"
" йынрев ежоБ";"йорес";"Боже верный";"серой";" ";"дюны, ты бережёшь твоих серых птичек";"Е. Г. Гуро. Молитва в серый день  («Пахнет нежно тиной, тиной…») (1910-1913)";"Е. Г. Гуро";"1877";"Молитва в серый день  («Пахнет нежно тиной, тиной…»)";"1910-1913";"художественная";"";"";"";"2002";"книга";"омонимия не снята";"";"9";"48";"Боже верный серой дюны, ты бережёшь твоих серых птичек на песке.";"2c4929dec4334b92c7cb3b3c0d8b4735:5:2"
" хиовт ьшёжереб ыт ,ынюд йорес йынрев";"хырес";"верный серой дюны, ты бережёшь твоих";"серых";" ";"птичек на песке.";"Е. Г. Гуро. Молитва в серый день  («Пахнет нежно тиной, тиной…») (1910-1913)";"Е. Г. Гуро";"1877";"Молитва в серый день  («Пахнет нежно тиной, тиной…»)";"1910-1913";"художественная";"";"";"";"2002";"книга";"омонимия не снята";"";"9";"48";"Боже верный серой дюны, ты бережёшь твоих серых птичек на песке.";"2c4929dec4334b92c7cb3b3c0d8b4735:5:7"
" И ИВБЮЛ АВОЛС ";"АЛПЕТ";"СЛОВА ЛЮБВИ И";"ТЕПЛА";" ";"";"Е. Г. Гуро. Слова любви и тепла  («У кота от лени и тепла разошлись ушки…») (1910-1913)";"Е. Г. Гуро";"1877";"Слова любви и тепла  («У кота от лени и тепла разошлись ушки…»)";"1910-1913";"художественная";"";"";"";"2002";"книга";"омонимия не снята";"";"11";"77";"СЛОВА ЛЮБВИ И ТЕПЛА";"5123f53beeca038e806457e2bfaf9c64:0:3"
" и инел то аток У";"алпет";"У кота от лени и";"тепла";" ";"разошлись ушки.";"Е. Г. Гуро. Слова любви и тепла  («У кота от лени и тепла разошлись ушки…») (1910-1913)";"Е. Г. Гуро";"1877";"Слова любви и тепла  («У кота от лени и тепла разошлись ушки…»)";"1910-1913";"художественная";"";"";"";"2002";"книга";"омонимия не снята";"";"11";"77";"У кота от лени и тепла разошлись ушки.";"5123f53beeca038e806457e2bfaf9c64:1:5"
" А[";"имылпёт";"[А";"тёплыми";" ";"словами потому касаюсь жизни, что как";"Е. Г. Гуро. Слова любви и тепла  («У кота от лени и тепла разошлись ушки…») (1910-1913)";"Е. Г. Гуро";"1877";"Слова любви и тепла  («У кота от лени и тепла разошлись ушки…»)";"1910-1913";"художественная";"";"";"";"2002";"книга";"омонимия не снята";"";"11";"77";"[А тёплыми словами потому касаюсь жизни, что как же иначе касаться раненого?";"5123f53beeca038e806457e2bfaf9c64:7:1"
" кат мавтсещус месв ,ястежак енМ ";"ондолох";"Мне кажется, всем существам так";"холодно";", ";"так холодно.";"Е. Г. Гуро. Слова любви и тепла  («У кота от лени и тепла разошлись ушки…») (1910-1913)";"Е. Г. Гуро";"1877";"Слова любви и тепла  («У кота от лени и тепла разошлись ушки…»)";"1910-1913";"художественная";"";"";"";"2002";"книга";"омонимия не снята";"";"11";"77";"Мне кажется, всем существам так холодно, так холодно.";"5123f53beeca038e806457e2bfaf9c64:8:5"
" кат ,ондолох кат мавтсещус месв ,ястежак";"ондолох";"кажется, всем существам так холодно, так";"холодно";".  ";"";"Е. Г. Гуро. Слова любви и тепла  («У кота от лени и тепла разошлись ушки…») (1910-1913)";"Е. Г. Гуро";"1877";"Слова любви и тепла  («У кота от лени и тепла разошлись ушки…»)";"1910-1913";"художественная";"";"";"";"2002";"книга";"омонимия не снята";"";"11";"77";"Мне кажется, всем существам так холодно, так холодно.";"5123f53beeca038e806457e2bfaf9c64:8:7"
" ";"йотолоЗ";"";"Золотой";" ";"луч запутался в прутиках и остался";"Е. Г. Гуро. «Золотой луч запутался в прутиках и остался надолго. Не торопится уйти…» (1909-1913)";"Е. Г. Гуро";"1877";"«Золотой луч запутался в прутиках и остался надолго. Не торопится уйти…»";"1909-1913";"художественная";"";"";"";"2002";"книга";"омонимия не снята";"";"2";"11";"Золотой луч запутался в прутиках и остался надолго.";"ee84d1555dba067276ee46a0351cf1e4:0:0"
" еытурк ,агенс огешвяатто зИ ";"еынреч";"Из оттаявшего снега, крутые";"черные";" ";"ребра лодок.";"Е. Г. Гуро. «Из оттаявшего снега, крутые черные ребра лодок…» (1909-1913)";"Е. Г. Гуро";"1877";"«Из оттаявшего снега, крутые черные ребра лодок…»";"1909-1913";"художественная";"";"";"";"2002";"книга";"омонимия не снята";"";"1";"7";"Из оттаявшего снега, крутые черные ребра лодок.";"df5aeb4307e0c12ecdf9bb4a01534a73:0:4"
" худзов марту оП ";"йылеб";"По утрам воздух";"белый";", ";"туманный от сжимающегося холода.";"Е. Г. Гуро. «По утрам воздух белый, туманный от сжимающегося холода…» (1909-1913)";"Е. Г. Гуро";"1877";"«По утрам воздух белый, туманный от сжимающегося холода…»";"1909-1913";"художественная";"";"";"";"2002";"книга";"омонимия не снята";"";"1";"8";"По утрам воздух белый, туманный от сжимающегося холода.";"76d4178a8a4a563048cfa7679ac48408:0:3"
" тижел но :одан ен ,етидж еН";"онйокопс";"Не ждите, не надо: он лежит";"спокойно";" ― ";"Это ничего.***";"Е. Г. Гуро. «Вот и лег утихший, хороший…» (1912)";"Е. Г. Гуро";"1877";"«Вот и лег утихший, хороший…»";"1912";"художественная";"";"";"";"2002";"книга";"омонимия не снята";"";"18";"146";"Не ждите, не надо: он лежит спокойно ― Это ничего.***";"e57637ecfc6da153bc428dfc697dce86:15:6"
"-онрокоп сач ,ееннесо орту в оН";"йынделб";"Но в утро осеннее, час покорно-";"бледный";", ";"Пусть узнают, жизнь кому, Как жил";"Е. Г. Гуро. «Вот и лег утихший, хороший…» (1912)";"Е. Г. Гуро";"1877";"«Вот и лег утихший, хороший…»";"1912";"художественная";"";"";"";"2002";"книга";"омонимия не снята";"";"18";"146";"Но в утро осеннее, час покорно-бледный, Пусть узнают, жизнь кому, Как жил на свете рыцарь бедный И ясным утром отошел ко сну.";"e57637ecfc6da153bc428dfc697dce86:16:6"
" жем обен еокьнелам :окшоко еокосыв еовс";"хынмет";"свое высокое окошко: маленькое небо меж";"темных";" ";"ветвей, никогда не обманула, ― ни в";"Е. Г. Гуро. Вдруг весеннее  («Земля дышала ивами в близкое небо…») (1912)";"Е. Г. Гуро";"1877";"Вдруг весеннее  («Земля дышала ивами в близкое небо…»)";"1912";"художественная";"";"";"";"2002";"книга";"омонимия не снята";"";"5";"55";"Верила в свое высокое окошко: маленькое небо меж темных ветвей, никогда не обманула, ― ни в чем не виновна, и вот она спит и дышит…";"ced2111609092d16e848fd46755c45fe:3:8"
" и";"олпет";"и";"тепло";".(1912)  ";"";"Е. Г. Гуро. Вдруг весеннее  («Земля дышала ивами в близкое небо…») (1912)";"Е. Г. Гуро";"1877";"Вдруг весеннее  («Земля дышала ивами в близкое небо…»)";"1912";"художественная";"";"";"";"2002";"книга";"омонимия не снята";"";"5";"55";"и тепло.(1912)";"ced2111609092d16e848fd46755c45fe:4:1"
" а ― ,ьлачеп ен ьлачеп И алшото";"йинис";"отошла И печаль не печаль, ― а";"синий";" ";"цветок.";"Е. Г. Гуро. Звенят кузнечики  («Звени, звени, моя осень…») (1912)";"Е. Г. Гуро";"1877";"Звенят кузнечики  («Звени, звени, моя осень…»)";"1912";"художественная";"";"";"";"2002";"книга";"омонимия не снята";"";"11";"120";"Знаю я, отчего сердце кончалося ― А кончина его не страшна ― Отчего печаль перегрустнулась и отошла И печаль не печаль, ― а синий цветок.";"5c987e3c18e6413f9096931b6f78c50d:3:20"
" зи тоВ";"огонсарк";"Вот из";"красного";" ";"уха мужчины вышло облако и часть";"Е. Г. Гуро. Финская мелодия  («Над нами, фрачными, корсетными, крахмальными…») (1912)";"Е. Г. Гуро";"1877";"Финская мелодия  («Над нами, фрачными, корсетными, крахмальными…»)";"1912";"художественная";"";"";"";"2002";"книга";"омонимия не снята";"";"37";"250";"Вот из красного уха мужчины вышло облако и часть леса, а женщина выпустила из головы сосны, а я дорогу и парня в валенках.";"7cd20b6aa8d827f810f92dec5c999dd0:5:2"
" липот ебет Я";"олпет";"Я тебе топил";"тепло";" ";"печку, а у тебя для моего";"Е. Г. Гуро. Финская мелодия  («Над нами, фрачными, корсетными, крахмальными…») (1912)";"Е. Г. Гуро";"1877";"Финская мелодия  («Над нами, фрачными, корсетными, крахмальными…»)";"1912";"художественная";"";"";"";"2002";"книга";"омонимия не снята";"";"37";"250";"Я тебе топил тепло печку, а у тебя для моего топорища руки малы.";"7cd20b6aa8d827f810f92dec5c999dd0:21:3"
" В ";"молеб";"В";"белом";" ";"зале, обиженном папиросами Комиссионеров, разбившихся по";"Е. Г. Гуро. «В белом зале, обиженном папиросами…» (1910)";"Е. Г. Гуро";"1877";"«В белом зале, обиженном папиросами…»";"1910";"художественная";"";"";"";"2002";"книга";"омонимия не снята";"";"10";"129";"В белом зале, обиженном папиросами Комиссионеров, разбившихся по столам: На стене распятая фреска, Обнаженная безучастным глазам.";"b77f3e1bab13bb7ecca51ad9fa4a1d03:0:1"
" йикелад дас ан ажохоп анО";"хылеБ";"Она похожа на сад далекий";"Белых";" ";"ангелов ― нет одна ― Как лишенная престола";"Е. Г. Гуро. «В белом зале, обиженном папиросами…» (1910)";"Е. Г. Гуро";"1877";"«В белом зале, обиженном папиросами…»";"1910";"художественная";"";"";"";"2002";"книга";"омонимия не снята";"";"10";"129";"Она похожа на сад далекий Белых ангелов ― нет одна ― Как лишенная престола царевна, Она будет молчать и она бледна.";"b77f3e1bab13bb7ecca51ad9fa4a1d03:1:5"
" ано и ьтачлом тедуб анО ,анверац";"анделб";"царевна, Она будет молчать и она";"бледна";".  ";"";"Е. Г. Гуро. «В белом зале, обиженном папиросами…» (1910)";"Е. Г. Гуро";"1877";"«В белом зале, обиженном папиросами…»";"1910";"художественная";"";"";"";"2002";"книга";"омонимия не снята";"";"10";"129";"Она похожа на сад далекий Белых ангелов ― нет одна ― Как лишенная престола царевна, Она будет молчать и она бледна.";"b77f3e1bab13bb7ecca51ad9fa4a1d03:1:18"
" в аксерФ теат отч ,ьтинмопсв одаН";"йонйефок";"Надо вспомнить, что тает Фреска в";"кофейной";", ";"И фонарь в переулке светит Как";"Е. Г. Гуро. «В белом зале, обиженном папиросами…» (1910)";"Е. Г. Гуро";"1877";"«В белом зале, обиженном папиросами…»";"1910";"художественная";"";"";"";"2002";"книга";"омонимия не снята";"";"10";"129";"Но тем, ― кто приходит сюда,― Сберечь жизни ― И представить их души в горницу Христа ― Надо вспомнить, что тает Фреска в кофейной, И фонарь в переулке светит Как звезда.(1910)";"b77f3e1bab13bb7ecca51ad9fa4a1d03:9:20"
" иледнерк в илИ";"еижыр";"Или в крендели";"рыжие";" ";"и веселые, Прутики в стеклянном небе";"Е. Г. Гуро. Ветер  («Радость летает на крыльях…») (1910)";"Е. Г. Гуро";"1877";"Ветер  («Радость летает на крыльях…»)";"1910";"художественная";"";"";"";"2002";"книга";"омонимия не снята";"";"11";"63";"Или в крендели рыжие и веселые, Прутики в стеклянном небе голые.";"b9c89684d2de9a0d98072598dfa793d3:5:3"
" ,еолат ретеВ";"еорес";"Ветер талое,";"серое";" ";"небо рвал, ветер по городу летал";"Е. Г. Гуро. «Говорил испуганный человек…» (1909)";"Е. Г. Гуро";"1877";"«Говорил испуганный человек…»";"1909";"художественная";"";"";"";"2002";"книга";"омонимия не снята";"";"19";"164";"Ветер талое, серое небо рвал, ветер по городу летал; уничтожал тупики, стены.";"41fd9f0b2357b2f418835492262c05f8:16:2"
" аз ьсалелпоП ,ажорд овилсурт ,яатибоп акночабос";"мылксут";"собачонка побитая, трусливо дрожа, Поплелась за";"тусклым";" ";"прохожим.";"Е. Г. Гуро. «Сильный, красивый, богатый…» (1909)";"Е. Г. Гуро";"1877";"«Сильный, красивый, богатый…»";"1909";"художественная";"";"";"";"2002";"книга";"омонимия не снята";"";"12";"72";"И тогда, как собачонка побитая, трусливо дрожа, Поплелась за тусклым прохожим.";"e1b17ba952bbd90e94fb8665c6408d80:10:9"
" хакур В";"яатолоз";"В руках";"золотая";" ";"арфа, на ней зелёные птички, на";"Е. Г. Гуро. Готическая миниатюра  («В пирном сводчатом зале…») (1909)";"Е. Г. Гуро";"1877";"Готическая миниатюра  («В пирном сводчатом зале…»)";"1909";"художественная";"";"";"";"2002";"книга";"омонимия не снята";"";"12";"142";"В руках золотая арфа, на ней зелёные птички, на платье его тёмносинем золоченые пчелки.";"80dbe400d0003d4a08219dcd68496a2d:2:2"
" йен ан ,афра яатолоз хакур В";"еынёлез";"В руках золотая арфа, на ней";"зелёные";" ";"птички, на платье его тёмносинем золоченые";"Е. Г. Гуро. Готическая миниатюра  («В пирном сводчатом зале…») (1909)";"Е. Г. Гуро";"1877";"Готическая миниатюра  («В пирном сводчатом зале…»)";"1909";"художественная";"";"";"";"2002";"книга";"омонимия не снята";"";"12";"142";"В руках золотая арфа, на ней зелёные птички, на платье его тёмносинем золоченые пчелки.";"80dbe400d0003d4a08219dcd68496a2d:2:6"
"-еннесев онбодоп и ,ирацыр еындорогалб могурк";"мылеб";"кругом благородные рыцари, и подобно весенне-";"белым";" ";"цветам красоты нежнейшей, замирая, внимают дамы";"Е. Г. Гуро. Готическая миниатюра  («В пирном сводчатом зале…») (1909)";"Е. Г. Гуро";"1877";"Готическая миниатюра  («В пирном сводчатом зале…»)";"1909";"художественная";"";"";"";"2002";"книга";"омонимия не снята";"";"12";"142";"И, цвет христианских держав, кругом благородные рыцари, и подобно весенне-белым цветам красоты нежнейшей, замирая, внимают дамы, сжав лилейно-тонкие руки.";"80dbe400d0003d4a08219dcd68496a2d:3:10"
" ьсилсеноп :мануртс миктуч оп тидоворп нО";"еылеб";"Он проводит по чутким струнам: понеслись";"белые";" ";"кони.";"Е. Г. Гуро. Готическая миниатюра  («В пирном сводчатом зале…») (1909)";"Е. Г. Гуро";"1877";"Готическая миниатюра  («В пирном сводчатом зале…»)";"1909";"художественная";"";"";"";"2002";"книга";"омонимия не снята";"";"12";"142";"Он проводит по чутким струнам: понеслись белые кони.";"80dbe400d0003d4a08219dcd68496a2d:4:6"
" оп тидоворп нО";"мылтевс";"Он проводит по";"светлым";" ";"струнам: расцвели красные розы.";"Е. Г. Гуро. Готическая миниатюра  («В пирном сводчатом зале…») (1909)";"Е. Г. Гуро";"1877";"Готическая миниатюра  («В пирном сводчатом зале…»)";"1909";"художественная";"";"";"";"2002";"книга";"омонимия не снята";"";"12";"142";"Он проводит по светлым струнам: расцвели красные розы.";"80dbe400d0003d4a08219dcd68496a2d:5:3"
" илевцсар :мануртс мылтевс оп тидоворп нО";"еынсарк";"Он проводит по светлым струнам: расцвели";"красные";" ";"розы.";"Е. Г. Гуро. Готическая миниатюра  («В пирном сводчатом зале…») (1909)";"Е. Г. Гуро";"1877";"Готическая миниатюра  («В пирном сводчатом зале…»)";"1909";"художественная";"";"";"";"2002";"книга";"омонимия не снята";"";"12";"142";"Он проводит по светлым струнам: расцвели красные розы.";"80dbe400d0003d4a08219dcd68496a2d:5:6"
" ичон ьдерс и ― ,лепаз нО";"йенис";"Он запел, ― и средь ночи";"синей";" ";"родилось весеннее утро.";"Е. Г. Гуро. Готическая миниатюра  («В пирном сводчатом зале…») (1909)";"Е. Г. Гуро";"1877";"Готическая миниатюра  («В пирном сводчатом зале…»)";"1909";"художественная";"";"";"";"2002";"книга";"омонимия не снята";"";"12";"142";"Он запел, ― и средь ночи синей родилось весеннее утро.";"80dbe400d0003d4a08219dcd68496a2d:8:5"
