"Reversed left context";"Reversed center";"Left context";"Center";"Punct";"Right context";"Title";"Author";"Birthday";"Header";"Created";"Sphere";"Type";"Topic";"Publication";"Publ_year";"Medium";"Ambiguity";"Audience_age";"Sentences";"Words";"Full context";"Example source"
" йом ,ароН ,акженсолеБ яом ,ароН";"йынженс";"Нора, моя Белоснежка, Нора, мой";"снежный";" ";"цветик, Мой облачный барашек.";"Е. Г. Гуро. «Нора, моя Белоснежка…» (1913)";"Е. Г. Гуро";"1877";"«Нора, моя Белоснежка…»";"1913";"художественная";"";"";"";"2002";"книга";"омонимия не снята";"";"5";"73";"Нора, моя Белоснежка, Нора, мой снежный цветик, Мой облачный барашек.";"93e5615e886d0e9177972c75c14d5e23:1:5"
" ,ыт хО";"яанженс";"Ох ты,";"снежная";" ";"королева, Облачное руно, Нежное перышко, Ты";"Е. Г. Гуро. «Нора, моя Белоснежка…» (1913)";"Е. Г. Гуро";"1877";"«Нора, моя Белоснежка…»";"1913";"художественная";"";"";"";"2002";"книга";"омонимия не снята";"";"5";"73";"Ох ты, снежная королева, Облачное руно, Нежное перышко, Ты, горный эдельвейс, Нора, моя мерцающая волна, Нора, мой сладко мерцающий сон!";"93e5615e886d0e9177972c75c14d5e23:2:2"
" еоМ";"еонженс";"Мое";"снежное";" ";"облако, Моя снежная сказка, Эдельвейс с";"Е. Г. Гуро. «Нора, моя Белоснежка…» (1913)";"Е. Г. Гуро";"1877";"«Нора, моя Белоснежка…»";"1913";"художественная";"";"";"";"2002";"книга";"омонимия не снята";"";"5";"73";"Мое снежное облако, Моя снежная сказка, Эдельвейс с горы, Много милее тебя!(1913)";"93e5615e886d0e9177972c75c14d5e23:4:1"
" яоМ ,окалбо еонженс еоМ";"яанженс";"Мое снежное облако, Моя";"снежная";" ";"сказка, Эдельвейс с горы, Много милее";"Е. Г. Гуро. «Нора, моя Белоснежка…» (1913)";"Е. Г. Гуро";"1877";"«Нора, моя Белоснежка…»";"1913";"художественная";"";"";"";"2002";"книга";"омонимия не снята";"";"5";"73";"Мое снежное облако, Моя снежная сказка, Эдельвейс с горы, Много милее тебя!(1913)";"93e5615e886d0e9177972c75c14d5e23:4:4"
" еинеживд ,иксод мецнлос миннесев дан илхитС";"мынсарк";"Стихли над весенним солнцем доски, движение";"красным";" ";"воскликом мчалось.";"Е. Г. Гуро. «Стихли над весенним солнцем доски…» (1913)";"Е. Г. Гуро";"1877";"«Стихли над весенним солнцем доски…»";"1913";"художественная";"";"";"";"2002";"книга";"омонимия не снята";"";"7";"53";"Стихли над весенним солнцем доски, движение красным воскликом мчалось.";"09a5a3b1df666e48d82f0da0b2e91851:0:6"
" с икшувед И ,доваз йонвип ииднялруК";"имынреч";"Курляндии пивной завод, И девушки с";"черными";" ";"косами.(1913)";"Е. Г. Гуро. «Стихли над весенним солнцем доски…» (1913)";"Е. Г. Гуро";"1877";"«Стихли над весенним солнцем доски…»";"1913";"художественная";"";"";"";"2002";"книга";"омонимия не снята";"";"7";"53";"В Курляндии пивной завод, И девушки с черными косами.(1913)";"09a5a3b1df666e48d82f0da0b2e91851:6:7"
" ан тижеЛ зор хиннесев конеВ";"мовозор";"Венок весенних роз Лежит на";"розовом";" ";"озере.";"Е. Г. Гуро. Из сладостных  («Венок весенних роз…») (1913)";"Е. Г. Гуро";"1877";"Из сладостных  («Венок весенних роз…»)";"1913";"художественная";"";"";"";"2002";"книга";"омонимия не снята";"";"17";"123";"Венок весенних роз Лежит на розовом озере.";"0f526df5ab2fdee8866bcc157e7e638a:2:5"
" яанжучмеж ьтсонженсолеБ иклаиф иледаз мофйелШ";"оговолиЛ";"Шлейфом задели фиалки Белоснежность жемчужная";"Лилового";" ";"бархата на лугу Зелени майской.";"Е. Г. Гуро. Из сладостных  («Венок весенних роз…») (1913)";"Е. Г. Гуро";"1877";"Из сладостных  («Венок весенних роз…»)";"1913";"художественная";"";"";"";"2002";"книга";"омонимия не снята";"";"17";"123";"Шлейфом задели фиалки Белоснежность жемчужная Лилового бархата на лугу Зелени майской.";"0f526df5ab2fdee8866bcc157e7e638a:4:5"
" янок С";"огоноров";"С коня";"вороного";" ";"спрыгнул, Склонился, пока повяжет Нежный узор";"Е. Г. Гуро. Из сладостных  («Венок весенних роз…») (1913)";"Е. Г. Гуро";"1877";"Из сладостных  («Венок весенних роз…»)";"1913";"художественная";"";"";"";"2002";"книга";"омонимия не снята";"";"17";"123";"С коня вороного спрыгнул, Склонился, пока повяжет Нежный узор «Эдита» Бисером или шелком.";"0f526df5ab2fdee8866bcc157e7e638a:7:2"
" ирузал в тушялп ытраднатШ";"йортсеП";"Штандарты пляшут в лазури";"Пестрой";" ";"улыбкой.";"Е. Г. Гуро. Из сладостных  («Венок весенних роз…») (1913)";"Е. Г. Гуро";"1877";"Из сладостных  («Венок весенних роз…»)";"1913";"художественная";"";"";"";"2002";"книга";"омонимия не снята";"";"17";"123";"Лес копий истомленный, Точно лес мачт победных. Штандарты пляшут в лазури Пестрой улыбкой. Все глаза устремились вперед Чья-то рука в волнении Машет платочком.";"0f526df5ab2fdee8866bcc157e7e638a:14:4"
" юьлып ынера С ,могзив с яьпок";"йонсарк";"копья с визгом, С арены пылью";"красной";" ";"закрылись ложи(1913)";"Е. Г. Гуро. Из сладостных  («Венок весенних роз…») (1913)";"Е. Г. Гуро";"1877";"Из сладостных  («Венок весенних роз…»)";"1913";"художественная";"";"";"";"2002";"книга";"омонимия не снята";"";"17";"123";"Помчались единороги в попонах большеглазых, Опущены забрала, лязгнули копья с визгом, С арены пылью красной закрылись ложи(1913)";"0f526df5ab2fdee8866bcc157e7e638a:16:14"
" зеб йогород йоннилд тудерб отдуб ,ьнзиж";"алпет";"жизнь, будто бредут длинной дорогой без";"тепла";".  ";"";"Е. Г. Гуро. Моему брату  («Помолись за меня — ты…») (1913)";"Е. Г. Гуро";"1877";"Моему брату  («Помолись за меня — ты…»)";"1913";"художественная";"";"";"";"2002";"книга";"омонимия не снята";"";"15";"142";"Также я думаю о тех, кто на свете в чудаках, кто за это в обиде у людей, позасунуты в уголках ― озябшие без ласки, плетут неумелую жизнь, будто бредут длинной дорогой без тепла.";"bbf2f6e64c4cf92b3b576d4e4cb8eef2:8:31"
" ынежасан едг ,икинтевц еижуч в ьсиледялгаЗ";"еикьневозор";"Загляделись в чужие цветники, где насажены";"розовенькие";" ";"и лиловенькие цветы для своих, для";"Е. Г. Гуро. Моему брату  («Помолись за меня — ты…») (1913)";"Е. Г. Гуро";"1877";"Моему брату  («Помолись за меня — ты…»)";"1913";"художественная";"";"";"";"2002";"книга";"омонимия не снята";"";"15";"142";"Загляделись в чужие цветники, где насажены розовенькие и лиловенькие цветы для своих, для домашних.";"bbf2f6e64c4cf92b3b576d4e4cb8eef2:9:6"
" ером ан я уребдоп от-икченед";"еолтевс";"денечки-то подберу я на море";"светлое";" ";"за ними побегу.";"Е. Г. Гуро. Шалопай  («Ах, деньки деньки маются!..») (1913)";"Е. Г. Гуро";"1877";"Шалопай  («Ах, деньки деньки маются!..»)";"1913";"художественная";"";"";"";"2002";"книга";"омонимия не снята";"";"15";"110";"Мама, мама, мамочка ― Не сердись ― я на днях денечки-то подберу я на море светлое за ними побегу.";"e0403c67b17f0698889e71ae86856ae4:7:14"
" йеом лащебо емам хи Я";"йоворус";"Я их маме обещал моей";"суровой";" ";"Моя мама строгая; ― точь-в-точь я, как";"Е. Г. Гуро. Шалопай  («Ах, деньки деньки маются!..») (1913)";"Е. Г. Гуро";"1877";"Шалопай  («Ах, деньки деньки маются!..»)";"1913";"художественная";"";"";"";"2002";"книга";"омонимия не снята";"";"15";"110";"Я их маме обещал моей суровой Моя мама строгая; ― точь-в-точь я, как день ― она как ночь!………………………………….";"e0403c67b17f0698889e71ae86856ae4:9:5"
" С";"йонсарк";"С";"красной";" ";"да полосочкой, ― ходкая, мигнуть.";"Е. Г. Гуро. [Лодочка]  («У него ли рыбочка…») (1910-1913)";"Е. Г. Гуро";"1877";"[Лодочка]  («У него ли рыбочка…»)";"1910-1913";"художественная";"";"";"";"2002";"книга";"омонимия не снята";"";"13";"65";"Рыбка моя, лодочка, не посмей тонуть. С красной да полосочкой, ― ходкая, мигнуть. Хор";"5238d6ac1aa59f14d557c4f8f3ab9808:5:1"
" медЖ ,йоньлетимот емьт ов медж ябет";"алпет";"тебя ждем во тьме томительной, Ждем";"тепла";" ";"твоей любви…";"Е. Г. Гуро. «Возлюбив боль поругания…» (1910-1913)";"Е. Г. Гуро";"1877";"«Возлюбив боль поругания…»";"1910-1913";"художественная";"";"";"";"2002";"книга";"омонимия не снята";"";"10";"99";"Мы все тебя ждем во тьме томительной, Ждем тепла твоей любви…";"cfcc0fe64503b93bb1025d926408e294:6:8"
" у ,акчодол ,ясйачак ,йачак ыТ";"йоначсеп";"Ты качай, качайся, лодочка, у";"песчаной";" ";"полосы, за тобой змейки весёлые, отраженья";"Е. Г. Гуро. «Выплывали в море упоенное…» (1910-1913)";"Е. Г. Гуро";"1877";"«Выплывали в море упоенное…»";"1910-1913";"художественная";"";"";"";"2002";"книга";"омонимия не снята";"";"8";"51";"Ты качай, качайся, лодочка, у песчаной полосы, за тобой змейки весёлые, отраженья зацвели.";"2b0a1159e9428d7d262958c0e6fa07c9:5:5"
" ,могротсов илевцаЗ";"мотолоз";"Зацвели восторгом,";"золотом";", ";"звонко-красной полосой.";"Е. Г. Гуро. «Выплывали в море упоенное…» (1910-1913)";"Е. Г. Гуро";"1877";"«Выплывали в море упоенное…»";"1910-1913";"художественная";"";"";"";"2002";"книга";"омонимия не снята";"";"8";"51";"Зацвели восторгом, золотом, звонко-красной полосой. за меня резвися, лодочка, шалопаю велят домой.(1914)";"2b0a1159e9428d7d262958c0e6fa07c9:6:2"
"-окновз ,мотолоз ,могротсов илевцаЗ";"йонсарк";"Зацвели восторгом, золотом, звонко-";"красной";" ";"полосой.";"Е. Г. Гуро. «Выплывали в море упоенное…» (1910-1913)";"Е. Г. Гуро";"1877";"«Выплывали в море упоенное…»";"1910-1913";"художественная";"";"";"";"2002";"книга";"омонимия не снята";"";"8";"51";"Зацвели восторгом, золотом, звонко-красной полосой. за меня резвися, лодочка, шалопаю велят домой.(1914)";"2b0a1159e9428d7d262958c0e6fa07c9:6:4"
" ,йынтупоп ретев ябет ялд гоБ йаД";"йеруБ";"Дай Бог для тебя ветер попутный,";"Бурей";" ";"разбиты они.";"Е. Г. Гуро. «Гордо иду я в пути…» (1910-1913)";"Е. Г. Гуро";"1877";"«Гордо иду я в пути…»";"1910-1913";"художественная";"";"";"";"2002";"книга";"омонимия не снята";"";"9";"42";"Дай Бог для тебя ветер попутный, Бурей разбиты они.";"45326f3ceaa00afc2a7ad4d81c9209fa:4:6"
"";"йынрёЧ";"";"Чёрный";" ";"грозный лес, Лес стоит.";"Е. Г. Гуро. «Звёздочка высока…» (1910-1913)";"Е. Г. Гуро";"1877";"«Звёздочка высока…»";"1910-1913";"художественная";"";"";"";"2002";"книга";"омонимия не снята";"";"8";"54";"Над грозным лесом Она взошла. Чёрный грозный лес, Лес стоит.";"a6136ae70f165818fd8042fcc8d43700:3:0"
" йом В ― :тировоГ";"йынмёт";"Говорит: ― В мой";"тёмный";" ";"знак, Мой тёмный знак не вступай!";"Е. Г. Гуро. «Звёздочка высока…» (1910-1913)";"Е. Г. Гуро";"1877";"«Звёздочка высока…»";"1910-1913";"художественная";"";"";"";"2002";"книга";"омонимия не снята";"";"8";"54";"Говорит: ― В мой тёмный знак, Мой тёмный знак не вступай!";"a6136ae70f165818fd8042fcc8d43700:4:3"
" йоМ ,канз йынмёт йом В ― :тировоГ";"йынмёт";"Говорит: ― В мой тёмный знак, Мой";"тёмный";" ";"знак не вступай!";"Е. Г. Гуро. «Звёздочка высока…» (1910-1913)";"Е. Г. Гуро";"1877";"«Звёздочка высока…»";"1910-1913";"художественная";"";"";"";"2002";"книга";"омонимия не снята";"";"8";"54";"Говорит: ― В мой тёмный знак, Мой тёмный знак не вступай!";"a6136ae70f165818fd8042fcc8d43700:4:6"
" йокат коретев адгоК ";"йылпёт";"Когда ветерок такой";"тёплый";", ";"так его хочется собрать в горсточку";"Е. Г. Гуро. «Когда ветерок такой тёплый…» (1910-1913)";"Е. Г. Гуро";"1877";"«Когда ветерок такой тёплый…»";"1910-1913";"художественная";"";"";"";"2002";"книга";"омонимия не снята";"";"1";"13";"Когда ветерок такой тёплый, так его хочется собрать в горсточку, ― ветерок мой ветерок…";"c5129e9e8beb85f609e555bd13a13889:0:3"
" онжен ястивонатС ,икчотсал тюатеЛ";"мывозор";"Летают ласточки, Становится нежно";"розовым";". ";"";"Е. Г. Гуро. «Море, плавно и блеско…» (1910-1913)";"Е. Г. Гуро";"1877";"«Море, плавно и блеско…»";"1910-1913";"художественная";"";"";"";"2002";"книга";"омонимия не снята";"";"8";"39";"Море, плавно и блеско. Летают ласточки, Становится нежно розовым. Мокнет чалочка, Плывёт рыбалочка, Летогон, летогон, Скалочка!";"43b5673af4174f54d8c6a400f00b703d:1:4"
" ынавосираН ";"еытлеж";"Нарисованы";"желтые";" ";"быки.";"Е. Г. Гуро. «Нарисованы желтые быки. Закоптелые, пропыленные…» (1910-1913)";"Е. Г. Гуро";"1877";"«Нарисованы желтые быки. Закоптелые, пропыленные…»";"1910-1913";"художественная";"";"";"";"2002";"книга";"омонимия не снята";"";"2";"5";"Нарисованы желтые быки.  Закоптелые, пропыленные.";"a54ca1b3b26198ab1207fe9d76a694e2:0:1"
" зи ьсинреВ";"огенис";"Вернись из";"синего";" ";"неба, светлый огонь.";"Е. Г. Гуро. «Охвачена осенью осинка…» (1910-1913)";"Е. Г. Гуро";"1877";"«Охвачена осенью осинка…»";"1910-1913";"художественная";"";"";"";"2002";"книга";"омонимия не снята";"";"6";"29";"Страшно за её душу, С восторгом молю ― вернись. Вернись из синего неба, светлый огонь. Плачу я о тебе, ― о тебе.(1914)";"e7cb049197abfa7a53fbcfe97ce43ae8:4:2"
" ,абен огенис зи ьсинреВ";"йылтевс";"Вернись из синего неба,";"светлый";" ";"огонь.";"Е. Г. Гуро. «Охвачена осенью осинка…» (1910-1913)";"Е. Г. Гуро";"1877";"«Охвачена осенью осинка…»";"1910-1913";"художественная";"";"";"";"2002";"книга";"омонимия не снята";"";"6";"29";"Страшно за её душу, С восторгом молю ― вернись. Вернись из синего неба, светлый огонь. Плачу я о тебе, ― о тебе.(1914)";"e7cb049197abfa7a53fbcfe97ce43ae8:4:4"
" сел янем аз ьтсуп ― ,унатсв ен";"йотолоз";"не встану, ― пусть за меня лес";"золотой";" ";"стоит, ― Лес золотой, Я июньский поденщик";"Е. Г. Гуро. «Пески, досочки…» (1910-1913)";"Е. Г. Гуро";"1877";"«Пески, досочки…»";"1910-1913";"художественная";"";"";"";"2002";"книга";"омонимия не снята";"";"8";"65";"― Шалопай летний, Стой, Юн Июньский, Нет, не встану, ― пусть за меня лес золотой стоит, ― Лес золотой, Я июньский поденщик, У меня плечи ― сила, За плечами широкий мир.";"c58f1fe00e5a3f394e0fb248aa2971d2:5:12"
" сеЛ ― ,тиотс йотолоз сел янем аз";"йотолоз";"за меня лес золотой стоит, ― Лес";"золотой";", ";"Я июньский поденщик, У меня плечи";"Е. Г. Гуро. «Пески, досочки…» (1910-1913)";"Е. Г. Гуро";"1877";"«Пески, досочки…»";"1910-1913";"художественная";"";"";"";"2002";"книга";"омонимия не снята";"";"8";"65";"― Шалопай летний, Стой, Юн Июньский, Нет, не встану, ― пусть за меня лес золотой стоит, ― Лес золотой, Я июньский поденщик, У меня плечи ― сила, За плечами широкий мир.";"c58f1fe00e5a3f394e0fb248aa2971d2:5:15"
" ястюавевзаР ";"еынелез";"Развеваются";"зеленые";" ";"кудри на небе.";"Е. Г. Гуро. «Развеваются зеленые кудри на небе…» (1910-1913)";"Е. Г. Гуро";"1877";"«Развеваются зеленые кудри на небе…»";"1910-1913";"художественная";"";"";"";"2002";"книга";"омонимия не снята";"";"";"19";"Развеваются зеленые кудри на небе. Небо смеется.";"6097667736bf73e4d9f5a1451531f305:0:1"
" в ястущелп ,вокотшгалф хыдрог с ястяуртс";"мобулог";"струятся с гордых флагштоков, плещутся в";"голубом";" ";"ветре.(1914)";"Е. Г. Гуро. «Развеваются зеленые кудри на небе…» (1910-1913)";"Е. Г. Гуро";"1877";"«Развеваются зеленые кудри на небе…»";"1910-1913";"художественная";"";"";"";"2002";"книга";"омонимия не снята";"";"";"19";"Мчатся флаги на дачах, струятся с гордых флагштоков, плещутся в голубом ветре.(1914)";"6097667736bf73e4d9f5a1451531f305:2:10"
" и вогереб хытыбаз У ,киндасилоп яслилавс";"оголтевс";"свалился полисадник, У забытых берегов и";"светлого";" ";"столика, ― рай неизвестный, кем-то одушевлённый.";"Е. Г. Гуро. «Струнной арфой…» (1910-1913)";"Е. Г. Гуро";"1877";"«Струнной арфой…»";"1910-1913";"художественная";"";"";"";"2002";"книга";"омонимия не снята";"";"";"61";"Струнной арфой Касались сосны, где свалился полисадник, У забытых берегов и светлого столика, ― рай неизвестный, кем-то одушевлённый.";"e542f10a4420bc091c5db6339d1a1deb:0:11"
" к теателу оге ашуд ,тёнсаз а";"мылтевс";"а заснёт, душа его улетает к";"светлым";" ";"источникам и в серебряной ряби веселится";"Е. Г. Гуро. «Струнной арфой…» (1910-1913)";"Е. Г. Гуро";"1877";"«Струнной арфой…»";"1910-1913";"художественная";"";"";"";"2002";"книга";"омонимия не снята";"";"";"61";"Пусть к ней придёт вдумчивый, сосредоточенный, кто умеет любить, не знаю кого, ждать, ― не знаю чего, а заснёт, душа его улетает к светлым источникам и в серебряной ряби веселится она.(1914)";"e542f10a4420bc091c5db6339d1a1deb:2:22"
" зИ";"хытлеж";"Из";"желтых";" ";"скуластых времен Радугой Возрождения Перекинулась улыбка";"Е. Г. Гуро. Василий Каменский  («Чарн-чаллы-ай…») (1910-1913)";"Е. Г. Гуро";"1877";"Василий Каменский  («Чарн-чаллы-ай…»)";"1910-1913";"художественная";"";"";"";"2002";"книга";"омонимия не снята";"";"20";"86";"Из желтых скуластых времен Радугой Возрождения Перекинулась улыбка ушкуйника И костлявой шеи местный загар.";"7155987b3d381dece12c28ac7d9e000c:3:1"
" ырвок еихит хамераг В";"имынновреЧ";"В гаремах тихие ковры";"Червонными";" ";"шелками Чуть обвито тело, Как пропасть";"Е. Г. Гуро. Василий Каменский  («Чарн-чаллы-ай…») (1910-1913)";"Е. Г. Гуро";"1877";"Василий Каменский  («Чарн-чаллы-ай…»)";"1910-1913";"художественная";"";"";"";"2002";"книга";"омонимия не снята";"";"20";"86";"В гаремах тихие ковры Червонными шелками Чуть обвито тело, Как пропасть ― смоль волос.";"7155987b3d381dece12c28ac7d9e000c:7:4"
